Unnamed: 0,Product,Review_Summary,Rating
46158,"Atomberg Renesa 1200 mm BLDC Motor with Remote 3 Blade Ceiling Fan  (Ivory & Black, Pack of 1)",Don't order any device from flipkart which needs installation. Use less team working in flipkart.you will be regret for all electrical and electronics devices if you order from flipkart. No one is responding after making so many calls,1
46159,"Atomberg Renesa 1200 mm BLDC Motor with Remote 3 Blade Ceiling Fan  (Ivory & Black, Pack of 1)",Go for it .,5
46160,"Atomberg Renesa 1200 mm BLDC Motor with Remote 3 Blade Ceiling Fan  (Ivory & Black, Pack of 1)","Great air flow , continue 8 hours run 0.2unit shows as meter, noiseless motor",5
46161,"Atomberg Renesa 1200 mm BLDC Motor with Remote 3 Blade Ceiling Fan  (Ivory & Black, Pack of 1)",Making abnormal sound in a week,1
46162,"Atomberg Renesa 1200 mm BLDC Motor with Remote 3 Blade Ceiling Fan  (Ivory & Black, Pack of 1)",Making abnormal sound in a week,1
46163,"Atomberg Renesa 1200 mm BLDC Motor with Remote 3 Blade Ceiling Fan  (Ivory & Black, Pack of 1)",Easy to install and good air flow. Easy to operate. Will update my review after usage.,5
46164,"Atomberg Renesa 1200 mm BLDC Motor with Remote 3 Blade Ceiling Fan  (Ivory & Black, Pack of 1)",Best product in all parameters,5
46165,"Atomberg Renesa 1200 mm BLDC Motor with Remote 3 Blade Ceiling Fan  (Ivory & Black, Pack of 1)",Super😆😆❤❤,5
46166,"Atomberg Renesa 1200 mm BLDC Motor with Remote 3 Blade Ceiling Fan  (Ivory & Black, Pack of 1)","Noise from fan. Mechanical rubbing noise. Electrician says product is defective. After removal and examination, there is a play between base unit with coils and another component which is not a full circle.",1
46167,"Atomberg Renesa 1200 mm BLDC Motor with Remote 3 Blade Ceiling Fan  (Ivory & Black, Pack of 1)","Value for money, first come in my mind is the premium look , wind is too cool compre my old fan 👍🏻👍🏻👍🏻👍🏻",5
46168,"Atomberg Renesa 1200 mm BLDC Motor with Remote 3 Blade Ceiling Fan  (Ivory & Black, Pack of 1)",Fan look and quality is good. Wind delivery is very good and speed of the fan is  more then normal fan. And buttons of remote glow in dark.,5
46169,"Atomberg Renesa 1200 mm BLDC Motor with Remote 3 Blade Ceiling Fan  (Ivory & Black, Pack of 1)",Not working after one day. Atomberg support told me they will replace the moter. Now its two week still I didn't get new moter. I am not recommending this fan.,1
46170,"Atomberg Renesa 1200 mm BLDC Motor with Remote 3 Blade Ceiling Fan  (Ivory & Black, Pack of 1)","Great fan if using along with AC.Pro: 1 Super efficient.         2 No noise even under inverter use Cons: 1 Less air when compared to regular fans.            2 If you lose remote you cannot control fan speed            3 Hidden Terms & Condition for warranty where customer                will have to pay for removal , installation & courier charges               involved in repair.",4
46171,"Atomberg Renesa 1200 mm BLDC Motor with Remote 3 Blade Ceiling Fan  (Ivory & Black, Pack of 1)","very nice fan low noise and look amazing, but i recommend it for small room. because size of fan is smaller then other 1200mm blade.",5
46172,"Atomberg Renesa 1200 mm BLDC Motor with Remote 3 Blade Ceiling Fan  (Ivory & Black, Pack of 1)","Sound is started from the fan after 10 days. If there is no sound, then it's good.",1
46173,"Atomberg Renesa 1200 mm BLDC Motor with Remote 3 Blade Ceiling Fan  (Ivory & Black, Pack of 1)",All the Features - Remote - Energy Saving is Good but the air flow is not.It's air delivery at max speed is almost the same as the fans costing 1400-1500 rupees.Buy only if you need for Extra features not for air flow or cooling.,3
46174,"Atomberg Renesa 1200 mm BLDC Motor with Remote 3 Blade Ceiling Fan  (Ivory & Black, Pack of 1)","After seeing all the reviews I have bought this fan, but this fan is not synching with remote properly and the fan get stop while running in between and restart by itself. And the fan is producing some sound while rotating. But the fan air is good. Had much expectations which didn't met, even the remote is not functioning properly",1
46175,"Atomberg Renesa 1200 mm BLDC Motor with Remote 3 Blade Ceiling Fan  (Ivory & Black, Pack of 1)","Simple sleek design, amazing performance &more energy saving 😊",4
46176,"Atomberg Renesa 1200 mm BLDC Motor with Remote 3 Blade Ceiling Fan  (Ivory & Black, Pack of 1)",Very good product i am fully satisfied,5
46177,"Atomberg Renesa 1200 mm BLDC Motor with Remote 3 Blade Ceiling Fan  (Ivory & Black, Pack of 1)",Super fan,5
46178,"Atomberg Renesa 1200 mm BLDC Motor with Remote 3 Blade Ceiling Fan  (Ivory & Black, Pack of 1)",nice working and disign design..,5
46179,"Atomberg Renesa 1200 mm BLDC Motor with Remote 3 Blade Ceiling Fan  (Ivory & Black, Pack of 1)",Super Fan..,5
46180,"Atomberg Renesa 1200 mm BLDC Motor with Remote 3 Blade Ceiling Fan  (Ivory & Black, Pack of 1)",looks superb..good perfomancehappy with the product,5
46181,"Atomberg Renesa 1200 mm BLDC Motor with Remote 3 Blade Ceiling Fan  (Ivory & Black, Pack of 1)",It's my third renesa fan from atemberg.. first one and second one i bought one year back..both are still working good..third one i bought last month i have noticed some problems from beginning...RPM is little lower than old one.. just after one month it's stoped working and got some abnormal sound from motor..i think new renasa models have some quality degradation happened.. any way I reported to atemberg and immediately they have replaced the motor and it's well now..i give 5 star this time ...,5
46182,"Atomberg Renesa 1200 mm BLDC Motor with Remote 3 Blade Ceiling Fan  (Ivory & Black, Pack of 1)",as usual... amazing..this is my 6th purchase.. no complaints.. super air delivery.. almost nil noise..thanks,5
46183,"Atomberg Renesa 1200 mm BLDC Motor with Remote 3 Blade Ceiling Fan  (Ivory & Black, Pack of 1)",Defective bearing making a lot of noise. Flipkart was unable to provide a replacement as they lost the replacement item on the way. Just as expected from flipkart.Now I have to use the noise fan as Flipkart is unable to provide any other replacement,2
46184,"Atomberg Renesa 1200 mm BLDC Motor with Remote 3 Blade Ceiling Fan  (Ivory & Black, Pack of 1)",Superb,5
46185,"Atomberg Renesa 1200 mm BLDC Motor with Remote 3 Blade Ceiling Fan  (Ivory & Black, Pack of 1)",Amazing product..,5
46186,"Atomberg Renesa 1200 mm BLDC Motor with Remote 3 Blade Ceiling Fan  (Ivory & Black, Pack of 1)",Using for last few weeks . Light weight but the air blow is better than conventional fan.,5
46187,"Atomberg Renesa 1200 mm BLDC Motor with Remote 3 Blade Ceiling Fan  (Ivory & Black, Pack of 1)",Product quality is too good.This is my 3rd Atomberg fan .,5
46188,"Atomberg Renesa 1200 mm BLDC Motor with Remote 3 Blade Ceiling Fan  (Ivory & Black, Pack of 1)",Best,5
46189,"Atomberg Renesa 1200 mm BLDC Motor with Remote 3 Blade Ceiling Fan  (Ivory & Black, Pack of 1)","Got it today and fixed..so far too good, the fan with remote control and consumes less power. Thanks for the technology and thanks to flipcart which has sent the fan well ahead of the expected time.",4
46190,"Atomberg Renesa 1200 mm BLDC Motor with Remote 3 Blade Ceiling Fan  (Ivory & Black, Pack of 1)",After 2 months fan not working waste product 😡😡😡😡,1
46191,"Atomberg Renesa 1200 mm BLDC Motor with Remote 3 Blade Ceiling Fan  (Ivory & Black, Pack of 1)",Fan is delivered in good condition. quality of build and the features are good.Main issue is the on board regulator cannot be used due to the remote control given with the fan. Always we have to keep the regulator at maximum speed and use only remote.Fan makes noise in high speed.,3
46192,"Atomberg Renesa 1200 mm BLDC Motor with Remote 3 Blade Ceiling Fan  (Ivory & Black, Pack of 1)",Good product 👌👌👌,5
46193,"Atomberg Renesa 1200 mm BLDC Motor with Remote 3 Blade Ceiling Fan  (Ivory & Black, Pack of 1)",Very happy with the product. Air spread is very even.,5
46194,"Atomberg Renesa 1200 mm BLDC Motor with Remote 3 Blade Ceiling Fan  (Ivory & Black, Pack of 1)",Good product and very nice,5
46195,"Atomberg Renesa 1200 mm BLDC Motor with Remote 3 Blade Ceiling Fan  (Ivory & Black, Pack of 1)",Very good fan and sweet air,5
46196,"Atomberg Renesa 1200 mm BLDC Motor with Remote 3 Blade Ceiling Fan  (Ivory & Black, Pack of 1)","Don't buy this atomberg renesa fan. The design concept is a failure. Being a expert myself who has 10 years of process engineering in motor manufacturing, I can say this DC motor has worst rotor design. The permanent magnets are just pasted with glue and they do not have any self locking mechanism and this leads to the magnet pop up during fan operation. I bought three fans and all of these 3 fans noise issue due to magnet pop up and I have repeated issues too. This fan is a garbage please do...",1
46197,"Atomberg Renesa 1200 mm BLDC Motor with Remote 3 Blade Ceiling Fan  (Ivory & Black, Pack of 1)",Highly recommended 🤩🤩🤩,5
46198,"Atomberg Renesa 1200 mm BLDC Motor with Remote 3 Blade Ceiling Fan  (Ivory & Black, Pack of 1)",After 1 month of use it is making rattling noises,1
46199,"Atomberg Renesa 1200 mm BLDC Motor with Remote 3 Blade Ceiling Fan  (Ivory & Black, Pack of 1)",Very light fan... But in full speed double the force of my old fan...Very convenient...Am tracking the power meter and found. 2 3 units down.Satisfied.....Been 1 month only...i extended warranty online for 2 years.,5
46200,"Atomberg Renesa 1200 mm BLDC Motor with Remote 3 Blade Ceiling Fan  (Ivory & Black, Pack of 1)",Good product 👍,5
46201,"Atomberg Renesa 1200 mm BLDC Motor with Remote 3 Blade Ceiling Fan  (Ivory & Black, Pack of 1)",Good,5
46202,"Atomberg Renesa 1200 mm BLDC Motor with Remote 3 Blade Ceiling Fan  (Ivory & Black, Pack of 1)",I bought it for use in my office room for less noise compared to normal fan. It's same like normal fan with remote control.,4
46203,"Atomberg Renesa 1200 mm BLDC Motor with Remote 3 Blade Ceiling Fan  (Ivory & Black, Pack of 1)",Fan appearance is not good,3
46204,"Atomberg Renesa 1200 mm BLDC Motor with Remote 3 Blade Ceiling Fan  (Ivory & Black, Pack of 1)","Selected this fan from Gorilla for gifting after going through the positive reviews. My expectations were fulfilled by this fan. After fitting, it looks different from regular fans. Speed is very good and there is no sound even at high speed. Blades are designed in such a way that, air flow is uniform. Blue LED lights indicate the speed whenever we press the remote button to increase or decrease the speed. LED lights can be switched off or kept on. Very light weight fan, so very easy to fit. ...",5
46205,"Atomberg Renesa 1200 mm BLDC Motor with Remote 3 Blade Ceiling Fan  (Ivory & Black, Pack of 1)",very good fan,5
46206,"Atomberg Renesa 1200 mm BLDC Motor with Remote 3 Blade Ceiling Fan  (Ivory & Black, Pack of 1)",This Fan made my Room More colorful 😍,5
46207,"Atomberg Renesa 1200 mm BLDC Motor with Remote 3 Blade Ceiling Fan  (Ivory & Black, Pack of 1)","Electric items ok but avoid grocery items buying in Flipkart, because Because they have very worst delivery service. We cannot track and we want wait for two & three weeks for our items.. very worst...",1
46208,"Atomberg Renesa 1200 mm BLDC Motor with Remote 3 Blade Ceiling Fan  (Ivory & Black, Pack of 1)",Value of money nice product,5
46209,"Atomberg Renesa 1200 mm BLDC Motor with Remote 3 Blade Ceiling Fan  (Ivory & Black, Pack of 1)",stopped working on the first day itself,1
46210,"Atomberg Renesa 1200 mm BLDC Motor with Remote 3 Blade Ceiling Fan  (Ivory & Black, Pack of 1)","Fan is making lot of wind noise, also deliver less air.Fan design is faulty. Fan Quality is good. Wish to cancel the order but Atomberg doesn't provide return & refund. Wish to go for other fan from USHA, Crompton, Orient etc. ☹️",1
46211,"Atomberg Renesa 1200 mm BLDC Motor with Remote 3 Blade Ceiling Fan  (Ivory & Black, Pack of 1)",After some time it will start making so annoying noise,1
46212,"Atomberg Renesa 1200 mm BLDC Motor with Remote 3 Blade Ceiling Fan  (Ivory & Black, Pack of 1)",Waste don't buy ... Ordinary fan is better ....even at speed 5 it gives no air properly,1
46213,"Atomberg Renesa 1200 mm BLDC Motor with Remote 3 Blade Ceiling Fan  (Ivory & Black, Pack of 1)",You will not get that much air flow compared to normal fans...,3
46214,"Atomberg Renesa 1200 mm BLDC Motor with Remote 3 Blade Ceiling Fan  (Ivory & Black, Pack of 1)",Performance is not as expected.. air delivery poor then other fans.. it’s just fancy products,3
46215,"Atomberg Renesa 1200 mm BLDC Motor with Remote 3 Blade Ceiling Fan  (Ivory & Black, Pack of 1)",Very Good Fan,5
46216,"Atomberg Renesa 1200 mm BLDC Motor with Remote 3 Blade Ceiling Fan  (Ivory & Black, Pack of 1)",Best option available in market,5
46217,"Atomberg Renesa 1200 mm BLDC Motor with Remote 3 Blade Ceiling Fan  (Ivory & Black, Pack of 1)",Good speed n unique look with remote 👌🏻👌🏻👌🏻,5
46218,"Atomberg Renesa 1200 mm BLDC Motor with Remote 3 Blade Ceiling Fan  (Ivory & Black, Pack of 1)",Value of money nice product,5
46219,"Atomberg Renesa 1200 mm BLDC Motor with Remote 3 Blade Ceiling Fan  (Ivory & Black, Pack of 1)","After seeing all the reviews I have bought this fan, but this fan is not synching with remote properly and the fan get stop while running in between and restart by itself. And the fan is producing some sound while rotating. But the fan air is good. Had much expectations which didn't met, even the remote is not functioning properly",1
46220,"Atomberg Renesa 1200 mm BLDC Motor with Remote 3 Blade Ceiling Fan  (Ivory & Black, Pack of 1)",Best BLDC fan in market. Only 28w power consumption at full speed. While a regular fan consumps huge 80w power. But BLDC fan price should be down.,5
46221,"Atomberg Renesa 1200 mm BLDC Motor with Remote 3 Blade Ceiling Fan  (Ivory & Black, Pack of 1)",good buy,4
46222,"Atomberg Renesa 1200 mm BLDC Motor with Remote 3 Blade Ceiling Fan  (Ivory & Black, Pack of 1)",good one...,5
46223,"Atomberg Renesa 1200 mm BLDC Motor with Remote 3 Blade Ceiling Fan  (Ivory & Black, Pack of 1)",Thanks to flipkart,5
46224,"Atomberg Renesa 1200 mm BLDC Motor with Remote 3 Blade Ceiling Fan  (Ivory & Black, Pack of 1)",I buy this fan in Rs-3300. Next day it decreases price to Rs-3095. I loss Rs-205. Pathetic purchasing experience.,1
46225,"Atomberg Renesa 1200 mm BLDC Motor with Remote 3 Blade Ceiling Fan  (Ivory & Black, Pack of 1)",Fan appearance is not good,3
46226,"Atomberg Renesa 1200 mm BLDC Motor with Remote 3 Blade Ceiling Fan  (Ivory & Black, Pack of 1)",Not Working Within 20 Days Poor Product.,1
46227,"Atomberg Renesa 1200 mm BLDC Motor with Remote 3 Blade Ceiling Fan  (Ivory & Black, Pack of 1)",superb fan,5
46228,"Atomberg Renesa 1200 mm BLDC Motor with Remote 3 Blade Ceiling Fan  (Ivory & Black, Pack of 1)","Very Good fan , I install this fan in my Dinning hall. Air flow is very good.",5
46229,"Atomberg Renesa 1200 mm BLDC Motor with Remote 3 Blade Ceiling Fan  (Ivory & Black, Pack of 1)","Amazing experience.. Looks classy, makes you smart, quality is good. Power consumption is very less comparatively.. Go for it.. Black and Ivory is the best one to go with..",4
46230,"Atomberg Renesa 1200 mm BLDC Motor with Remote 3 Blade Ceiling Fan  (Ivory & Black, Pack of 1)",Worst product not even working at full speed. Inconsistency working by stoping and restarting itself.,1
46231,"Atomberg Renesa 1200 mm BLDC Motor with Remote 3 Blade Ceiling Fan  (Ivory & Black, Pack of 1)",Best fan of renesa series ❤️,5
46232,"Atomberg Renesa 1200 mm BLDC Motor with Remote 3 Blade Ceiling Fan  (Ivory & Black, Pack of 1)",good fan... makes a bit of noise on high speed.. overall satisfied..has mood lighting...,5
46233,"Atomberg Renesa 1200 mm BLDC Motor with Remote 3 Blade Ceiling Fan  (Ivory & Black, Pack of 1)","Product cost not affordable, product also not a classy.",3
46234,"Atomberg Renesa 1200 mm BLDC Motor with Remote 3 Blade Ceiling Fan  (Ivory & Black, Pack of 1)","I'll give it 4.6 out of 5. The only thing that cut .4 is The Straight Air Delivery. You will never found these things better than Atomberg Design, Technology, Speed, and most important the uniqueness. Highly recommended.",4
46235,"Atomberg Renesa 1200 mm BLDC Motor with Remote 3 Blade Ceiling Fan  (Ivory & Black, Pack of 1)",Owsam products,4
46236,"Atomberg Renesa 1200 mm BLDC Motor with Remote 3 Blade Ceiling Fan  (Ivory & Black, Pack of 1)",Delivery at proper time. I shall submit the product review after instalation and use.,4
46237,"Atomberg Renesa 1200 mm BLDC Motor with Remote 3 Blade Ceiling Fan  (Ivory & Black, Pack of 1)",Most electric efficiencies fan and smart remote control system . Good in use..,5
46238,"Atomberg Renesa 1200 mm BLDC Motor with Remote 3 Blade Ceiling Fan  (Ivory & Black, Pack of 1)",very good fan. I am using it for almost 6 month and very satisfied. All accessories are high quality. Blades are high quality and light weight.,5
46239,"Atomberg Renesa 1200 mm BLDC Motor with Remote 3 Blade Ceiling Fan  (Ivory & Black, Pack of 1)",Starts to make noise on the same day of installation.,1
46240,"Atomberg Renesa 1200 mm BLDC Motor with Remote 3 Blade Ceiling Fan  (Ivory & Black, Pack of 1)",Very bad don't purchase . Waste of money,1
46241,"Atomberg Renesa 1200 mm BLDC Motor with Remote 3 Blade Ceiling Fan  (Ivory & Black, Pack of 1)","Fan produce air only at the center and doesn't spread across the room even if it's top speed. Don't waste money as it doesn't have return option only, replacement option is there. Don't go with ratings.",1
46242,"Atomberg Renesa 1200 mm BLDC Motor with Remote 3 Blade Ceiling Fan  (Ivory & Black, Pack of 1)",Good liked it,4
46243,"Atomberg Renesa 1200 mm BLDC Motor with Remote 3 Blade Ceiling Fan  (Ivory & Black, Pack of 1)",Poor quality too much sound,1
46244,"Atomberg Renesa 1200 mm BLDC Motor with Remote 3 Blade Ceiling Fan  (Ivory & Black, Pack of 1)",Good product 👌👌👌,5
46245,"Atomberg Renesa 1200 mm BLDC Motor with Remote 3 Blade Ceiling Fan  (Ivory & Black, Pack of 1)",superb fan.,5
46246,"Atomberg Renesa 1200 mm BLDC Motor with Remote 3 Blade Ceiling Fan  (Ivory & Black, Pack of 1)",Fan is simply super.Go for it.,4
46247,"Atomberg Renesa 1200 mm BLDC Motor with Remote 3 Blade Ceiling Fan  (Ivory & Black, Pack of 1)","Don't buy atomberg product it's of no use service is also very bad and the fan they delivered is have many issue , continuously restarting problem,moter issue,and some times fan makes unnecessary sound So i suggest don't buy this product 😡😡😡😡Very disappointed with atombergI will never buy atomberg again and never suggest to anyone to buy this product 😡",1
46248,"Atomberg Renesa 1200 mm BLDC Motor with Remote 3 Blade Ceiling Fan  (Ivory & Black, Pack of 1)",Develope the mobile application for all atomberg fans.. btw loved this,5
46249,"Atomberg Renesa 1200 mm BLDC Motor with Remote 3 Blade Ceiling Fan  (Ivory & Black, Pack of 1)","Very very worest product, not any person installation came it self installation",1
46250,"Atomberg Renesa 1200 mm BLDC Motor with Remote 3 Blade Ceiling Fan  (Ivory & Black, Pack of 1)",Product is working very good but installation facilities very bad.better local lineman,4
46251,"Atomberg Renesa 1200 mm BLDC Motor with Remote 3 Blade Ceiling Fan  (Ivory & Black, Pack of 1)","Finest performance, but I have to wait and see the durability.",4
46252,"Atomberg Renesa 1200 mm BLDC Motor with Remote 3 Blade Ceiling Fan  (Ivory & Black, Pack of 1)","Best BDLC Fans and very energy efficient.Elegant design.Made in India by IIT's , So support home grown company.It wont disappoint you for anything.",5
46253,"Atomberg Renesa 1200 mm BLDC Motor with Remote 3 Blade Ceiling Fan  (Ivory & Black, Pack of 1)","We bought this fan in April 26th, installation done by April 27th, only 5 months it's working good, after that it's not working, we r unhappy for this product, money Also waste, we r very disappointed",1
46254,"Atomberg Renesa 1200 mm BLDC Motor with Remote 3 Blade Ceiling Fan  (Ivory & Black, Pack of 1)",Average kind of product,3
46255,"Atomberg Renesa 1200 mm BLDC Motor with Remote 3 Blade Ceiling Fan  (Ivory & Black, Pack of 1)",Very good,5
46256,"Atomberg Renesa 1200 mm BLDC Motor with Remote 3 Blade Ceiling Fan  (Ivory & Black, Pack of 1)",Super,4
46257,"Atomberg Renesa 1200 mm BLDC Motor with Remote 3 Blade Ceiling Fan  (Ivory & Black, Pack of 1)","Nice product,working very good even in low voltage.",4
46258,"Atomberg Renesa 1200 mm BLDC Motor with Remote 3 Blade Ceiling Fan  (Ivory & Black, Pack of 1)",Excellent 👍,5
46259,"Atomberg Renesa 1200 mm BLDC Motor with Remote 3 Blade Ceiling Fan  (Ivory & Black, Pack of 1)",Very good fan,5
46260,"Atomberg Renesa 1200 mm BLDC Motor with Remote 3 Blade Ceiling Fan  (Ivory & Black, Pack of 1)","Very good speed, nice look",5
46261,"Atomberg Renesa 1200 mm BLDC Motor with Remote 3 Blade Ceiling Fan  (Ivory & Black, Pack of 1)",I faced this issue once. When I was trying to set fanspeed to 2 then it was running at full speed. Got fixed automatically after few runs.,3
46262,"Atomberg Renesa 1200 mm BLDC Motor with Remote 3 Blade Ceiling Fan  (Ivory & Black, Pack of 1)",I am noticing fluctuations in Speed at lower levels.,2
46263,"Atomberg Renesa 1200 mm BLDC Motor with Remote 3 Blade Ceiling Fan  (Ivory & Black, Pack of 1)",Very good,3
46264,"Atomberg Renesa 1200 mm BLDC Motor with Remote 3 Blade Ceiling Fan  (Ivory & Black, Pack of 1)",Nice,5
46265,"Atomberg Renesa 1200 mm BLDC Motor with Remote 3 Blade Ceiling Fan  (Ivory & Black, Pack of 1)",Fan is compliant within a month. 4 piece bought . One was compliant on delivery. The other 3 became faulty in a month. Makes noise. Came to know that this model is one batch full of compliants,2
46266,"Atomberg Renesa 1200 mm BLDC Motor with Remote 3 Blade Ceiling Fan  (Ivory & Black, Pack of 1)",This fan saves electric bill and also runs on small inverter.,4
46267,"Atomberg Renesa 1200 mm BLDC Motor with Remote 3 Blade Ceiling Fan  (Ivory & Black, Pack of 1)",Looking qood,4
46268,"Atomberg Renesa 1200 mm BLDC Motor with Remote 3 Blade Ceiling Fan  (Ivory & Black, Pack of 1)",Please never buy atomberg fan. This got replaced 2 times and within the second week of purchase. Fan speed is not at all good and very slow compared to other non remote fans. Zero recommendation from my side to buy this fan.,1
46269,"Atomberg Renesa 1200 mm BLDC Motor with Remote 3 Blade Ceiling Fan  (Ivory & Black, Pack of 1)","Motor failed in 24 days.just purchase on 12th may 2022,motor failed yesterday",1
46270,"Atomberg Renesa 1200 mm BLDC Motor with Remote 3 Blade Ceiling Fan  (Ivory & Black, Pack of 1)",Very noisy.very bad,1
46271,"Atomberg Renesa 1200 mm BLDC Motor with Remote 3 Blade Ceiling Fan  (Ivory & Black, Pack of 1)",Verry Bad ..OLD IS GOLD..,1
46272,"Atomberg Renesa 1200 mm BLDC Motor with Remote 3 Blade Ceiling Fan  (Ivory & Black, Pack of 1)",Nice,4
46273,"Atomberg Renesa 1200 mm BLDC Motor with Remote 3 Blade Ceiling Fan  (Ivory & Black, Pack of 1)",Not good. very worst product 8 months only run. we had manufacturing problem.Mohamed ushainTamilnadu,1
46274,"Atomberg Renesa 1200 mm BLDC Motor with Remote 3 Blade Ceiling Fan  (Ivory & Black, Pack of 1)",Worst product....staring problem after a few month...better to buy product from HAVELLS OR Usha... Waste of money,2
46275,"Atomberg Renesa 1200 mm BLDC Motor with Remote 3 Blade Ceiling Fan  (Ivory & Black, Pack of 1)",Fan Start with bearing noise + itself speed increase/decrease.i bought this product with lot of expectations but now I had to return it🥲,1
46276,"Atomberg Renesa 1200 mm BLDC Motor with Remote 3 Blade Ceiling Fan  (Ivory & Black, Pack of 1)",Good production,5
46277,"Atomberg Renesa 1200 mm BLDC Motor with Remote 3 Blade Ceiling Fan  (Ivory & Black, Pack of 1)",It is making too much noice,1
46278,"Atomberg Renesa 1200 mm BLDC Motor with Remote 3 Blade Ceiling Fan  (Ivory & Black, Pack of 1)",Very nice 👌👍🏼,4
46279,"Atomberg Renesa 1200 mm BLDC Motor with Remote 3 Blade Ceiling Fan  (Ivory & Black, Pack of 1)",The fan makes tak tak noise. It starts with a loud noise as if we start a tractor. I bought two fans and both started doing this after 5days. Worst ever experience because we have our house warming and it won't be repaired quickly.,1
46280,"Atomberg Renesa 1200 mm BLDC Motor with Remote 3 Blade Ceiling Fan  (Ivory & Black, Pack of 1)",Fan makingg noise with in a week,2
46281,"Atomberg Renesa 1200 mm BLDC Motor with Remote 3 Blade Ceiling Fan  (Ivory & Black, Pack of 1)",Very very fine airflow I love it.thanx to atomberg and flipkart..I will order again for it.,5
46282,"Atomberg Renesa 1200 mm BLDC Motor with Remote 3 Blade Ceiling Fan  (Ivory & Black, Pack of 1)",It's very bad.. Very noicey,2
46283,"Atomberg Renesa 1200 mm BLDC Motor with Remote 3 Blade Ceiling Fan  (Ivory & Black, Pack of 1)",Nice air flow as well as speed is also very good,4
46284,"Atomberg Renesa 1200 mm BLDC Motor with Remote 3 Blade Ceiling Fan  (Ivory & Black, Pack of 1)",After replac new fan noise problem as it is.. So very bad experience... Please don't buy Renesa,1
46285,"Atomberg Renesa 1200 mm BLDC Motor with Remote 3 Blade Ceiling Fan  (Ivory & Black, Pack of 1)",Go for it👍,5
