Unnamed: 0,Product,Review_Summary,Rating
46092,"Atomberg Renesa 1200 mm BLDC Motor with Remote 3 Blade Ceiling Fan  (Ivory & Black, Pack of 1)","Overall Fan is good, first i was afraid for ordering this fan because its not that popular and without checking it was risky.But my decision was right and i ordered it.Fan is too good speed is awesome but its lightweight and i really like to se doesn it will affect my electricity bill.After three months i will again repost about it.",4
46093,"Atomberg Renesa 1200 mm BLDC Motor with Remote 3 Blade Ceiling Fan  (Ivory & Black, Pack of 1)",Excellent Fan. Made in India. Fan works Good allover and good airflow. Remote control works super.,5
46094,"Atomberg Renesa 1200 mm BLDC Motor with Remote 3 Blade Ceiling Fan  (Ivory & Black, Pack of 1)","This is my second fan from atomberg, super quality, energy efficient. Performance wise 5/5.Look wise 5/5.And 5 special stars who designed the fan.The first glimpse of the fan, and automatically you say wowwww....* * * * * *Customer reviews build something known as social proof.* * * * *Responding to reviews is one of the most important things a brand can do to improve its reputation and local SEO rankings. * * * * *",5
46095,"Atomberg Renesa 1200 mm BLDC Motor with Remote 3 Blade Ceiling Fan  (Ivory & Black, Pack of 1)","Today I fit my Gorila Fan date is =22/02/2020..According to me today I watched it super , great...But don't know how long it will run ...If it give me long life I promise again I will buy 2 piece Bcz I really like its power consumption and remote , LED look  gives my room a  great look ...I wish it Will run long time Start date= 22/02/2020..Ok lets seeEverybody I want to say no tention easily purchase it..great fan ofcourse I will buy another one",5
46096,"Atomberg Renesa 1200 mm BLDC Motor with Remote 3 Blade Ceiling Fan  (Ivory & Black, Pack of 1)","Selected this fan from Gorilla for gifting after going through the positive reviews. My expectations were fulfilled by this fan. After fitting, it looks different from regular fans. Speed is very good and there is no sound even at high speed. Blades are designed in such a way that, air flow is uniform. Blue LED lights indicate the speed whenever we press the remote button to increase or decrease the speed. LED lights can be switched off or kept on. Very light weight fan, so very easy to fit. ...",5
46097,"Atomberg Renesa 1200 mm BLDC Motor with Remote 3 Blade Ceiling Fan  (Ivory & Black, Pack of 1)","Highly Recomended. Very good speed, quality product with the best standerd quality air blowing. Delux air comfortness.This is my best choice.No sound and noise. Only air sound.LED is also good.Remote control is very sweet.It carry a very nice looks.Big matter is motor is very good, with minimun watt. It consumes only 28 watt with very good speed. Its speed is awesome. You can not see its blades when it is in the running condition.You may buy it blindly if you want to save electricity ...",5
46098,"Atomberg Renesa 1200 mm BLDC Motor with Remote 3 Blade Ceiling Fan  (Ivory & Black, Pack of 1)",Pros:-Super Efficient at only 28 WattsSleek design and transparent buttom with indicator LEDsVery useful remote control with awesome featuresAir delivery is good and the noise level is less compared to other fqns at this sizeCons:-Price is little bit on the expensive sideThe main motor body has some plastic builds which doesn't feel premiumAt full speed there's a clicking noise which is not that loud but its there.Conclusion:-It's definitely a good product and it does works flawless...,4
46099,"Atomberg Renesa 1200 mm BLDC Motor with Remote 3 Blade Ceiling Fan  (Ivory & Black, Pack of 1)","Selected this fan from Gorilla for gifting after going through the positive reviews. My expectations were fulfilled by this fan. After fitting, it looks different from regular fans. Speed is very good and there is no sound even at high speed. Blades are designed in such a way that, air flow is uniform. Blue LED lights indicate the speed whenever we press the remote button to increase or decrease the speed. LED lights can be switched off or kept on. Very light weight fan, so very easy to fit. ...",5
46100,"Atomberg Renesa 1200 mm BLDC Motor with Remote 3 Blade Ceiling Fan  (Ivory & Black, Pack of 1)",Best Energy Saving Fan ever❤❤...Speed is so nice..covers all the corners of the room but it's for small & medium size room (Approx 100 - 140 sqft)...Looks so premium .With led lights it becomes more eye catching 👀...It consume only 28 watt (Boost Mode 35 watts)...with cute tiny remote it becomes so easy to operate..Sound is lesser than other fans...Also u can buy spare parts on Atomberg official website...Overall loved it.proudly says that it's Made in India By the IIT BOMBAY Alumni🇮🇳🇮🇳❤❤,5
46101,"Atomberg Renesa 1200 mm BLDC Motor with Remote 3 Blade Ceiling Fan  (Ivory & Black, Pack of 1)","Very good fan. Good air delivery. Runs smoothly. Air throw is equal to usha high speed celling fan. Speed is equal to general high speed fans. Worth buying. I am satisfied.U need not go for renesa +. All are same to it...speed, functions air delivery....all. just glossy colour is better in plus while it is matty finished. I dont think one should spare 350 extra money just for colour,  which is not visible at running condition.",5
46102,"Atomberg Renesa 1200 mm BLDC Motor with Remote 3 Blade Ceiling Fan  (Ivory & Black, Pack of 1)","Its a good choice.Delivery: delivered in time as informed.Packing: was very good Item performance: it's great, stand out product than all other conventional fans, power efficiency I hope will be there as mentioned, remote and lights are great.in short, a good choice, hats off to its manufacturers , the  IITans..I read u r in a way to make AC with less power consumption, eagarly waiting for it.",5
46103,"Atomberg Renesa 1200 mm BLDC Motor with Remote 3 Blade Ceiling Fan  (Ivory & Black, Pack of 1)","Got this product with nice packings ,all parts are intact.fan looks primium,light weight, functions are fabulous,super fast speed with ease of remote control for the sleepy heads,just go and own this luxury with 3 years of warrenty",5
46104,"Atomberg Renesa 1200 mm BLDC Motor with Remote 3 Blade Ceiling Fan  (Ivory & Black, Pack of 1)","Very stylish and modern design. By the way, this fan is a dust magnet - my normal fans does not attract this much dust as this does :DAtomberg could have provided a remote holder too. I have see a holder packed with some other brands of BLDC fan. Remote is cute though. I just 3D printed a holder for it and fixed at the location where the fan regulator was removed. If the remote control was RF based I should never had to remove it from the holder.The speed is acceptable and the energy cons...",4
46105,"Atomberg Renesa 1200 mm BLDC Motor with Remote 3 Blade Ceiling Fan  (Ivory & Black, Pack of 1)","A nice-compact fan, with high RPM, remote control, LED lights and energy efficient with 5 star BEE rating. Easy to install, no necessity of an electrician. Regulator can be removed from the switch board, not required for this fan.Very silent, just the sound of wind comes. Yes, LEDs can be turned on/off from the Remote. Battery for the remote is included.",5
46106,"Atomberg Renesa 1200 mm BLDC Motor with Remote 3 Blade Ceiling Fan  (Ivory & Black, Pack of 1)",There is everything good about the fan except that it is not dust proof. The Air flow is good . Looks sleek & Good. Remote is small and fine . One thing you must remember that you have to disable your regulator after installation and keep it on full . Then disconnect it. Once installed you have to use all functions only through remote. Price appears to be on the higher side but that is the trend with most remote control fans. Power consumption needs to be checked.,3
46107,"Atomberg Renesa 1200 mm BLDC Motor with Remote 3 Blade Ceiling Fan  (Ivory & Black, Pack of 1)",After using one month fully satisfied. Remote is  working well . Led is using to night lamp if you needed. Smart air flow more than my old one. Easy to installed myself.FM signal signal interfere with when fan is working time.When fan also working at same speed after power failure but light Lamp is not on after power failure.,5
46108,"Atomberg Renesa 1200 mm BLDC Motor with Remote 3 Blade Ceiling Fan  (Ivory & Black, Pack of 1)",Excellent fan. Low power consuming fan at a marginal premium compared to other normal fans. Makes much less noise. Looks better than normal fans. Comes with a remote control for lazy bones like me. Also has sleep and timer features in addition to small leds which work like night lamp. What else can one ask for in a fan. Bought two such fans over the period of last 6 months and planning to replace all the existing fans of my home with this one.Very quick delivery despite lockdown. Kudos to fl...,5
46109,"Atomberg Renesa 1200 mm BLDC Motor with Remote 3 Blade Ceiling Fan  (Ivory & Black, Pack of 1)",terrific product 100% satisfied thank you seller and thank you flipkart and delivery team is awesome,5
46110,"Atomberg Renesa 1200 mm BLDC Motor with Remote 3 Blade Ceiling Fan  (Ivory & Black, Pack of 1)","One of the best fans I have come across. Sleek, slim, cute looking and energy efficient",5
46111,"Atomberg Renesa 1200 mm BLDC Motor with Remote 3 Blade Ceiling Fan  (Ivory & Black, Pack of 1)","best slick design, powerful and quite operation. hoping for the best durability. LED should have been white or warm white color",5
46112,"Atomberg Renesa 1200 mm BLDC Motor with Remote 3 Blade Ceiling Fan  (Ivory & Black, Pack of 1)","best slick design, powerful and quite operation. hoping for the best durability. LED should have been white or warm white color",5
46113,"Atomberg Renesa 1200 mm BLDC Motor with Remote 3 Blade Ceiling Fan  (Ivory & Black, Pack of 1)","Fan is very good, light weight,fan speed is like normal fan speed with using the boost a little bit fan speed is high.build quality is very good.If you need to buy for current consumption go for it. Nice product",4
46114,"Atomberg Renesa 1200 mm BLDC Motor with Remote 3 Blade Ceiling Fan  (Ivory & Black, Pack of 1)",The fan is good -Couple of things to note if you are ordering this fan ensure the false ceiling is not done yet since the black rod doesn’t help.Fan blades seem to be very small or thin for a 10*13 room but the air flow is good. Overall good purchase so far. You have to switch in 3 # seed to have a free flow of air.,4
46115,"Atomberg Renesa 1200 mm BLDC Motor with Remote 3 Blade Ceiling Fan  (Ivory & Black, Pack of 1)","Bought it 1 month ago.Runs perfectly.smooth design.Works handy.air flow is better in compare to normal 75 watt fan.Remote works fine.warranty registration was easy,i am saying this because i have bought a havells bldc motor fan and the registration process of that product was pretty hefty.I recommend this if you are going to buy a bldc motor fan.",5
46116,"Atomberg Renesa 1200 mm BLDC Motor with Remote 3 Blade Ceiling Fan  (Ivory & Black, Pack of 1)",The product was delivered within couple of days. I am using this product for more than a week and I must say I am really happy. After using for a week i ordered another Atomberg fans. I definitely recommend this to everyone. Couple of people came at my home and asked which fans are this. They liked it as well. Thanks a lot Flipkart and Atomberg. 🤘👍,5
46117,"Atomberg Renesa 1200 mm BLDC Motor with Remote 3 Blade Ceiling Fan  (Ivory & Black, Pack of 1)","Awesome fan, top indian company specially fitting, quality are too good, dont view of negative submissions, energy consumption is less than a top quality pedestal or wall fan. Best for use with electricity and inverter.",5
46118,"Atomberg Renesa 1200 mm BLDC Motor with Remote 3 Blade Ceiling Fan  (Ivory & Black, Pack of 1)","Order is delivered before expected date...and the product is awesome... elegant design ,effective air flow ....smaller than ordinary fans but the air flow is far better than ordinary fans....after all it is too cheeper when you compare the price with other brands with similar specifications....though I ordered from a remote rural area the delivery guy delivered it directly to my home unlike other services...thanks to him",5
46119,"Atomberg Renesa 1200 mm BLDC Motor with Remote 3 Blade Ceiling Fan  (Ivory & Black, Pack of 1)","Fan is good, First I have doubt about the speed, but it is good like a normal fan build is mostly plastic, but blade are metal of good quality and  overall fan feel and look like premium.I have only one problem that the fan not work smoothly with remote, Sometimes when I select the speed 3 on remote it goes into boost mode with full speed but after sometimes its speed adjusted.I have not contacted the company yet.After the prepaid meter installation, it is good and economical to have bl...",4
46120,"Atomberg Renesa 1200 mm BLDC Motor with Remote 3 Blade Ceiling Fan  (Ivory & Black, Pack of 1)",Awesome product it's working good functions are working well. I recommend these for all but I want check it's performance for period of time .I am going to edit my review after two months.thanks Flipkart for it's fast delivery..,4
46121,"Atomberg Renesa 1200 mm BLDC Motor with Remote 3 Blade Ceiling Fan  (Ivory & Black, Pack of 1)",FANTASTIC PURCHASED I ALSO PURCHASED ORIENT CEILING FAN WITH REMOTE AND ATOMBERG RENESA I REALLY LOVED THIS PRODUCT ORIENT FAN NOT GETTING REMOTE CONTROL NOW BUT THIS FAN IS SMOOTHLY PICK CONTROL BY REMOTE I WRITE THIS REVIEW AFTER 1.5 YEAR PURCHASE OF THIS PRODUCT,5
46122,"Atomberg Renesa 1200 mm BLDC Motor with Remote 3 Blade Ceiling Fan  (Ivory & Black, Pack of 1)",Looking like promising product Bcz after going through reviews I order it and now it's working fine even at low voltage.... Now I have to order 6 more.,5
46123,"Atomberg Renesa 1200 mm BLDC Motor with Remote 3 Blade Ceiling Fan  (Ivory & Black, Pack of 1)",The fan speed is good and I feel just like a normal fan initially I thought that die to its low voltage I thought that the speed may not be good but after purchase I was happy it is very good,5
46124,"Atomberg Renesa 1200 mm BLDC Motor with Remote 3 Blade Ceiling Fan  (Ivory & Black, Pack of 1)",It was giving sounds while starting and feels like it may fall down. Raised complaint with Atomberg and they changed the fan. New one works fine from the last 2 months. Features are great and works well .,5
46125,"Atomberg Renesa 1200 mm BLDC Motor with Remote 3 Blade Ceiling Fan  (Ivory & Black, Pack of 1)",Fans are noiseless and covers good area of air flow. Best in market,5
46126,"Atomberg Renesa 1200 mm BLDC Motor with Remote 3 Blade Ceiling Fan  (Ivory & Black, Pack of 1)",First time i purchased this BLDC model fan. Actually i don't know about this product and performance. It was received with nice packing and in time. Most important things are it comes with remote and it is not delivering any heat like ordinary fans. Good balue for money,5
46127,"Atomberg Renesa 1200 mm BLDC Motor with Remote 3 Blade Ceiling Fan  (Ivory & Black, Pack of 1)","this fan is amazing by looks, also performance. power consumption is very little, nly 28watt, in comparison with other conventional fan arround 80 to 100 watt, that is almost 1/3 . thats why electric bill immediately slash down 1/3.more over it does not heat and noise even slower speed. led lamp can be use as good as night lamp.finally its awesome. I recommend those who want to buy this fan, neve think twice.",5
46128,"Atomberg Renesa 1200 mm BLDC Motor with Remote 3 Blade Ceiling Fan  (Ivory & Black, Pack of 1)",Really Amazing Fan..  Been using for 3 months now  Pros: 1. Power consumption at max speed is 35 watt compated to 80 watts normal fan 2. Great looks 3. Same or more airflow compared to normal fans 4. Good packing on delivery.. 5. Gurantee for 3 years Overall great experience         Cons: 1. Expensive compared to normal fan 2. Power comsumption at max speed is 35 watts although written 28 watts in ad and pack,5
46129,"Atomberg Renesa 1200 mm BLDC Motor with Remote 3 Blade Ceiling Fan  (Ivory & Black, Pack of 1)",The fan looks great on ceiling. Speed wise good. The pic taken while running at boost speed which is 6th stage. Remote is handy and nice. It's on costlier side though. Not sure abt electricity saving as it claims 28W consumption. Upon switching on its a slow starter.,4
46130,"Atomberg Renesa 1200 mm BLDC Motor with Remote 3 Blade Ceiling Fan  (Ivory & Black, Pack of 1)",Writing after using for 3 days :1. Fan speed is satisfactory.2. LEDs work well.3. Sleep & timer is also useful.4. This fan is lighter in weight compared to other fans. So assemble the fan cautiously.   So far happy with the fan & hope it lasts long.,4
46131,"Atomberg Renesa 1200 mm BLDC Motor with Remote 3 Blade Ceiling Fan  (Ivory & Black, Pack of 1)",Excellent bldc fan iam past 1year iam getting problem in low voltage only in summer season due to all phase load was sucking near by house using Ac... That time in my meter 140 voltage drop... Now bldc fan running at 140 voltage at full boost speed... Really the tecnology is excellent... Congratulate to the invetors..,5
46132,"Atomberg Renesa 1200 mm BLDC Motor with Remote 3 Blade Ceiling Fan  (Ivory & Black, Pack of 1)",Excellent bldc fan iam past 1year iam getting problem in low voltage only in summer season due to all phase load was sucking near by house using Ac... That time in my meter 140 voltage drop... Now bldc fan running at 140 voltage at full boost speed... Really the tecnology is excellent... Congratulate to the invetors..,5
46133,"Atomberg Renesa 1200 mm BLDC Motor with Remote 3 Blade Ceiling Fan  (Ivory & Black, Pack of 1)","Very nice look, speed is very high as compared than other normal fans, remote works properly LED light makes it very smart fan. You can boost your fan any time, any speed from remote. Sleep mode also available. Overall satisfied from this fan. Thanks flipkart.",5
46134,"Atomberg Renesa 1200 mm BLDC Motor with Remote 3 Blade Ceiling Fan  (Ivory & Black, Pack of 1)",Bought it as needed a remote control fan and this serves the best in purpose also the speed is really good it's smooth dose not produce any noise and led are very good they indicate speed and also have option to switch on or off led,5
46135,"Atomberg Renesa 1200 mm BLDC Motor with Remote 3 Blade Ceiling Fan  (Ivory & Black, Pack of 1)",Awesome air delivery. Eye- catchy style . Powerful remote. Power consumption is only 28w at the highest speed. Love the product.,5
46136,"Atomberg Renesa 1200 mm BLDC Motor with Remote 3 Blade Ceiling Fan  (Ivory & Black, Pack of 1)","Wonderful product from such new company cheap and best, seriously believe me i bought two products one from Atomberg and one from Luminous and Luminous is 1.5K more than this and it's classic and Luminous is pathetic regards functionalities and looks.",4
46137,"Atomberg Renesa 1200 mm BLDC Motor with Remote 3 Blade Ceiling Fan  (Ivory & Black, Pack of 1)",Still waiting its performance after installation. Fast shipping good packaging good looking fan with remote. Definitely recommend it .will buy again. Used for couple of weeks performances is good . Bought total 5 fans for my home. Installed onely one fan right now. Hope other will be good tooThanks flipkart,5
46138,"Atomberg Renesa 1200 mm BLDC Motor with Remote 3 Blade Ceiling Fan  (Ivory & Black, Pack of 1)",writing review after 2-3 months of usage. its good. doesnot sound much at higher speed. but swings a bit at high Speed which is not comfortable. also design is very simple considering the price. better to go for smart phone which is good compared to this. atomberg sends email to collect feedback which is good.,3
46139,"Atomberg Renesa 1200 mm BLDC Motor with Remote 3 Blade Ceiling Fan  (Ivory & Black, Pack of 1)","Not better than havells bldc, bought two fan one atomberge and one havells neo, atomberge has narrow and long blade, havells has wider blade, led look like cheap chinese product, havell fan looks good and low noise as well that atomberge. Fan speed control also not up to mark, for speed 1 its just rotating without delivering air.Havells doing better here even in low price and  consuming low power.",4
46140,"Atomberg Renesa 1200 mm BLDC Motor with Remote 3 Blade Ceiling Fan  (Ivory & Black, Pack of 1)","We're using ""Atomberg Renesa"" for the last few months, I must say it's one of the best fans we've used, the fan just runs like the regular fan but it consumes less power, it's good. The best part about the Renesa is the remote control, it makes the life easy for users. The noise is just similar to the usual fans, very low noise and you wouldn't feel it. The Fan Speed is good, and also the built is good, it's light in weight, but it's good. the fan does attract a lot of dust and so you...",5
46141,"Atomberg Renesa 1200 mm BLDC Motor with Remote 3 Blade Ceiling Fan  (Ivory & Black, Pack of 1)",Fan is so good looking.Speed on 1 and 2 number is Lil slow but on 3rd 4th n 5th it's very good.Led lights gives good look to fan.As i read some voice is coming from fan at the time of buying but there is no voice fan is totally ok.And mostly no noise at the time of starting end shutting the fan.Remote is looking very nice and works very well.,4
46142,"Atomberg Renesa 1200 mm BLDC Motor with Remote 3 Blade Ceiling Fan  (Ivory & Black, Pack of 1)","Good Fan And Nice Air flow. Only One Problem If you put two fans in close proximity, then both the fans will operate simultaneously on the same remote.",4
46143,"Atomberg Renesa 1200 mm BLDC Motor with Remote 3 Blade Ceiling Fan  (Ivory & Black, Pack of 1)","Quality wise Product is very good and  running very faster at speed level 5 more than Boost mode but actually at speed level 3 or 4 it's running very slow comparatively normal fan, So little disappointed.",3
46144,"Atomberg Renesa 1200 mm BLDC Motor with Remote 3 Blade Ceiling Fan  (Ivory & Black, Pack of 1)",Have been using 3 Fans since more than a year. It has reduced power bills significantly. Fan in hall & 1 bed room  works 24 hours a day & hence has contributed to savings,5
46145,"Atomberg Renesa 1200 mm BLDC Motor with Remote 3 Blade Ceiling Fan  (Ivory & Black, Pack of 1)","Excellent product, no sound from motor and the remote controlling is very good. Very easy to install,you can even install by your self not by passing the regulator. Just install it like any ceiling fan and put the regulator at high always and control the fan through remote.",5
46146,"Atomberg Renesa 1200 mm BLDC Motor with Remote 3 Blade Ceiling Fan  (Ivory & Black, Pack of 1)",This fan is very good product best quality best experience for the day very very happy,5
46147,"Atomberg Renesa 1200 mm BLDC Motor with Remote 3 Blade Ceiling Fan  (Ivory & Black, Pack of 1)",Very good quality and 5 star electricity rating Celine fan.Speed is outstanding and also spreads the air all over the room. Awesome delivery by flipkart. Worth it!!,5
46148,"Atomberg Renesa 1200 mm BLDC Motor with Remote 3 Blade Ceiling Fan  (Ivory & Black, Pack of 1)",Excellent fan. Remote works well and very silent. Air flow 8s better than conventional fan,5
46149,"Atomberg Renesa 1200 mm BLDC Motor with Remote 3 Blade Ceiling Fan  (Ivory & Black, Pack of 1)","(After 2 months of use) Good Product . After Replacement this product is genuine . but at first Seller Delivered me defected product that's very Sad for me. This should not be Right , you should sent Customer Genuine product at the first Time.",4
46150,"Atomberg Renesa 1200 mm BLDC Motor with Remote 3 Blade Ceiling Fan  (Ivory & Black, Pack of 1)","It is an average product. I bought 2 colours from Flipkart, both are average. Compared to the conventional fans the speed is normal. I am a great lover of Crompton fans. Comparing this with Crompton high-speed fans the BLDC fans air delivery is not that good. I am using an Exide inverter and which has an option to display percentage of the connected load. When I connect a Crompton high-speed fan on this inverter it will show 12% power consumption. Today I checked same with Automberg BLDC fan...",3
46151,"Atomberg Renesa 1200 mm BLDC Motor with Remote 3 Blade Ceiling Fan  (Ivory & Black, Pack of 1)","Amazing fan and amazing service. The LED light is like a night lamp. But you can switch it off if you want. There are 6 LEDs. As you increase or decrease the speed, the leds will glow momentarily to let you know the speed. For example for fifth speed, 5leds will blink momentarily. Installation is very easy just like normal ceiling fan. Speed is very high even at low voltages. Power back up of our inverter has increased significantly after using this fan. I had got 2 fans. But unfortunately, o...",5
46152,"Atomberg Renesa 1200 mm BLDC Motor with Remote 3 Blade Ceiling Fan  (Ivory & Black, Pack of 1)",Very good quality.....With good looking....and speed is too fast   and consumed low power.. Very good performance I'm impressed with this.,5
46153,"Atomberg Renesa 1200 mm BLDC Motor with Remote 3 Blade Ceiling Fan  (Ivory & Black, Pack of 1)",It's an amazing product ....Value for money.....It's working with mobile phone.....,5
46154,"Atomberg Renesa 1200 mm BLDC Motor with Remote 3 Blade Ceiling Fan  (Ivory & Black, Pack of 1)",very nice and awsome looksmi rimote support this fan,4
46155,"Atomberg Renesa 1200 mm BLDC Motor with Remote 3 Blade Ceiling Fan  (Ivory & Black, Pack of 1)",Best fan consume only 28 watts,5
46156,"Atomberg Renesa 1200 mm BLDC Motor with Remote 3 Blade Ceiling Fan  (Ivory & Black, Pack of 1)",Nice products 👍,5
46157,"Atomberg Renesa 1200 mm BLDC Motor with Remote 3 Blade Ceiling Fan  (Ivory & Black, Pack of 1)",It is good enough to the living room. Nice product,4
