Unnamed: 0,Product,Review_Summary,Rating
181280,"BAJAJ 15 L Storage Water Geyser (Popular Plus 15 L, White)","i am giving four stars because of the courier system. they refused to deliver doorstep. Other than the product is good  well pacakge. relevant, less electricity consumption. but u have to wait at least 5-6 mint to get perfect desirable heated water.",4
181281,"BAJAJ 15 L Storage Water Geyser (Popular Plus 15 L, White)",Product look good and installation is quite easy it ordered 15 litre popular plus and it takes 10 min for hot water.,5
181282,"BAJAJ 15 L Storage Water Geyser (Popular Plus 15 L, White)","Nice product, I review it after use 7 to 8 days, it's too good, heating process are very good, it's take 20-25 min for heat water, if you take normal warm water it's take 10-15 min only.1) in this package only water geyser provide by supplier.2) didn't have inlet and outlet pipes in sales box, when bajaj executive come your doorstep for installing, they provide you inlet and outlet pipes free of cost, bcz company provides both pipes for customers.3) this model doesn't have 3pin top with th...",5
181283,"BAJAJ 15 L Storage Water Geyser (Popular Plus 15 L, White)",Very good product. 100/100 always on bajaj products. really useful. low in cost. Totally best purchase from flipkart. one more thing I want to thank all the flipkart customer care and concern team who helped me to get my money back in time as I have an issue while buying this product. You can trust them with close eyes. Thank you all. (I just want to aware you on that if you select COD then don't change your payment mode frequently. you may be on trouble). otherwise all good. Thank you flipkart,5
181284,"BAJAJ 15 L Storage Water Geyser (Popular Plus 15 L, White)",Overall product is very good and very fast free installation..but the heating is bit slow and you can not get 25 ltr hot water. if you want to purchase only bajaj plz look for another product don't buy popular plus..,3
181285,"BAJAJ 15 L Storage Water Geyser (Popular Plus 15 L, White)",Working fine and installation is so easy. The only thing is it's taking 8-10 minutes of time to hot water and it's not for 4-5 people's use. If want to use for max 3 people's you can go for it. This is the best product in the market at this range of price.I am giving 4.5 🌟 star.,4
181286,"BAJAJ 15 L Storage Water Geyser (Popular Plus 15 L, White)",best in price heating fast installation free but you have to pay for pipes or buy from your own worth purchase heating time is less and temp. adjustment is pretty nice...,5
181287,"BAJAJ 15 L Storage Water Geyser (Popular Plus 15 L, White)","awesome product , features and product both are good and u can aslo get free installation by Bajaj. i got next day installationm this is the sign of a best brand and service",4
181288,"BAJAJ 15 L Storage Water Geyser (Popular Plus 15 L, White)","I searched lot of geyser finally I found this geyser ,it is great ful and working good also ,then the Service is very good they came and install within 3 day after registration .totally my family is satisfied",4
181289,"BAJAJ 15 L Storage Water Geyser (Popular Plus 15 L, White)",Nice working but the packaging was not good ...after using 10 days I wrote this ..nodoubt geyser is nice. I gave 4 star as packaging was not good,4
181290,"BAJAJ 15 L Storage Water Geyser (Popular Plus 15 L, White)","Awsome bajaj water geyser best product and best price, i am very satisfied and the water is to hot for long hours thank you flipkart and bajaj installation service I liked it.",5
181291,"BAJAJ 15 L Storage Water Geyser (Popular Plus 15 L, White)","I was ordered geyser on big billions days, this is great deal for winter season, the product is delivered by flipkart with in 4 day that was awesome for me, I think if I use this product around 2 year without any issues, that indicates this product is awesome at this price, so genuine reviews come form after using that product at few months or years, so ...",5
181292,"BAJAJ 15 L Storage Water Geyser (Popular Plus 15 L, White)",Installation person was a very good person with terrific knowledge on product & others.His installation was very perfect & like his personality it adds weightage to the product,5
181293,"BAJAJ 15 L Storage Water Geyser (Popular Plus 15 L, White)","The item was delivered in good condition and in a well packed state, delivered to my doorstep at my 4th floor apartment. Functions very well, really impressed with the water heating time and the safety feature incorporated by the manufacturers.",5
181294,"BAJAJ 15 L Storage Water Geyser (Popular Plus 15 L, White)",Anchor fastner not provided. Even suitable anchor fastner is not available in market. I have to fit basin anchor fastner. Not good experience. There is safety concern.,1
181295,"BAJAJ 15 L Storage Water Geyser (Popular Plus 15 L, White)","This is the best geyser in this price range..After using it for 1month I can truly say that. Heating takes 5-8 mins and doesn't consume much electricity, looks nice in white color, installation was fast and smooth nevertheless you have to pay for the extra fittings.",5
181296,"BAJAJ 15 L Storage Water Geyser (Popular Plus 15 L, White)",It's worth your money. Very classy look and works pretty well.,5
181297,"BAJAJ 15 L Storage Water Geyser (Popular Plus 15 L, White)",Awesome quality...  No complaints with the quality..  But the only thing is accessories like connector pipe and other stuffs weren’t there in the box... Just for that i gave it 4 star.. Otherwise the water heats very fast and remain hot for very long... No doubt in the quality 🥰🥰🥰... Must buy product,4
181298,"BAJAJ 15 L Storage Water Geyser (Popular Plus 15 L, White)","A very good product. Easy installation, Good looks, capacity is good for a family of 4.",5
181299,"BAJAJ 15 L Storage Water Geyser (Popular Plus 15 L, White)",It is very good product at low price,5
181300,"BAJAJ 15 L Storage Water Geyser (Popular Plus 15 L, White)",It's been a month since I bought the product but they have not come to install yet... So disappointed,1
181301,"BAJAJ 15 L Storage Water Geyser (Popular Plus 15 L, White)","Decent product, but a Zero star, Pathetic installation service from Flipkart  They charge 499 for the service which you cannot opt out when you buy the product. These so called service engineer didn't anything, he just hung the heater on the wall on already existing nail and stand..He said the rest of the work like connecting inlet or outlet pipes or the connecting the plug are not his job and we should call a plumber and do it. He was done with it 5 mins and just left. insane. Multiple revie...",1
181302,"BAJAJ 15 L Storage Water Geyser (Popular Plus 15 L, White)",good,4
181303,"BAJAJ 15 L Storage Water Geyser (Popular Plus 15 L, White)",super fast heater,4
181304,"BAJAJ 15 L Storage Water Geyser (Popular Plus 15 L, White)",Very good product,5
181305,"BAJAJ 15 L Storage Water Geyser (Popular Plus 15 L, White)",amazing products,5
181306,"BAJAJ 15 L Storage Water Geyser (Popular Plus 15 L, White)",Fast delivery and same day installationgreat product at very reasonable pricevery satisfied 👍👍👍👍,5
181307,"BAJAJ 15 L Storage Water Geyser (Popular Plus 15 L, White)",Stunning product,5
181308,"BAJAJ 15 L Storage Water Geyser (Popular Plus 15 L, White)",It's worth the price !!,5
181309,"BAJAJ 15 L Storage Water Geyser (Popular Plus 15 L, White)",Takes a bit time to heat the water however it is overall good,5
181310,"BAJAJ 15 L Storage Water Geyser (Popular Plus 15 L, White)",Awesome Product👍🏻👍🏻,4
181311,"BAJAJ 15 L Storage Water Geyser (Popular Plus 15 L, White)",It is a good product of Bajaj,5
181312,"BAJAJ 15 L Storage Water Geyser (Popular Plus 15 L, White)","Good product, You all can trust Bajaj Brand.",5
181313,"BAJAJ 15 L Storage Water Geyser (Popular Plus 15 L, White)","installation service is very bad.install after 4 days and demand 250 only for nut bold and plag which are not provide by company.did not connect the pipe properly,facing leakage problem.water flows slowly.main unit of the item is average.takes time to heat and remain hot not so long as per expected.",1
181314,"BAJAJ 15 L Storage Water Geyser (Popular Plus 15 L, White)",Very nice product,5
181315,"BAJAJ 15 L Storage Water Geyser (Popular Plus 15 L, White)",Awesome product,5
181316,"BAJAJ 15 L Storage Water Geyser (Popular Plus 15 L, White)",wow Best hai,5
181317,"BAJAJ 15 L Storage Water Geyser (Popular Plus 15 L, White)","product is okay, but no contact from the installation team. Finally I had to get it done via a local technician l.",2
181318,"BAJAJ 15 L Storage Water Geyser (Popular Plus 15 L, White)",very nice,5
181319,"BAJAJ 15 L Storage Water Geyser (Popular Plus 15 L, White)","I bought this brand geyser but they lack basic accessories. 1. No connection pipe in this unit. 2. No clamp bolt. 3. No power plug. 4. Safety valve damaged while fitting with external connection pipe, as it doesn't fit this model. Don't buy this product.. Atleast go for those product which doesn't make u run in this lockdown to purchase missed accessories with heavy price and that to from a local manufacturers. Worst experience 😡",1
181320,"BAJAJ 15 L Storage Water Geyser (Popular Plus 15 L, White)",Nice 👍👌,4
181321,"BAJAJ 15 L Storage Water Geyser (Popular Plus 15 L, White)",Nice product and price,5
181322,"BAJAJ 15 L Storage Water Geyser (Popular Plus 15 L, White)",Product looks very nice...... ⭐⭐⭐⭐⭐,5
181323,"BAJAJ 15 L Storage Water Geyser (Popular Plus 15 L, White)",Good product.....,5
181324,"BAJAJ 15 L Storage Water Geyser (Popular Plus 15 L, White)","Very impressive... Awesome products & best thing is u just don't have to regret on this,  so hesitation go for it... Cool product.",5
181325,"BAJAJ 15 L Storage Water Geyser (Popular Plus 15 L, White)",Thanku Flipkart,5
181326,"BAJAJ 15 L Storage Water Geyser (Popular Plus 15 L, White)",Installation completed today and found ok.storage also hold upto 6 hours with heat,5
181327,"BAJAJ 15 L Storage Water Geyser (Popular Plus 15 L, White)",The best quality with price also,5
181328,"BAJAJ 15 L Storage Water Geyser (Popular Plus 15 L, White)",Super product i love it,5
181329,"BAJAJ 15 L Storage Water Geyser (Popular Plus 15 L, White)",Very bad experience with installation....the installation boy is talked ng rudely as I am his servant...and have done crime by purchasing this geyserSorry but I am going to return..,1
181330,"BAJAJ 15 L Storage Water Geyser (Popular Plus 15 L, White)",Good quality.. Thank You Flipcart 😄😄😄,5
181331,"BAJAJ 15 L Storage Water Geyser (Popular Plus 15 L, White)",nice and genuine product...less than my local market price..thanks flipkart,5
181332,"BAJAJ 15 L Storage Water Geyser (Popular Plus 15 L, White)",very good delivery service and the delivery man very good.,5
181333,"BAJAJ 15 L Storage Water Geyser (Popular Plus 15 L, White)",good product,5
181334,"BAJAJ 15 L Storage Water Geyser (Popular Plus 15 L, White)",Awesome,5
181335,"BAJAJ 15 L Storage Water Geyser (Popular Plus 15 L, White)",It takes hours for heating,1
181336,"BAJAJ 15 L Storage Water Geyser (Popular Plus 15 L, White)",Good product,5
181337,"BAJAJ 15 L Storage Water Geyser (Popular Plus 15 L, White)",waste product no heating,1
181338,"BAJAJ 15 L Storage Water Geyser (Popular Plus 15 L, White)",nice product in cheap rate,5
181339,"BAJAJ 15 L Storage Water Geyser (Popular Plus 15 L, White)",It's simply perfect for me ... Easy to use ...value for money,5
181340,"BAJAJ 15 L Storage Water Geyser (Popular Plus 15 L, White)",Best geyser in this price segment because market price is very high then online price,5
181341,"BAJAJ 15 L Storage Water Geyser (Popular Plus 15 L, White)",Very good product from Bajaj. It takes only 3 to 5 minutes to fully heat the 15 litre water. Capacity is also ok for small families. Only drawbacks are-1) Bajaj didn't provide the connecting heat resistance pipe with the geyser.2) Bajaj also didn't provide the wall mounting bolts.3) Installation was not free. You have to find a plumber and have to fit the item.      These all needs extra 800 to 1k inr. from your pocket. So I am giving 4 star.,4
181342,"BAJAJ 15 L Storage Water Geyser (Popular Plus 15 L, White)",Good products,5
181343,"BAJAJ 15 L Storage Water Geyser (Popular Plus 15 L, White)","Product technically is very good, also delivery got within time,But, For installation of geyser, technician was demanding charges to me, to resolve this issue I had to call customer care so many time, and finally, after 5 days, he agreed to install geyser with free of cost,Overall product is good, packing is bestThank you Flipkart.",5
181344,"BAJAJ 15 L Storage Water Geyser (Popular Plus 15 L, White)",Nice product,5
181345,"BAJAJ 15 L Storage Water Geyser (Popular Plus 15 L, White)",Excellent I M Happy,5
181346,"BAJAJ 15 L Storage Water Geyser (Popular Plus 15 L, White)",This is a very good gyser..Heats water in 10 minute..It has power on/off auto system...And its installation and inlet-outlet pipe is also free..,5
181347,"BAJAJ 15 L Storage Water Geyser (Popular Plus 15 L, White)",Nice product,5
181348,"BAJAJ 15 L Storage Water Geyser (Popular Plus 15 L, White)",It's been 8 days and no body came for installation and flipkart has no control over it. Unprofessional behaviour by installation team when they don't care  and denied for installation.Bad experience.. never expected.,1
181349,"BAJAJ 15 L Storage Water Geyser (Popular Plus 15 L, White)",It's more than 24 hr but haven't got any installation team yet.Very poor...,1
181350,"BAJAJ 15 L Storage Water Geyser (Popular Plus 15 L, White)",Best water heater..,5
181351,"BAJAJ 15 L Storage Water Geyser (Popular Plus 15 L, White)","As described in description installation is not provided in all areas ,Bajaj electric customer care is even more worse",1
181352,"BAJAJ 15 L Storage Water Geyser (Popular Plus 15 L, White)",Like it,4
181353,"BAJAJ 15 L Storage Water Geyser (Popular Plus 15 L, White)",Good product 👌,5
181354,"BAJAJ 15 L Storage Water Geyser (Popular Plus 15 L, White)",Good,5
181355,"BAJAJ 15 L Storage Water Geyser (Popular Plus 15 L, White)",No installation still right now,1
181356,"BAJAJ 15 L Storage Water Geyser (Popular Plus 15 L, White)",heating time too long 50mins to 1hr15mins,3
181357,"BAJAJ 15 L Storage Water Geyser (Popular Plus 15 L, White)",Best in price range..I bought it in offer but didn't get free installation so do check once  ✅,4
181358,"BAJAJ 15 L Storage Water Geyser (Popular Plus 15 L, White)",Good product 👍👍❤️,5
181359,"BAJAJ 15 L Storage Water Geyser (Popular Plus 15 L, White)",Takes approximately 60-70mintues to completely warm the water. Consume too much electricity. Not recommend.,1
181360,"BAJAJ 15 L Storage Water Geyser (Popular Plus 15 L, White)",Very good product,5
181361,"BAJAJ 15 L Storage Water Geyser (Popular Plus 15 L, White)",Bad product hiting problem,4
181362,"BAJAJ 15 L Storage Water Geyser (Popular Plus 15 L, White)","Superb product , Excellent service",5
181363,"BAJAJ 15 L Storage Water Geyser (Popular Plus 15 L, White)",I searched lots of products then I bought this one. But I must say it's heating time is not at all good. It takes approx 20-23 min to heat its 20litre capacity.I recommend you to buy v guard geyser its heating time is 8-10 min only of 20 litre capacity.,3
181364,"BAJAJ 15 L Storage Water Geyser (Popular Plus 15 L, White)","Good product,looking wise Good but ita takes much time to heat .",4
181365,"BAJAJ 15 L Storage Water Geyser (Popular Plus 15 L, White)",Should appreciate Bajaj & Flipkart for a wonderful product with a cool price.,5
181366,"BAJAJ 15 L Storage Water Geyser (Popular Plus 15 L, White)",The product is really very good. The heating system is very good. I like it. The delivery was also very fast. I received it 4-5 days earlier than  the expected date.Thank u Flipkart ...It is really awesome....,5
181367,"BAJAJ 15 L Storage Water Geyser (Popular Plus 15 L, White)",Good,4
181368,"BAJAJ 15 L Storage Water Geyser (Popular Plus 15 L, White)","Got it delivered with in 1 day by flipkart, Excellent service from BAJAJ company.▪︎Free geyser installation from bajaj▪︎Free 18 inches inlet and outlet pipes (the bajaj technician will bring it when he comes for installation of geyser)▪︎within the time period of 15mins, the geyser gets heated completely.Best geyser in 15litres range, go for it.Highly recommended.",4
181369,"BAJAJ 15 L Storage Water Geyser (Popular Plus 15 L, White)",that product was very good her features was good and easy to use I recamanded to every one who buy that range product buy This product,5
181370,"BAJAJ 15 L Storage Water Geyser (Popular Plus 15 L, White)",Product very nice 👍👍👍👍,5
181371,"BAJAJ 15 L Storage Water Geyser (Popular Plus 15 L, White)",Heating time is good,4
181372,"BAJAJ 15 L Storage Water Geyser (Popular Plus 15 L, White)",Nice product,5
181373,"BAJAJ 15 L Storage Water Geyser (Popular Plus 15 L, White)",Good,5
181374,"BAJAJ 15 L Storage Water Geyser (Popular Plus 15 L, White)",Best Product From Bajaj ! Really Impressive,5
181375,"BAJAJ 15 L Storage Water Geyser (Popular Plus 15 L, White)",After installation water not coming properly,1
181376,"BAJAJ 15 L Storage Water Geyser (Popular Plus 15 L, White)",Superb,5
181377,"BAJAJ 15 L Storage Water Geyser (Popular Plus 15 L, White)","Review after using 1 monthFirst- company only provide gyser. Apart of this all chargeable(like- tube, fastener,Washbasin connector)Hitting okIf possible go offline same product available on less price and also installation free.",1
181378,"BAJAJ 15 L Storage Water Geyser (Popular Plus 15 L, White)",Nice product.you can buy with close eyes.You have to on switch power before two hour for heating water this is one fault in this I think,5
181379,"BAJAJ 15 L Storage Water Geyser (Popular Plus 15 L, White)","First few days it worked osam after four days it stopped heating, very worst .",1
181380,"BAJAJ 15 L Storage Water Geyser (Popular Plus 15 L, White)",To good day nice product,5
181381,"BAJAJ 15 L Storage Water Geyser (Popular Plus 15 L, White)",Good,5
181382,"BAJAJ 15 L Storage Water Geyser (Popular Plus 15 L, White)",Very good experience,5
181383,"BAJAJ 15 L Storage Water Geyser (Popular Plus 15 L, White)",All is well,4
181384,"BAJAJ 15 L Storage Water Geyser (Popular Plus 15 L, White)",Good,4
181385,"BAJAJ 15 L Storage Water Geyser (Popular Plus 15 L, White)",I am using this bajaj geyser for more than 10 days and I am totally satisfied. The storage tank of this Geyser is wonderful. It can store the hot water for 24 hours or more. It heats quickly and also energy efficient.,5
181386,"BAJAJ 15 L Storage Water Geyser (Popular Plus 15 L, White)",Good,4
181387,"BAJAJ 15 L Storage Water Geyser (Popular Plus 15 L, White)","No plug at the end of geyser. No clips or anything given with this product and service is equally bad, service guy asks us for everything like tape, nails and etc. not sure if we could install it much easier than getting service",1
181388,"BAJAJ 15 L Storage Water Geyser (Popular Plus 15 L, White)",I have purchase the Bajaj geyser item Last year and given the feedback after use of one year- product is good 👍 installation done very quickly and overall 5 star rating from my side.,5
181389,"BAJAJ 15 L Storage Water Geyser (Popular Plus 15 L, White)",Service is very worst don't purchase any electronic goods from online we purchased lost year now we r not getting hot water we rise the compant lost week we r not getting call or service from Bajaj side,1
181390,"BAJAJ 15 L Storage Water Geyser (Popular Plus 15 L, White)",The product should have cleary specify that we provide only wire. 3 pin plug you need to purchase. Such a cheap company.,1
181391,"BAJAJ 15 L Storage Water Geyser (Popular Plus 15 L, White)",Low performance,2
181392,"BAJAJ 15 L Storage Water Geyser (Popular Plus 15 L, White)",It would not be right that the installation and demonstration are cancelled immediately after the product is received.  How would you expect that to have the product installed at the end of the consumer.  Product I will review again.,3
181393,"BAJAJ 15 L Storage Water Geyser (Popular Plus 15 L, White)","Nice product, better heating and efficient",5
181394,"BAJAJ 15 L Storage Water Geyser (Popular Plus 15 L, White)",Low qulity,1
181395,"BAJAJ 15 L Storage Water Geyser (Popular Plus 15 L, White)","Not at all suitable for domestic use...they do not even give the option to return the product and purchase some other geyser of lower storage capacity...for domestic use go for 6liters capacity instead of this bulky, gigantic and burdensome product...",1
181396,"BAJAJ 15 L Storage Water Geyser (Popular Plus 15 L, White)",Ok,4
181397,"BAJAJ 15 L Storage Water Geyser (Popular Plus 15 L, White)",It's fantastic,5
181398,"BAJAJ 15 L Storage Water Geyser (Popular Plus 15 L, White)",Very 3rd class experience with such product.Seller cant provides any kind of survice such that installation,1
181399,"BAJAJ 15 L Storage Water Geyser (Popular Plus 15 L, White)",I am Happy thanks Flipkart,5
181400,"BAJAJ 15 L Storage Water Geyser (Popular Plus 15 L, White)",Best product more then 5star rating.,5
181401,"BAJAJ 15 L Storage Water Geyser (Popular Plus 15 L, White)",Nice 👍 product,4
181402,"BAJAJ 15 L Storage Water Geyser (Popular Plus 15 L, White)",Nice pic,5
181403,"BAJAJ 15 L Storage Water Geyser (Popular Plus 15 L, White)",Very nice........,4
181404,"BAJAJ 15 L Storage Water Geyser (Popular Plus 15 L, White)",Ultimate product i like it,5
181405,"BAJAJ 15 L Storage Water Geyser (Popular Plus 15 L, White)","Product is good. For installation, Pipes, plug, they charged me 820 which is expensive I think. If installation is free you can save 500. So I think if installation is free you can go for it.",4
181406,"BAJAJ 15 L Storage Water Geyser (Popular Plus 15 L, White)",Awesome product,5
181407,"BAJAJ 15 L Storage Water Geyser (Popular Plus 15 L, White)",Good product,5
181408,"BAJAJ 15 L Storage Water Geyser (Popular Plus 15 L, White)",Satisfactory,4
181409,"BAJAJ 15 L Storage Water Geyser (Popular Plus 15 L, White)",Best at this price 👍👍,4
181410,"BAJAJ 15 L Storage Water Geyser (Popular Plus 15 L, White)",Delivered a brand new geyser full of dent from a local market named as flipcart.And the seller reject to replace the order. It's smells like flipcart big billion day gonna be a big SCAM in 2021.,1
181411,"BAJAJ 15 L Storage Water Geyser (Popular Plus 15 L, White)",Good..... Got on offer,4
181412,"BAJAJ 15 L Storage Water Geyser (Popular Plus 15 L, White)",Installation is not yet done by the team,1
181413,"BAJAJ 15 L Storage Water Geyser (Popular Plus 15 L, White)",Good one,4
181414,"BAJAJ 15 L Storage Water Geyser (Popular Plus 15 L, White)",Wow very nice. product,5
181415,"BAJAJ 15 L Storage Water Geyser (Popular Plus 15 L, White)",Giving only 1 star as review as they won't install it for many days,1
181416,"BAJAJ 15 L Storage Water Geyser (Popular Plus 15 L, White)",Nice product. Heating time is lil more 20 to 25 min. Rest all ok,4
181417,"BAJAJ 15 L Storage Water Geyser (Popular Plus 15 L, White)",Plug with wire not available 😔,2
181418,"BAJAJ 15 L Storage Water Geyser (Popular Plus 15 L, White)",Not good,1
181419,"BAJAJ 15 L Storage Water Geyser (Popular Plus 15 L, White)",Nice product. Good working.,5
181420,"BAJAJ 15 L Storage Water Geyser (Popular Plus 15 L, White)",I loved it...must buy...Flipkart denial for Instalation..then i got bajaj’s helpline number from google...then they sent the person for free installation,5
181421,"BAJAJ 15 L Storage Water Geyser (Popular Plus 15 L, White)","Installation not provided, also quality is not so good as expected",1
181422,"BAJAJ 15 L Storage Water Geyser (Popular Plus 15 L, White)",Installing not done,1
181423,"BAJAJ 15 L Storage Water Geyser (Popular Plus 15 L, White)",There is no response from installation team after 48h.,1
181424,"BAJAJ 15 L Storage Water Geyser (Popular Plus 15 L, White)",Within 2 days thre is leakage in pipes and pipe is damaged. Company provides bad quality pipes. When i registered complaint then they say company not provided pipes warranty. So i purchase s.s pipes .,1
181425,"BAJAJ 15 L Storage Water Geyser (Popular Plus 15 L, White)",Outfoolw very slow,1
181426,"BAJAJ 15 L Storage Water Geyser (Popular Plus 15 L, White)","Product is fine  with in this range but flipkart miss communicating to their customer .. no has came for installation after passing 15 days have done self installation , .. so think its disaster",4
181427,"BAJAJ 15 L Storage Water Geyser (Popular Plus 15 L, White)",Time to heat is very bad not suitable for 3 floor building very bad not except from bajaj,4
181428,"BAJAJ 15 L Storage Water Geyser (Popular Plus 15 L, White)",I am not happy,1
181429,"BAJAJ 15 L Storage Water Geyser (Popular Plus 15 L, White)",No installation persone did not came no response for this product waste support dont buy this product,1
181430,"BAJAJ 15 L Storage Water Geyser (Popular Plus 15 L, White)",Very bad product. Not working in just one month. Don't buy it ..  horrible . Not expected from bajaj,1
181431,"BAJAJ 15 L Storage Water Geyser (Popular Plus 15 L, White)",bad product,1
181432,"BAJAJ 15 L Storage Water Geyser (Popular Plus 15 L, White)","Service was not good,heating is very poor.",1
181433,"BAJAJ 15 L Storage Water Geyser (Popular Plus 15 L, White)",Good quality but heating time taken more,4
181434,"BAJAJ 15 L Storage Water Geyser (Popular Plus 15 L, White)",Veey bad quality product,1
181435,"BAJAJ 15 L Storage Water Geyser (Popular Plus 15 L, White)",It's a damage products. Have short circuit problem,1
181436,"BAJAJ 15 L Storage Water Geyser (Popular Plus 15 L, White)","No free installation, heating time is approx 30 min.worst product",1
