Unnamed: 0,Product,Review_Summary,Rating
3195,Amazon Tap - Alexa-Enabled Portable Bluetooth Speaker,"Guys, the Tap does everything Echo does and it's portable! Use it at home for everything, at work on your desk for music, weather, etc, and even poolside as a portable speaker.",5.0
3196,Amazon Tap - Alexa-Enabled Portable Bluetooth Speaker,Amazon Tap is awesome. Seems to do everything the Echo does for a lesser price.,5.0
3197,Amazon Tap - Alexa-Enabled Portable Bluetooth Speaker,"This is a great product. I also have a Dot but the ability take this anywhere is a huge bonus, the hands free mode works just like the Dot, and the sound is great. I use the Tap all the time; working on projects, making shopping lists, playing games, to turning on the lights. I looked at the Echo but even with a battery pack it didn't seem very mobile.",5.0
3198,Amazon Tap - Alexa-Enabled Portable Bluetooth Speaker,Got this on sale for 100! Replaces my 500 cds! Must buy as long as you have Prime!,5.0
3199,Amazon Tap - Alexa-Enabled Portable Bluetooth Speaker,i got to say that love it!! makes it easier to play music without pairing any device to it and perfect sound for my needs.,5.0
3200,Amazon Tap - Alexa-Enabled Portable Bluetooth Speaker,Happy I bought this. Makes everything easier to control.,5.0
3201,Amazon Tap - Alexa-Enabled Portable Bluetooth Speaker,"I wouldn't buy it again...the software doesn't seem as well integrated with the hardware on this machine. I also have an Echo and I don't have the same connectivity issues with it that I do with this. I liked the features available with this...portability mainly with a long battery life, but with plagued by connectivity issues I can't say I would recommend it. I have looked at reviews online since purchasing and have discovered I am not the only one that feels this way. The sound, when it is connected and responding, is amazing.",3.0
3202,Amazon Tap - Alexa-Enabled Portable Bluetooth Speaker,Great Bluetooth speaker with the added benefit of Alexa,4.0
3203,Amazon Tap - Alexa-Enabled Portable Bluetooth Speaker,My wife uses the Tap mostly to listen to music. She loves the fact that she can take it into aNY room of the house. No more having to turn up the sound to hear I'm different parts of the house.,5.0
3204,Amazon Tap - Alexa-Enabled Portable Bluetooth Speaker,Great speaker and the sound is great. Use it every day. Love being able to use Alexa when attached to my network.,5.0
3205,Amazon Tap - Alexa-Enabled Portable Bluetooth Speaker,Got this for the family and we all love it. Great gift,4.0
3206,Amazon Tap - Alexa-Enabled Portable Bluetooth Speaker,"This little speaker has quickly become a family favorite for portability and music streaming. My kids have quickly learned that Alexa is their personal DJ when hooked up to the Amazon Prime Unlimited Music program. Battery life is great and sound quality is adequate for our purposes. Some audiophiles might not like the lack of bass, but it does the job for our family.",5.0
3207,Amazon Tap - Alexa-Enabled Portable Bluetooth Speaker,"Excellent sound and fun. Very portable and easy to carry in backpack. All the features of Echo and Echo Dot but you must ""Tap"" the button before speaking.",5.0
3208,Amazon Tap - Alexa-Enabled Portable Bluetooth Speaker,Great tech works well highly recommended no issues,5.0
3209,Amazon Tap - Alexa-Enabled Portable Bluetooth Speaker,Want to try one and Best Buy put up the best price. Th tap is good for usage on the wifi network. Use it to play music outside around the house.,5.0
3210,Amazon Tap - Alexa-Enabled Portable Bluetooth Speaker,"Fantastic sound from such a small speaker, excellent! Not as impressed with its other potential capabilities- more difficult to set those up & get all the various apps needed to do things like get weather, order items, etc.. Wish it came with more pre installed I guess.",4.0
