Unnamed: 0,Product,Review_Summary,Rating
1210,Amazon - Echo Plus w/ Built-In Hub - Silver,A fun little device on the cutting edge of consumer artificial intelligence. Sp aker sounds pretty good. Alexa does have some problems understanding how I ask questions a fair amount of the time.,4.0
1211,Amazon - Echo Plus w/ Built-In Hub - Silver,I was wishing I good set it up to my pool equipment.,4.0
1212,Amazon - Echo Plus w/ Built-In Hub - Silver,Excellent item... above and beyond my expectations,5.0
1213,Amazon - Echo Plus w/ Built-In Hub - Silver,It works great and is easy too use. The salesman was a tremendous help.,5.0
1214,Amazon - Echo Plus w/ Built-In Hub - Silver,"I bought this for myself and another one for a gift, you must have Wi-Fi to use as well as a smart phone.",4.0
1215,Amazon - Echo Plus w/ Built-In Hub - Silver,Good product and wasy to set up. Works well with smart lights.,5.0
1216,Amazon - Echo Plus w/ Built-In Hub - Silver,"This is great for inquisitive minds. Alexa plays music, turns the light on, answers questions and so much more.",5.0
1217,Amazon - Echo Plus w/ Built-In Hub - Silver,"ECHO PLUS OFFERS SO MUCH MORE FOR THE SMART HOME., HOWEVER, I HAVE HAD THE DOT FOR A LONG TIME AND YESTERDAY I BOUGHT 5 ECHO DOTS FOR MY CHILDREN .GREAT PRODUCT.",5.0
1218,Amazon - Echo Plus w/ Built-In Hub - Silver,great sound. Love the music and the electrical devices you can work with it.,5.0
1219,Amazon - Echo Plus w/ Built-In Hub - Silver,My home is about 80% automated with help from ALEXA...We want to have one in each room.,5.0
1220,Amazon - Echo Plus w/ Built-In Hub - Silver,"I really purchased this for my wife to use as a Bluetooth speaker knowing that maybe we would find something else for it to do. I'm glad I did, now. We have Christmas tree lights going off and on, lamps dimming at precise measures, ""Alexa, light 30 percent"", and am looking at the other many, many things that this can do. It's easy to setup, too.",5.0
1221,Amazon - Echo Plus w/ Built-In Hub - Silver,Easy to set up. We really enjoy getting real time local weather. It translates Spanish very efficiently. We also enjoy the music we can easily select but would appreciate a higher quality sound. Linking the Echo to lighting is a snap. Highly recommended!,5.0
1222,Amazon - Echo Plus w/ Built-In Hub - Silver,LOVE it. Never had one before. Easy to set up and use.,5.0
1223,Amazon - Echo Plus w/ Built-In Hub - Silver,"Alexa works pretty good, music sounds good. Just exploring all her skills",4.0
1224,Amazon - Echo Plus w/ Built-In Hub - Silver,i have really enjoyed my new echo plus.i enjoy music every morning with the news,5.0
1225,Amazon - Echo Plus w/ Built-In Hub - Silver,Bought this for our son for Christmas. He uses it in his room and loves it. Alexa also wakes him up for school in the morning.,5.0
1226,Amazon - Echo Plus w/ Built-In Hub - Silver,this is so much better than the echo dot. the smart hub is pretty cool,5.0
1227,Amazon - Echo Plus w/ Built-In Hub - Silver,Awesome product and cool design and a great color I would recommend to a friend,5.0
1228,Amazon - Echo Plus w/ Built-In Hub - Silver,"I already have Alexa at home and since it was on sale, made a nice christmas gift..",5.0
1229,Amazon - Echo Plus w/ Built-In Hub - Silver,"It works well and sounds decent, but the hub portion of this is not as easy to use as Samsung.",3.0
1230,Amazon - Echo Plus w/ Built-In Hub - Silver,"This was a gift that I gave to my daughter at our family Christmas party. She loves it, especially the ease of set up and the attached hub so she can control her lights & her nest thermostat. This has also gone over well with the Grand Children.",5.0
1231,Amazon - Echo Plus w/ Built-In Hub - Silver,Echo plus seems to work as they say. I have it running two lights so far. Plan on setting up seven more. Nice product.,5.0
1232,Amazon - Echo Plus w/ Built-In Hub - Silver,Alexa items are easy to use and set up. Works easily with the smart plug and bulb.,5.0
1233,Amazon - Echo Plus w/ Built-In Hub - Silver,This is the music lovers best friend. My wife and kids love asking Alexa to play ANY song. The sound quality is great,5.0
1234,Amazon - Echo Plus w/ Built-In Hub - Silver,"Seamlessly control your house, tell Alexa to turn on your favorite music, and play games. Not much else you could ask for, especially for the price!",5.0
1235,Amazon - Echo Plus w/ Built-In Hub - Silver,I received an original echo two years ago and use it in my office. This year I decided to get one for the house and was amazed at all the features I hadn’t taken advantage of. Primarily the smart home features. This was great because it came with a lightbulb.,5.0
1236,Amazon - Echo Plus w/ Built-In Hub - Silver,"I was a bit reluctant to jump on the Alexa wagon, but now that I have, I don’t know why! This is awesome. Still figuring out all the things I can do but only because there are so many!",5.0
1237,Amazon - Echo Plus w/ Built-In Hub - Silver,This will be a great gift for the whole house too enjoy.,5.0
1238,Amazon - Echo Plus w/ Built-In Hub - Silver,Works seamlessly and easy to set up and use. A great product.,5.0
1239,Amazon - Echo Plus w/ Built-In Hub - Silver,This product is so very convenient I have day I don't want to get up and she helps me,5.0
1240,Amazon - Echo Plus w/ Built-In Hub - Silver,"My kids like to play music, I like the online rafio and weather service.",4.0
1241,Amazon - Echo Plus w/ Built-In Hub - Silver,We love our Echo plus. Alexa is my go to girl for everything. Music sounds great in the kitchen.,5.0
1242,Amazon - Echo Plus w/ Built-In Hub - Silver,"Great purchase. We bought this to make it easier to turn off lights, etc. It's perfect for connecting the whole house.",4.0
1243,Amazon - Echo Plus w/ Built-In Hub - Silver,"I enjoy the premium sound with this Amazon Echo Plus speaker. Of course it also connects to Alexa, so I can do everything from making calls to listening to music, and finding recipes for cooking meals.is compatible with smart home technology for hands-free control of lighting and other functions. I like the Amazon Echo Plus speaker because it adapts to my speech patterns.",5.0
1244,Amazon - Echo Plus w/ Built-In Hub - Silver,Sound quality is very good & Sleek design is nice.,5.0
1245,Amazon - Echo Plus w/ Built-In Hub - Silver,"We bought this for our son who wanted nothing for christmas... he uses it all the time. With lights, music, and locking the door. He absolutely loves it. We are now buying another home base for the rest of the house.",5.0
1246,Amazon - Echo Plus w/ Built-In Hub - Silver,Works great used to put the lights on when I was in Texas during the holidays.,5.0
1247,Amazon - Echo Plus w/ Built-In Hub - Silver,"A great value and I love it, sounds great and works",4.0
1248,Amazon - Echo Plus w/ Built-In Hub - Silver,"Saw Echo dot at my parents. Had to have one. Then I saw the plus. It was so easy to set up. Love the the music steaming. Love the light bulb that came with mine. Makes my life so much easier when I don’t have an empty hand. Guess what, I went back and bought one for my sister for Christmas. Very pleased.",5.0
1249,Amazon - Echo Plus w/ Built-In Hub - Silver,The Echo Plus is an Awesome Device. Lots of information just by speech.,5.0
1250,Amazon - Echo Plus w/ Built-In Hub - Silver,"Quite satisfied w/ purchase ... However, paying 50 dollars for a smart bulb has proven to be a superfluous expense ...",4.0
1251,Amazon - Echo Plus w/ Built-In Hub - Silver,Very helpful for someone with disabilities. Saves a lot steps.Responsive and fun to use.,3.0
1252,Amazon - Echo Plus w/ Built-In Hub - Silver,Best Buy associate explained product very well. Easy to use,5.0
1253,Amazon - Echo Plus w/ Built-In Hub - Silver,I bought this for my wife and absolutely loves it. Alexa is so smart and helps my wife with everything. Like a personal assistant,5.0
1254,Amazon - Echo Plus w/ Built-In Hub - Silver,Love the Alexa. Very convenient to use to listen to music and turn on my lights.,5.0
1255,Amazon - Echo Plus w/ Built-In Hub - Silver,Bought this for my parents to use with their Amazon prime account. Sure they will love it.,5.0
1256,Amazon - Echo Plus w/ Built-In Hub - Silver,Wanted to expand Alexa into multiple rooms of the house. This device added easily into the system and can now listen to music in multiple rooms.,4.0
1257,Amazon - Echo Plus w/ Built-In Hub - Silver,I purchase the Echo Plus as a Christmas gift but set it up early so that it could be used right out of the box. I was impressed how easy the setup was. I'll find out later how it sounds and works.,5.0
1258,Amazon - Echo Plus w/ Built-In Hub - Silver,This is the best...fast to play music and check weather and lots of other questions,5.0
1259,Amazon - Echo Plus w/ Built-In Hub - Silver,Nice smart speaker. I do wish there was a LG TV Alexa skill.,4.0
1260,Amazon - Echo Plus w/ Built-In Hub - Silver,My new Echo Plus exceeds my expectations. The speaker's sound is just what I wanted and the included Hue bulb is great.,5.0
1261,Amazon - Echo Plus w/ Built-In Hub - Silver,We already have the Echo in our house. I got this for my son for his apartment and he loves it.,5.0
1262,Amazon - Echo Plus w/ Built-In Hub - Silver,"received as a Christmas gift. really works well, we can turn the living room light on and off from anywhere with cell phone, so you don't need to remember to plug in a timer when going away. plays amazon music and sound is amazing",5.0
1263,Amazon - Echo Plus w/ Built-In Hub - Silver,"I purchased it to control my lights & introduce myself to Alexa & AI, but I find myself using it for all sorts of things and enjoy using it. I can now control my front door Arlo camera by asking Alexa to show the live feed in to my TV, and get my Robots vacuum cleaner to start work , plus listen to the latest weather conditions & do my normal google search via Alexa . I am seriously hooked in to my Alexa!!!!",5.0
1264,Amazon - Echo Plus w/ Built-In Hub - Silver,Love it so far but I have a lot to learn yet. My son loves it also.,5.0
1265,Amazon - Echo Plus w/ Built-In Hub - Silver,"This product is great. Still finding out everything that it can do, but completely satisfied.",4.0
1266,Amazon - Echo Plus w/ Built-In Hub - Silver,Would be so much better if it had an internal battery,4.0
1267,Amazon - Echo Plus w/ Built-In Hub - Silver,I enjoyed and I bought an echo too To make all my family take the pleasure of it,5.0
1268,Amazon - Echo Plus w/ Built-In Hub - Silver,Definitely worth the money. The sound is awesome!!,5.0
1269,Amazon - Echo Plus w/ Built-In Hub - Silver,my wife loves alexa it was an early Christmas present,5.0
1270,Amazon - Echo Plus w/ Built-In Hub - Silver,So far I love the echo products. I ended up buying a combination of 8 for Christmas gifts,5.0
1271,Amazon - Echo Plus w/ Built-In Hub - Silver,"I have both a 1st gen Echo and now the new Echo Plus. I am impressed with the sound quality improvement, especially the bass. Don’t get me wrong, it’s no Bose system but it sounds great for every day use.",4.0
1272,Amazon - Echo Plus w/ Built-In Hub - Silver,Very pleased. Based upon reviews I did expect the speaker to be louder and have a bit better sound but not a big deal. For big sound just turn on the stereo.,5.0
1273,Amazon - Echo Plus w/ Built-In Hub - Silver,"My family Loves this. My 3 boys love asking alexa to tell a joke, or to make toot noises. It's super helpful in with news and weather updates.",4.0
1274,Amazon - Echo Plus w/ Built-In Hub - Silver,"Easy to set up, easy to use apps are awesome and sounds great!",5.0
1275,Amazon - Echo Plus w/ Built-In Hub - Silver,I absolutely love this product. It does so many things not the least of which is music. Ask it anything and it will answer.,5.0
1276,Amazon - Echo Plus w/ Built-In Hub - Silver,Sound is amazing! Wish Alexa knew more things I get a lot of I’m sorry I don’t know that which is unfortunate.,4.0
1277,Amazon - Echo Plus w/ Built-In Hub - Silver,Purchased the Echo Plus and couldn't be more pleased. Easy to use.,5.0
1278,Amazon - Echo Plus w/ Built-In Hub - Silver,"On sale & was purchased as a gift for Christmas, really great deal!",5.0
1279,Amazon - Echo Plus w/ Built-In Hub - Silver,Love the concept and how I can make my whole house a smart house.,5.0
1280,Amazon - Echo Plus w/ Built-In Hub - Silver,"Decent sounding music device...easy to connect and use the app. Getting custom routines set up with smart home (vivint, hue, etc) takes some trial and error figuring out commands. Would buy again.",5.0
1281,Amazon - Echo Plus w/ Built-In Hub - Silver,"Really enjoy the Echo Plus, this is a must have for all homes!",5.0
1282,Amazon - Echo Plus w/ Built-In Hub - Silver,So far the Echo has been extreme useful. My husband just says start my day in the morning and it gives him the weather and traffic before he leaves for work. It is also is nice to tell it to turn on and off lights in the home with the smart bulbs. Overall I'm extremely satisfied with my Echo plus.,5.0
1283,Amazon - Echo Plus w/ Built-In Hub - Silver,I bought this for my 14 year old daughter and she loves it!!!!,5.0
1284,Amazon - Echo Plus w/ Built-In Hub - Silver,This amazon Alexa plus is awesome...it’s works great and easy to set up,5.0
1285,Amazon - Echo Plus w/ Built-In Hub - Silver,Love this product. I can ask questions and play music...also link my lights to it!,5.0
1286,Amazon - Echo Plus w/ Built-In Hub - Silver,"I am so glad that I bought this Echo, it has made it easier to automate my music, and my lights throughout my house. We are still learning to use it, but hope to add our thermostat as well to the items I can control with my Alexa.",5.0
1287,Amazon - Echo Plus w/ Built-In Hub - Silver,Not sure. It was a gift. We'll be setting up after Christmas,5.0
1288,Amazon - Echo Plus w/ Built-In Hub - Silver,This is the first Echo that we have used and really like it. It is easy to set up according to my husband. There are things that we would like to do but don't have instructions on how to do them.,5.0
1289,Amazon - Echo Plus w/ Built-In Hub - Silver,"Echo plus is great for home use, to ask questions and turn the lights on when you away.",5.0
1290,Amazon - Echo Plus w/ Built-In Hub - Silver,I am not the most tech savvy person and found this very easy to get set up without any help.,5.0
1291,Amazon - Echo Plus w/ Built-In Hub - Silver,It great to have in the home it has become invaluable,4.0
1292,Amazon - Echo Plus w/ Built-In Hub - Silver,Excellent combination and easy to install and setup.,5.0
1293,Amazon - Echo Plus w/ Built-In Hub - Silver,When I tried to hook it up it wouldn't recognize my internet. I will have to contact best buy when I get home and have their guys come out to see if they can get it working,3.0
1294,Amazon - Echo Plus w/ Built-In Hub - Silver,"Surprisingly entertaining, and a diverse selection of apps make for a fun addition to the house. Adding lights and enabled plugs adds to the fun and practicality as well.",5.0
1295,Amazon - Echo Plus w/ Built-In Hub - Silver,Set up was simple. We liked so much we bought one for my Mom,5.0
1296,Amazon - Echo Plus w/ Built-In Hub - Silver,Great product. I use it everyday. It’s a great way to automate your home,5.0
1297,Amazon - Echo Plus w/ Built-In Hub - Silver,Very happy with amazon not hesitating to integrate their products with third party integration.”Crestron,5.0
1298,Amazon - Echo Plus w/ Built-In Hub - Silver,I looked at Google Home .. And the Echo. I went with the Echo after I spoke to a Best Buy employee. They helped me sort out the pros and cons. I do love all the skills that are possible. Its like another person in my apt sometimes. (I live alone) the Echo adjusts my lights and plays my Pandora. I'm pretty much loving it.,5.0
1299,Amazon - Echo Plus w/ Built-In Hub - Silver,I love my echo so easy to hook up and great sound quality,5.0
1300,Amazon - Echo Plus w/ Built-In Hub - Silver,It’s easily connected to my Sony android tv and works great!,5.0
1301,Amazon - Echo Plus w/ Built-In Hub - Silver,I didn’t know what I was missing out on until I got an Echo Plus,5.0
1302,Amazon - Echo Plus w/ Built-In Hub - Silver,Purchased the Echo Plus because of the built in Zigbee hub. It controls my Philips Hue bulbs throughout the house. very easy setup. Speaker is sufficient for the area I have it in.,5.0
1303,Amazon - Echo Plus w/ Built-In Hub - Silver,"I’ve been hesitant to purchase this item, didn’t feel there was an actual need. Alexa has changed my mind. I use this daily with timers and turning off appliances, checking weather and adjusting my heat. Alexa can even arm the alarm system.",5.0
1304,Amazon - Echo Plus w/ Built-In Hub - Silver,Great sound quality. Easy to set up. Easy to use. Looks good too.,5.0
1305,Amazon - Echo Plus w/ Built-In Hub - Silver,Let there be light - this has been awesome to be able to walk in to a room and with a spoken word from me have the light go on. Equally impressive is that it gradually goes bright so you aren’t blinded by it.,5.0
1306,Amazon - Echo Plus w/ Built-In Hub - Silver,"Eco plus is an amazing product, it integrates with most of the products...U can set the music, reminders, buy products.. what not...definitely a worthy purchase!!!",5.0
1307,Amazon - Echo Plus w/ Built-In Hub - Silver,Setting this up was about as easy as one could expect. The Echo Plus is an amazing device and I got a free smart light bulb with a package deal. :-),5.0
1308,Amazon - Echo Plus w/ Built-In Hub - Silver,"You simply must have a virtual voice activated assistant. I can not recommend this product enough. If you don’t have one, you will eventually. If you can’t afford you, you aren’t a Big Baller.",5.0
1309,Amazon - Echo Plus w/ Built-In Hub - Silver,Easy to set up and pair other compatible items by enabling skills through the Amazon app. I've been to best buy twice for information and how to questions and all seems to be going well. It's only been a week and still have a lot to learn about Elexa's capabilities,5.0
1310,Amazon - Echo Plus w/ Built-In Hub - Silver,"I love my amazon echo plus as bad as it sounds I don’t have to get out of bed to turn the lights off, my fans on or off, and even my tv. We love alexa!",5.0
1311,Amazon - Echo Plus w/ Built-In Hub - Silver,"I really like this device! Right now I only have 1 light sync'd with it, but looking forward to adding more! Another feature I like is the ability to put items on both my shopping and errand lists! I can't wait to find out all the things it can do for me!",5.0
1312,Amazon - Echo Plus w/ Built-In Hub - Silver,"As a newbie in smart home technology, I was attracted to the Echo Plus because of the built-in Zigbee hub which means it can connect directly to products like the Philips Hue line of smart bulbs without the need for a separate smart hub. Combine that with the power of Alexa voice commands and I was able to get my smart home up and running in a matter of minutes.",5.0
1313,Amazon - Echo Plus w/ Built-In Hub - Silver,I bought this for my finance.i bought it for Christmas he left bed it,5.0
1314,Amazon - Echo Plus w/ Built-In Hub - Silver,Sound and response is good. Works well for area coverage.,4.0
1315,Amazon - Echo Plus w/ Built-In Hub - Silver,"The echo plus is the way to go and with the hue, no need to install a dimmer!",5.0
1316,Amazon - Echo Plus w/ Built-In Hub - Silver,"The echo plus has been great .easy to set up and work.its all I thought it would be and more ,love it",5.0
1317,Amazon - Echo Plus w/ Built-In Hub - Silver,Love operation of this system.Bought the mini afterwards for another room.,5.0
1318,Amazon - Echo Plus w/ Built-In Hub - Silver,"I wondered about buying one before making the decision - now even after just a few weeks I wonder how I managed. It has some gimmicky things yes but also can help out with a lot of very useful ideas such as weather, traffic and lists. Would recommend one to anyone",5.0
1319,Amazon - Echo Plus w/ Built-In Hub - Silver,"Bought eh Echo Plus on a whim - it was on sale and I figured, ""why not."" I am really enjoying it. Apart form the basic news and weather reporting, I enjoy my morning trivia. I also use the music from Amazon a lot. It's been nice having a ""holiday"" station at my disposal. The Echo Plus is easy to set up and use and definitely has a lot of features, many of which I am still learning.",5.0
1320,Amazon - Echo Plus w/ Built-In Hub - Silver,"Love this product, super easy to use and able to have a lot of fun with this with entertaining guests and ourselves.",5.0
1321,Amazon - Echo Plus w/ Built-In Hub - Silver,It has great speakers and is very easy to set up love my echo,5.0
1322,Amazon - Echo Plus w/ Built-In Hub - Silver,"Bought this for my mom that is electronically challenged and she loves it. Makes her feel like she is a tech wiz. Makes me feel better about her ability to turn lights on and off as she comes and goes. More importantly, she is in her 70s and Iives alone, she can make a phone call using Alexa from anywhere she has an echo. I bought her 3 to cover her whole house. This means if she falls down and can’t get to her phone she can dial me or 911 with her voice.....a must have!!!",5.0
1323,Amazon - Echo Plus w/ Built-In Hub - Silver,Still figuring out what all I can do with it but the Echo was extremely easy to hook up. The instructions that came with it made everything very clear. The speaker doesnt get room filling loud if you want to play music but thankfully it has an audio out jack so I just hooked it up to some speakers.,5.0
1324,Amazon - Echo Plus w/ Built-In Hub - Silver,Surprisingly useful. Ben 2 Echo is much better than Gen 1. Definitely recommend.,5.0
1325,Amazon - Echo Plus w/ Built-In Hub - Silver,We love the new Echo! So easy to set up and use!!!,5.0
1326,Amazon - Echo Plus w/ Built-In Hub - Silver,Alexa usually works well but it has turned on things when I did not tell it to.,4.0
1327,Amazon - Echo Plus w/ Built-In Hub - Silver,its a lot of fun playing with alexa comands the speakers sound great. i'm glad i purchase it.,5.0
1328,Amazon - Echo Plus w/ Built-In Hub - Silver,I love this product would really recommend to any one!,5.0
1329,Amazon - Echo Plus w/ Built-In Hub - Silver,"Love being able to set a timer, play music and turn in my Wi-Fi connected lamp without moving from my couch.",5.0
1330,Amazon - Echo Plus w/ Built-In Hub - Silver,"This has got to be the best electronic purchase I’ve made in recent months! Easy to set up, so many skills to enable, Alexa knows it all! The range is about 30 feet for it to hear and recognize my voice. Be sure to speak clearly. Great purchase, and exceeds my expectations. Works great with my iOS devices too!",5.0
1331,Amazon - Echo Plus w/ Built-In Hub - Silver,This may be an incremental upgrade to the original Amazon Echo but is definitely worth it. Miles ahead from Google Home.,5.0
1332,Amazon - Echo Plus w/ Built-In Hub - Silver,As I made my home a smart home I know I know I made a smart choice with Amazon Echo and Philips light bulbs. I'm looking forward to adding more smart gadgets to my collection.,5.0
1333,Amazon - Echo Plus w/ Built-In Hub - Silver,"The light came free with the Echo (didn’t know) but now that I have that one I want to get all my lights like this one! It’s so great and convenient to be able to tell it to turn off right before I leave the room instead of having to walk over there to pull the cord. Or even better when you forget to turn the switch off before you sit down, that’s the worst!",5.0
1334,Amazon - Echo Plus w/ Built-In Hub - Silver,Love asking Alexis all kinds of questions and listening to great Amazon Music!!!!,5.0
1335,Amazon - Echo Plus w/ Built-In Hub - Silver,Very easy to set up.Changed how I do a lot of things.,5.0
1336,Amazon - Echo Plus w/ Built-In Hub - Silver,Pretty cool product.Features are limited unless you spend a lot more money buying other things you can connect and interface with. But the basic unit with one lightbulb is a pretty good start. Just know going into it that you will be shelling out a lot more to expand the system.,4.0
1337,Amazon - Echo Plus w/ Built-In Hub - Silver,"The sound of the Echo Plus is good, and the matte black color looks stylish. The Phillips Hugh Bulb that was included with my purchase is nice and convenient.",5.0
1338,Amazon - Echo Plus w/ Built-In Hub - Silver,"Purchased as a gift for my 14 year old son. He absolutely loves it. Uses to place music, ask questions and turn off his lights!",5.0
1339,Amazon - Echo Plus w/ Built-In Hub - Silver,Still learning what all she can do but it definitely makes life easier.,5.0
1340,Amazon - Echo Plus w/ Built-In Hub - Silver,"She could perform some tasks ,but most things she didn't know. So agrivating.",2.0
1341,Amazon - Echo Plus w/ Built-In Hub - Silver,We love the Echo II. Its an awesome product. Great price too,5.0
1342,Amazon - Echo Plus w/ Built-In Hub - Silver,My husband loves the ability to listen to anything and to be able to run the living room light when he comes in instead of trying to find the light switch.,5.0
1343,Amazon - Echo Plus w/ Built-In Hub - Silver,I have been greatly impressed with the Alexa. A friend loves calling me and asking her Alexa questions. We share alot of laughs just discovering all the things she can do. So I just had to purchase an Alexa for myself. I'm just beginning set my Alexa up. I hope it's easy because I'm not tech. salve. I've got to go and get started with the set-up.,5.0
1344,Amazon - Echo Plus w/ Built-In Hub - Silver,I mainly bought the Echo plus for my kids but I’m using it more than they do. Excellent product!!,5.0
1345,Amazon - Echo Plus w/ Built-In Hub - Silver,"I purchased this, in addition to several other Alexa products, because I wanted the hub to connect several smart home devices. So far it has been pretty easy to set up and use. I'm happy with the sound also.",5.0
