Unnamed: 0,Product,Review_Summary,Rating
945,Amazon - Echo Plus w/ Built-In Hub - Silver,Works great. Turns H&A up and down. Tv on and off. Lights on and off. All from Alexa. You do have to have apps and special lights.,5.0
946,Amazon - Echo Plus w/ Built-In Hub - Silver,I LOVE Alexa and my Echo device (and Smart Bulb) so much I bought 4 more Echos and 8 more bulbs with more to come soon...,5.0
947,Amazon - Echo Plus w/ Built-In Hub - Silver,"So I went to the store, purchased and gifted.it was a snap.",5.0
948,Amazon - Echo Plus w/ Built-In Hub - Silver,"Love the convenience of being able to turn on a light or other appliances connected to smart switches with voice commands. Also very convenient music streaming, news and weather reports.",5.0
949,Amazon - Echo Plus w/ Built-In Hub - Silver,"We replaced our old echo for this one with a smart hub, works great",5.0
950,Amazon - Echo Plus w/ Built-In Hub - Silver,It is a nice hub to use with lights and plugs. Sometimes echo does not work.,4.0
951,Amazon - Echo Plus w/ Built-In Hub - Silver,Speaker was used as a giveaway and everyone wanted it! It was a huge hit at our conference. Would buy again.,5.0
952,Amazon - Echo Plus w/ Built-In Hub - Silver,I bought this for my moms birthday and she loves it.,5.0
953,Amazon - Echo Plus w/ Built-In Hub - Silver,I like this smart machine and will recommend to my friends,5.0
954,Amazon - Echo Plus w/ Built-In Hub - Silver,"purchased this product while was on sale, very easy to pair, looks well made, very happy with it.",5.0
955,Amazon - Echo Plus w/ Built-In Hub - Silver,Love it. It’s a lot of fun. Great speakers too provides a lot of great information and fun too!,5.0
956,Amazon - Echo Plus w/ Built-In Hub - Silver,"Really enjoying this device so far,,,my smart phone is basic Tracfone...currently adding smart lighting...will probably switch to a tablet for controlling and adding to a future (limited) smart home",5.0
957,Amazon - Echo Plus w/ Built-In Hub - Silver,"Great item, we love our Echo. If only she could mow the yard for the kids....",5.0
958,Amazon - Echo Plus w/ Built-In Hub - Silver,Alexa walks you through every step which I found helpful.,5.0
959,Amazon - Echo Plus w/ Built-In Hub - Silver,We have sonos speakers and a Honeywell Lyric thermostat. It took a little searching on google to get things linked. Now that they are linked we can play music in any room and change our home temperature by using Alexa.,5.0
960,Amazon - Echo Plus w/ Built-In Hub - Silver,"I'm not a techie, but after days of trying to hook up, I gave up. I don't know if it was the Echo Plus or my carrier ATT Uverse causing the issue, but it would NOT connect. So, back to the store it went. Even with checking out blogs on the internet for assistance...none of it worked.",3.0
961,Amazon - Echo Plus w/ Built-In Hub - Silver,Alexa Is amazin. I love the features their great.Just love it,5.0
962,Amazon - Echo Plus w/ Built-In Hub - Silver,This speaker is truly amazing and being able to control my lights makes it even better,5.0
963,Amazon - Echo Plus w/ Built-In Hub - Silver,"My new Echo Plus has been a fun find. It is working as advertised, and we are still exploring the many, many ways you can use this device. You do need some tech savvy on apps, wifi, and willingness to do some reading on the various ""skills"" but it is well worth it. Already added an Echo Dot to the mix.",5.0
964,Amazon - Echo Plus w/ Built-In Hub - Silver,"Love the knowledge it gives, and easy for my older brother who does. It so technology.",5.0
965,Amazon - Echo Plus w/ Built-In Hub - Silver,I enjoy the amazon Alexa. It is an lot of fun. It will be more helpful once I have completely set up./,4.0
966,Amazon - Echo Plus w/ Built-In Hub - Silver,I’ve enjoy my echo since I purchased it ! The light bulbs are great to I will be buying more products,5.0
967,Amazon - Echo Plus w/ Built-In Hub - Silver,Wanted one for awhile so finally got one. Works great. Way better than Siri on my iPhone. Speaker works great for music. Very happy overal,4.0
968,Amazon - Echo Plus w/ Built-In Hub - Silver,These items are easy to set up. They have added value to our home.,5.0
969,Amazon - Echo Plus w/ Built-In Hub - Silver,"Works great! I bought 2, 1 for the kitchen and 1 for master bath.",4.0
970,Amazon - Echo Plus w/ Built-In Hub - Silver,I will definitely recommend this product . The tech support is also easy and friendly. Alexa keeps my husband company during the day answering his questions.,5.0
971,Amazon - Echo Plus w/ Built-In Hub - Silver,"I originally purchased this to use as a Bluetooth speaker for my wife's music but soon realized that we would use this much more than we thought. Ya, turning on and off lights is good and being able to dim with the included bulb is pretty great but there are hundreds of smart home type of apps that work with this including my Sony Google TV and more show up regularly. Makes it almost too easy to be lazy.",5.0
972,Amazon - Echo Plus w/ Built-In Hub - Silver,Pretty fun little gadget. Kids love playing with it. Not even sure of all the things it can do yet,4.0
973,Amazon - Echo Plus w/ Built-In Hub - Silver,I am extremely satisfied with my purchase.New toy!,5.0
974,Amazon - Echo Plus w/ Built-In Hub - Silver,"Bought 4 devices for my kids... they report its simple to start up, easy to use and fun!",5.0
975,Amazon - Echo Plus w/ Built-In Hub - Silver,"The ultimate lazy life is happening before my eyes. Now I love technology , always have . But let’s be honest , telling Alexa to turn the lights off and on and ask her to tell you a joke as examples . It really is great and I’m now addicted to the Hue line as well.",5.0
976,Amazon - Echo Plus w/ Built-In Hub - Silver,Alexa ricks the plus is the best ever buy it you will love it,5.0
977,Amazon - Echo Plus w/ Built-In Hub - Silver,Have yet to explore all the aspects. Enjoy using it daily.,5.0
978,Amazon - Echo Plus w/ Built-In Hub - Silver,"It is so fun to talk to Alexa, the sound is also very high quality, I am very happy with my purchase.",5.0
979,Amazon - Echo Plus w/ Built-In Hub - Silver,One of my favorite purchases. Very easy to set up. Already works with Dish hope Directv gets it soon.,5.0
980,Amazon - Echo Plus w/ Built-In Hub - Silver,"I saw this product used by friends and was so impressed, I bought one for my husband for Christmas. .",5.0
981,Amazon - Echo Plus w/ Built-In Hub - Silver,Love being able to turn a light on when I walk inside with no hands! Alexa is a lifesaver,5.0
982,Amazon - Echo Plus w/ Built-In Hub - Silver,So far I have used Alexa to play music. My only comment would be that I wish there was a larger variety of opera music.,4.0
983,Amazon - Echo Plus w/ Built-In Hub - Silver,"bought this as a present for the wife, but as I relaxed for the holiday requested six hours of different song play. The wife enjoyed the music as the music emanated through the open areas of our house. The wife received information on measures for recipes, weather updates, etc. this will be one of those classic gifts.",5.0
984,Amazon - Echo Plus w/ Built-In Hub - Silver,Echo is nice but it could be better allowing you to connect to anything that is on your WIFI network without having to buy several different hubs.,4.0
985,Amazon - Echo Plus w/ Built-In Hub - Silver,I need to buy all the additional parts but it’s great,5.0
986,Amazon - Echo Plus w/ Built-In Hub - Silver,I have enjoyed learning about home automation using Echo plus and consumers need to know that this comes with having to buy additional equipment to get the most out of Alexa.,5.0
987,Amazon - Echo Plus w/ Built-In Hub - Silver,I love this product! I love everything about it!!!,5.0
988,Amazon - Echo Plus w/ Built-In Hub - Silver,I have two dots and this and the functionality between them is awesome. I can’t wait to see how it improves through time. Great quality speaker and build.,5.0
989,Amazon - Echo Plus w/ Built-In Hub - Silver,Really enjoy having the echo to use to control the lights and music in our house,5.0
990,Amazon - Echo Plus w/ Built-In Hub - Silver,Wife loves her Alexa. Uses it with her pandora and the kids love talking to it.,5.0
991,Amazon - Echo Plus w/ Built-In Hub - Silver,I love Alexa although sometimes she has a hard time understanding so I find myself repeating commands such as “Alexa turn off lights in bedroom” . Overall she’s amazing and she tells jokes and very up to date with current events,4.0
992,Amazon - Echo Plus w/ Built-In Hub - Silver,"We have several, this one was a Christmas gift for our daughter. We love the convenience of creating lists and some home automation. Once you get started, you come up with more things to use it for.",5.0
993,Amazon - Echo Plus w/ Built-In Hub - Silver,Great way to introduce family and friends to A.I. Technology.,5.0
994,Amazon - Echo Plus w/ Built-In Hub - Silver,this is my third Alexa and combined with my fire TV and now the lights my couch time has increased. Love the new technology!!,5.0
995,Amazon - Echo Plus w/ Built-In Hub - Silver,What an amazing piece of technology. I was impressed with the sound quality,5.0
996,Amazon - Echo Plus w/ Built-In Hub - Silver,I bought it for my family and everyone loves it! Definitely recommend buying one!,5.0
997,Amazon - Echo Plus w/ Built-In Hub - Silver,"I gave as a gift to my kids for Christmas, they are enjoying Alexa.",5.0
998,Amazon - Echo Plus w/ Built-In Hub - Silver,"This was a present for my mother, very fun! She loves looking things up and it's easier to talk it out.",5.0
999,Amazon - Echo Plus w/ Built-In Hub - Silver,Alexa is amazing and the Phillips bulb works seamlessly with it.,5.0
1000,Amazon - Echo Plus w/ Built-In Hub - Silver,This is such a great addition to our house! Amazon Echo plus is incredible for all the things it is capable of doing.,5.0
1001,Amazon - Echo Plus w/ Built-In Hub - Silver,"We use Alexa to ask simple questions like - what time is the basketball game? and she usually responds correctly. If you ask a more detailed question, she may not have an answer. We like to play Jeopardy and listen to local radio stations using Alexa. I am sure the device will get better with more use and updates.",4.0
1002,Amazon - Echo Plus w/ Built-In Hub - Silver,"Decided to go for the model just below this one. I didn't need the integrated ""hub"" features. (Phillips Hue does require this, but I decided to stick with my current Insteon hub).",5.0
1003,Amazon - Echo Plus w/ Built-In Hub - Silver,I love this product and it was one of my Best Buy’s from best buy,5.0
1004,Amazon - Echo Plus w/ Built-In Hub - Silver,"Waste of money, ask Alexa a question and you are lucky if you get an answer instead of I'm not sure.",2.0
1005,Amazon - Echo Plus w/ Built-In Hub - Silver,I love how Alexa can control almost all smart things and help control lights and power on and off devices to help us get ready for the day. The music is connected directly to Amazon Prime Music and I love how the sound is clear and crisp. You can call out to Alexa from far away and she’ll add items to your shopping list and the Alexa app is so simple to view the lists and control your smart things.,5.0
1006,Amazon - Echo Plus w/ Built-In Hub - Silver,I have an Echo that I bought from Best Buy several months ago. So when it came to buying one for my son & his family for Christmas I knew where to come. It’s an excellent information hub!,5.0
1007,Amazon - Echo Plus w/ Built-In Hub - Silver,Perfect start for smart home.works perfect with Echo,5.0
1008,Amazon - Echo Plus w/ Built-In Hub - Silver,"I take 1 star off, because I had problems to syncing it with my W-FI.",4.0
1009,Amazon - Echo Plus w/ Built-In Hub - Silver,This was a great purchase! I love my echo plus with the hue light bulb. The set up is really easy and you can hook up your amazon account and order from Alexa. You can program your lights to be turned on at a certain time every day or even download the app and turn them on remotely. I love how this product is compatible with nest products.,5.0
1010,Amazon - Echo Plus w/ Built-In Hub - Silver,"Good stereo sound, but will not control some devices without the use of an external hub.",4.0
1011,Amazon - Echo Plus w/ Built-In Hub - Silver,Easy to use no Complains at all. Added all the smart plugs to the skills and works perfect.,5.0
1012,Amazon - Echo Plus w/ Built-In Hub - Silver,This is my first Amazon Echo and it was a great buy. The Echo Plus works amazing. The voice control of the lights in my house works perfect. No need for a hub.,5.0
1013,Amazon - Echo Plus w/ Built-In Hub - Silver,I love having Alexa in my home. Alexa has helped from recipes to relaxing sleep sounds all night,5.0
1014,Amazon - Echo Plus w/ Built-In Hub - Silver,"Purchased my first Amazon Echo Plus after researching online and watching video reviews. A friend of mine had one and he showed me the features. The device was easy to setup and has worked great since. I use it to control lights, fans and play music.",5.0
1015,Amazon - Echo Plus w/ Built-In Hub - Silver,Having a great experience using the Alexa Echo plus product.,5.0
1016,Amazon - Echo Plus w/ Built-In Hub - Silver,Pleased with Alexa. Have not used light yet. I’ll update after use,5.0
1017,Amazon - Echo Plus w/ Built-In Hub - Silver,Love my Alexa! Having lots of fun asking her questions and enjoy listening to music on it.,5.0
1018,Amazon - Echo Plus w/ Built-In Hub - Silver,I also have the smaller echo and this sounds much better. Love all the features!,5.0
1019,Amazon - Echo Plus w/ Built-In Hub - Silver,They are both responsive to each other and it gives me convenience. I don't have to turn off the lights and all I do is lay down and ask Alexa to turn off the light. All my lights are connected to my Echo Plus.,5.0
1020,Amazon - Echo Plus w/ Built-In Hub - Silver,"My family have enjoyed ALEXA in the house, she is very smart and she does lots of research for the family! We are truly glad that we made the purchase",5.0
1021,Amazon - Echo Plus w/ Built-In Hub - Silver,Great entertainment when friends are over. The knowledge and jokes are tons of fun.,5.0
1022,Amazon - Echo Plus w/ Built-In Hub - Silver,This is the second one I’ve bought this year for gifts,5.0
1023,Amazon - Echo Plus w/ Built-In Hub - Silver,This Alexa series 2 sounds better and preforms better than the previous model. It picks up the voices 10x better and the sound quality is on a Bose level(fills the whole room). Me and my family spends more quality time on the product!,5.0
1024,Amazon - Echo Plus w/ Built-In Hub - Silver,I have had the competitive products and nothing compares.,5.0
1025,Amazon - Echo Plus w/ Built-In Hub - Silver,Alexis is the new favorite name. Great for the college student,5.0
1026,Amazon - Echo Plus w/ Built-In Hub - Silver,Great Echo!! Friend really liked it!! It really does what he wants it to do and he connected his lights to the device. Everything works well.,5.0
1027,Amazon - Echo Plus w/ Built-In Hub - Silver,So far so good. I enjoy being able to communicate with friends and family using the Drop In Feature.,4.0
1028,Amazon - Echo Plus w/ Built-In Hub - Silver,Alexa a great product the light too. They are working fine.,5.0
1029,Amazon - Echo Plus w/ Built-In Hub - Silver,Great sound for the money. Easy to set up also have a dot that I like,5.0
1030,Amazon - Echo Plus w/ Built-In Hub - Silver,"Love the sound, I have a google home and is not as loud as this echo",5.0
1031,Amazon - Echo Plus w/ Built-In Hub - Silver,A must have!!!!!!!!!!!!!! Everyone should get one.,5.0
1032,Amazon - Echo Plus w/ Built-In Hub - Silver,"great sound , easy to use, wife love it, connect with wifi and all my phones.",4.0
1033,Amazon - Echo Plus w/ Built-In Hub - Silver,and practical easy to use just the start of my IOT home,5.0
1034,Amazon - Echo Plus w/ Built-In Hub - Silver,We love our Alexia! We mostly use it for music and to control the lights.,5.0
1035,Amazon - Echo Plus w/ Built-In Hub - Silver,Very pleased to have this new Echo Plus and get started on automation of the home in stages. Knowing that it can continue to improve with new products and apps is a plus for owning this device.,5.0
1036,Amazon - Echo Plus w/ Built-In Hub - Silver,Bought one for Living Room and the other for the bedroom. Home wifi needs to be boosted but Alexa would connect through out which caused complications along with Bluetooth speakers. Once straightened out works great.,4.0
1037,Amazon - Echo Plus w/ Built-In Hub - Silver,"I have no idea how my family ever lived without these products! Since purchasing the Alexa Hub and Hue bulb, we've purchased Echo Dots for our kitchen and son's room. We absolutely love the convenience of the bulbs and Alexa is a life saver on so many levels.",5.0
1038,Amazon - Echo Plus w/ Built-In Hub - Silver,"This was a present for my husband who originally had asked for a radio for his home office. He set it up relatively quick and was amazed at the sound quality. He loved the versatility and that he could have a specific radio station played or a random song as well as tell a joke, etc. It has been fun for all of us and we are looking into getting the smaller ""dots"" for other rooms now. He commented that he would NEVER get rid of this! It's very fun and functional. The Smart bulb is very handy as well. Love it!",5.0
1039,Amazon - Echo Plus w/ Built-In Hub - Silver,"I have been contemplating purchasing an Echo product for some time now. I finally did it and I am so pleased I did. It was extremely easy to set up. I add my lights to the process and now it is so easy to turn lights on before I get to the room. For me, I know this will be the tip of the iceberg. I will now start looking at what else I can add to the Echo. Love the product. Great Buy!!!",5.0
1040,Amazon - Echo Plus w/ Built-In Hub - Silver,I got this for my husband. He likes it and the setup is easy.,4.0
1041,Amazon - Echo Plus w/ Built-In Hub - Silver,"I wasn't sure I would use this item when I purchased it for my family. However, I just signed up for Amazon unlimited music after testing it on radio stations and playing games with the grandkids. I want to hook up the lighting feature as well. Speaker is excellent quality and quite enjoyable to listen to.",5.0
1042,Amazon - Echo Plus w/ Built-In Hub - Silver,I really enjoy the Echo plus. Speaker sorry bds good for playing music and I enjoy having Alexa turn on my lights.,5.0
1043,Amazon - Echo Plus w/ Built-In Hub - Silver,Works great very easy to install made connecting other devices even easier,5.0
1044,Amazon - Echo Plus w/ Built-In Hub - Silver,"A wonderful use of creativity and design, where installation was a breeze and use was pure enjoyment",5.0
1045,Amazon - Echo Plus w/ Built-In Hub - Silver,"I purchased this as a second Alexa. Couldn't figure out why it came with the Hue Light bulb until I learned that the new version of Alexa has a built-in hub. It's a gift for my spouse, but I can't wait to set it up and get more bulbs to automate our home lighting.",5.0
1046,Amazon - Echo Plus w/ Built-In Hub - Silver,Great addition to all the other electronics in our home,4.0
1047,Amazon - Echo Plus w/ Built-In Hub - Silver,Bought the Amazon - Echo Plus + Philips Hue Bulb - Black for my kitchen it is awesome also came with free smart bulb.,5.0
1048,Amazon - Echo Plus w/ Built-In Hub - Silver,"Love my Echo Plus, echo, echo spot and Ech show. Very satisfied with the products. They work great individually or with each other.",5.0
1049,Amazon - Echo Plus w/ Built-In Hub - Silver,Installation was easy. Directions for use was excellent. Best buy employees were very helpful explaining the product. Best buy always makes the buying process very easy and enjoyable. Looking forward to using the echo plus for many years.,5.0
1050,Amazon - Echo Plus w/ Built-In Hub - Silver,Great product. Works as advertised and fun to use.,5.0
1051,Amazon - Echo Plus w/ Built-In Hub - Silver,It is goodagood and accurate..it is very convienient.,4.0
1052,Amazon - Echo Plus w/ Built-In Hub - Silver,"great for the elderly, makes life a lot easier for everyone",5.0
1053,Amazon - Echo Plus w/ Built-In Hub - Silver,I purchased two Amazon in Echo Plus and two dots plus four fire sticks and the hub Philips hue for lamp for the family at Christmas 2017. I’m so happy with these purchases and learning so much with Alexa. You can start your daily routine with Alexa and program it to whatever you would like to include news weather music horoscope ALSO you can start your day off with a compliment and I think is very important. Alexa gave me the BEST CHILI RECIPE I MEAN THE BEST it’s called Chili I. I want my husband to use Alexa to stay organized for business dates and reminders. This is the way to go,5.0
1054,Amazon - Echo Plus w/ Built-In Hub - Silver,I think these products are great. I enjoy using them.,5.0
1055,Amazon - Echo Plus w/ Built-In Hub - Silver,Great sound and function! ❤️ Alexa! The color and style of the silver plus looks great with our newly finished basement.,5.0
1056,Amazon - Echo Plus w/ Built-In Hub - Silver,Very good price for the product. Sounds good and fun and easy to set up.,5.0
1057,Amazon - Echo Plus w/ Built-In Hub - Silver,Still seeing if if I like alexa like to try and set up lighting,4.0
1058,Amazon - Echo Plus w/ Built-In Hub - Silver,"Love the shopping lists feature, listening to music ... having so much fun",5.0
1059,Amazon - Echo Plus w/ Built-In Hub - Silver,I have several Amazon Echo's throughout my house. Home automation is great and these work with everything that I have.,5.0
1060,Amazon - Echo Plus w/ Built-In Hub - Silver,This is a great product but we exchanged the unit for the 2nd generation because of space limitations. It works great too.,5.0
1061,Amazon - Echo Plus w/ Built-In Hub - Silver,"Have 1st gen Echo and Dot and a 2nd gen Dot. Wanted this over regular Echo, because I prefer the look and better speakers.",5.0
1062,Amazon - Echo Plus w/ Built-In Hub - Silver,Since installing the Amazon Echo we have been having fun with talking to Alexa. Also the music feature is great,5.0
1063,Amazon - Echo Plus w/ Built-In Hub - Silver,"I had my doubts when I first purchased it. But after just a day I had synced it with my thermostat, lights, TV, Bose sound system, and many more. Amazing product.. couldn’t be happier.",5.0
1064,Amazon - Echo Plus w/ Built-In Hub - Silver,"Great device, but I noticed based on the WiFi connection that Alexa can react slower at times. Especially when asking the device to turn off bulbs, or any smart devices.",4.0
1065,Amazon - Echo Plus w/ Built-In Hub - Silver,It's nice to be able to listen to music in the morning and setting reminders is extremely helpful and I love being able to operate my light bulb remotely,5.0
1066,Amazon - Echo Plus w/ Built-In Hub - Silver,"Took it out of the box and played with it for a while. Then I lost connection with it and now it no longer recognizes my phone #. Called Amazon they said they would work on the problem, no call back yet.",3.0
1067,Amazon - Echo Plus w/ Built-In Hub - Silver,Great and easy even for someone that is not tech savvy,5.0
1068,Amazon - Echo Plus w/ Built-In Hub - Silver,Echo Plus is everything I expected and more. Plus easy to set up.,5.0
1069,Amazon - Echo Plus w/ Built-In Hub - Silver,GREAT PRICE FOR HOLIDAYS COMBO WORKS WELL NO NEED FOR EXTERNAL HUB,5.0
1070,Amazon - Echo Plus w/ Built-In Hub - Silver,Hard to review as I purchased for my son as a present,5.0
1071,Amazon - Echo Plus w/ Built-In Hub - Silver,The bundle will help to test Philips hue light. Purchased additional tplink plug.,5.0
1072,Amazon - Echo Plus w/ Built-In Hub - Silver,It is an ok device but I find Google home to be better and more promising in the future,3.0
1073,Amazon - Echo Plus w/ Built-In Hub - Silver,"Love, love, love my echo plus! Is great that it has a built in bridge...great way to start a system for your smart home!Love being able to program lights to come on and off from phone...",5.0
1074,Amazon - Echo Plus w/ Built-In Hub - Silver,This Echo has great sound for such a a small device. It is easy to set up and use. I am finding new tasks Alexa can do each day.,5.0
1075,Amazon - Echo Plus w/ Built-In Hub - Silver,I bought this for my mom and dad they loved it. Thank you,5.0
1076,Amazon - Echo Plus w/ Built-In Hub - Silver,"So yesterday evening i decided to purchase an Amazon Echo. Is the machine intrusive yeah i guess it could be if you allow it. I purchased it because of its home automation and other fantastic capabilities. Just to name a few of those capabilities. With a subscription you will have an unprecedented amount of music you can listen to, that in itself was worth it. Some other things include sports travel recipes and traffic. The home automation part lock doors turn on lights random lighting when on vacation..",5.0
1077,Amazon - Echo Plus w/ Built-In Hub - Silver,"We love Alexa! Great addition to our family! Lol But seriously, you can rely on Alexa....",5.0
1078,Amazon - Echo Plus w/ Built-In Hub - Silver,Alexa turns on the lights and when I say “ Alexa good night” she turns them off. Love her!,5.0
1079,Amazon - Echo Plus w/ Built-In Hub - Silver,Got this as a present for my fiancé for Christmas will update,5.0
1080,Amazon - Echo Plus w/ Built-In Hub - Silver,"I enjoy Alexa, she reminds me of appointment and alerts me when my packages arrive.",5.0
1081,Amazon - Echo Plus w/ Built-In Hub - Silver,The Amazon - Echo Plus is good buy it buy it you will love it,4.0
1082,Amazon - Echo Plus w/ Built-In Hub - Silver,"Fun gadget. Plays songs, various entertainment, still learning all it can do",4.0
1083,Amazon - Echo Plus w/ Built-In Hub - Silver,We purchased 3 of the Eco Plus and out two adult children really like their Eco Plus. They are having a lot of fun with it we are still learning,5.0
1084,Amazon - Echo Plus w/ Built-In Hub - Silver,Great item and easy to use. Very helpful and entertaining,5.0
