Unnamed: 0,Product,Review_Summary,Rating
1085,Amazon - Echo Plus w/ Built-In Hub - Silver,Excellent product. Turns on and off supported devices by asking it. Live walking into a room and asking Alexa to turn on a light. Poof it’s done. Or locking and unlocking the front door. Arming and disarming my security system. If you’re looking to turn your house into a smarthome I strongly recommend the Amazon Echo Plus,5.0
1086,Amazon - Echo Plus w/ Built-In Hub - Silver,Received an Echo Plus as a Christmas present. Absolutely love it. We went back & purchased a Dot & more light bulbs.,5.0
1087,Amazon - Echo Plus w/ Built-In Hub - Silver,Salesman told me the big one was better so I bought it. My daughter gave me the small one for Christmas. Does the same thing. Salesmen are apparently undertrained or a bunch of liars!,4.0
1088,Amazon - Echo Plus w/ Built-In Hub - Silver,I love this product and plan to expand my Alexa and Echo network.,5.0
1089,Amazon - Echo Plus w/ Built-In Hub - Silver,Purchased as a gift for the family. Can’t wait to use it.,5.0
1090,Amazon - Echo Plus w/ Built-In Hub - Silver,I already had the 1st gen Echo. This one has considerably more options that I can use. I highly recommend this item.,5.0
1091,Amazon - Echo Plus w/ Built-In Hub - Silver,"Is a notch up product.. with inbuilt hub, echo has opened up the door for easy connectivity with other products.",5.0
1092,Amazon - Echo Plus w/ Built-In Hub - Silver,If you like to control smart gadgets this is definitely for you!,5.0
1093,Amazon - Echo Plus w/ Built-In Hub - Silver,Gave it as a gift to provide a sense of safety and security for someone living in the country. Turning the lights on before entering the house is a big deal when you live alone.,5.0
1094,Amazon - Echo Plus w/ Built-In Hub - Silver,"The Echo Plus was demonstrated for us at Best Buy. We were a bit skeptical but bought to check it out. Wow! are we impressed! We tell it to turn on and turn off our lights in the living room, family room, and bedroom. Also it can dim the lights more than once. Need the local weather forecast, just ask. Want to listen to Christmas music? Yes, again. Want to know the distance to someplace or the population of some city or country, yes! We're still discovering what it can do and it seems limitless. Absolutely love this!!",5.0
1095,Amazon - Echo Plus w/ Built-In Hub - Silver,This does not give great answers and the connection is not that great. Exchanging for a GOOGLE Home,2.0
1096,Amazon - Echo Plus w/ Built-In Hub - Silver,We all love ALEXA! You can play games like Jeopardy or would you rather family edition. The kids love to have Alexa tell them jokes.,4.0
1097,Amazon - Echo Plus w/ Built-In Hub - Silver,Alexa Exceed expectations in it ability to control,5.0
1098,Amazon - Echo Plus w/ Built-In Hub - Silver,"I've had an Amazon Echo and Dot for over a year now. I really wanted to develop the Smart Device usage around my house and when the upgraded Echo i just had to have it. It is a great device. I use the drop in feature to communicate with others in the house, especially when they are upstairs, without having to yell. The smart hub is amazing. Attaching to smart devices is much more seamless than with the 1st gen echo. Just got it so time will tell, but the 2nd gen Echo devices are worth it.",5.0
1099,Amazon - Echo Plus w/ Built-In Hub - Silver,Works great with WeMo and Philips Hue. Great sound and voice recognition.,4.0
1100,Amazon - Echo Plus w/ Built-In Hub - Silver,"Loud speaker, very responsive. Makes it easier that the smart hub is built into it than having to buy another piece of equipment.",5.0
1101,Amazon - Echo Plus w/ Built-In Hub - Silver,Very easy to set up. I mostly control the lights with my Hue cell phone app. Very convenient. I have 4 lamps hooked up to the light bulbs now. I plan on doing most of my house in the future. I listen to music and get weather updates from the Echo. My husband uses the echo as an alarm.,5.0
1102,Amazon - Echo Plus w/ Built-In Hub - Silver,We the concept to learn and adapt to the ever changing word. This product should stand out.,5.0
1103,Amazon - Echo Plus w/ Built-In Hub - Silver,I love that I have the ability to catch up on news and have this crazy thing turn on and off my lights. Love it!!,5.0
1104,Amazon - Echo Plus w/ Built-In Hub - Silver,It has very good voice recognition; even with the grandchildren throwing all kinds of crazy questions at it. Speaker quality is top of the line. Everyone that has tried it out at our house loves it.,5.0
1105,Amazon - Echo Plus w/ Built-In Hub - Silver,The Echo is a great addition for my busy household. The voice commands to play music is excellent. The fact I can sit on my couch and control the lights and other items just by saying what i want is just amazing.,5.0
1106,Amazon - Echo Plus w/ Built-In Hub - Silver,"I love Alexa! Great sound, unlimited music, used the bulb and synchronized it...Simple 2 use....",5.0
1107,Amazon - Echo Plus w/ Built-In Hub - Silver,Very easy to setup. Had no issues at all . Nice having hub inside . Bulb sync was a breeze,5.0
1108,Amazon - Echo Plus w/ Built-In Hub - Silver,"I bought this and an Echo Dot just in case the Dot didn't do everything I needed. The Dot worked fine, so I returned the full-featured Echo Plus.",4.0
1109,Amazon - Echo Plus w/ Built-In Hub - Silver,Upgraded to the Plus with a lot of the accessories.,5.0
1110,Amazon - Echo Plus w/ Built-In Hub - Silver,We returned it. Could not give answers to our questions even though the answers were easily found on google.,2.0
1111,Amazon - Echo Plus w/ Built-In Hub - Silver,"This is a great entry level Alexa product. The speaker is adequate, but the inclusion of the Philip’s hue bulb makes it feel like a good deal",5.0
1112,Amazon - Echo Plus w/ Built-In Hub - Silver,This was an awesome gift for someone very special and they enjoy it as much as I do mine would recommend product,4.0
1113,Amazon - Echo Plus w/ Built-In Hub - Silver,You are able to control you lights and other electrical devices with the Echo Plus,5.0
1114,Amazon - Echo Plus w/ Built-In Hub - Silver,"I truly love this item ,its amszing good . Will do",5.0
1115,Amazon - Echo Plus w/ Built-In Hub - Silver,This Alex's device is fantastic and would recommend it for anyone. Especially for people with physical disabilities. We are enjoying all of its features.,5.0
1116,Amazon - Echo Plus w/ Built-In Hub - Silver,Had the Echo Plus over a week and this thing is amazing. Great sound and easy to move around. A little tricky with the set up but works great.,5.0
1117,Amazon - Echo Plus w/ Built-In Hub - Silver,Easy set up and very user friendly for my children,5.0
1118,Amazon - Echo Plus w/ Built-In Hub - Silver,"My DIL loves it. Does everything she had read about. My grandson is a bit disappointed that Alexa can't carry on a conversation. LOL. However, he is only 8.",5.0
1119,Amazon - Echo Plus w/ Built-In Hub - Silver,Purchased this for my wife. All the lights are now voice activated. The sound it great from the built in speaker.,5.0
1120,Amazon - Echo Plus w/ Built-In Hub - Silver,awesome product my wife and I love it makes home automation simple,5.0
1121,Amazon - Echo Plus w/ Built-In Hub - Silver,"We finally decided to try the Echo system, after months and months of debate. We purchased the Echo Plus & an Echo Dot. The Plus easily handles our main two floors and the Dot handles our upstairs. The Plus's speakers are incredible for its size. We both agree we made the right choice to get the Plus.",5.0
1122,Amazon - Echo Plus w/ Built-In Hub - Silver,"I bought this for my brother and his wife. They love it! Not only does it control their Nest thermostat, it works with their expanding environment of Philips Hue bulbs.",5.0
1123,Amazon - Echo Plus w/ Built-In Hub - Silver,works like a dream.use it daily.phone feature is really cool.like it.,5.0
1124,Amazon - Echo Plus w/ Built-In Hub - Silver,Smart Home=Happy Home!This lightbulb is simple...all you need to do is speak to it,5.0
1125,Amazon - Echo Plus w/ Built-In Hub - Silver,A perfect gift for someone who has everything and a busy schedule,5.0
1126,Amazon - Echo Plus w/ Built-In Hub - Silver,Purchased the product for a gift. Has not been used yet,5.0
1127,Amazon - Echo Plus w/ Built-In Hub - Silver,We have two echo ourselves and purchased this as a gift for someone. We have smart plugs for our lamps that Alexa turns on/off.,4.0
1128,Amazon - Echo Plus w/ Built-In Hub - Silver,It made a great Christmas present for my wife. Plus...I get it too...Works great. Great order and delivery from Best Buy.,5.0
1129,Amazon - Echo Plus w/ Built-In Hub - Silver,Great item for controling your lights in my home even when I'm away.,5.0
1130,Amazon - Echo Plus w/ Built-In Hub - Silver,"This is our first Echo so nothing to compare it to, but so far so good! Sound is great. Fun to use and has been helpful for information needed quickly!",5.0
1131,Amazon - Echo Plus w/ Built-In Hub - Silver,The echo is great for choosing music and getting information. The voice is very soothing.,5.0
1132,Amazon - Echo Plus w/ Built-In Hub - Silver,Easy to set up. Performs well. Nice Product For The Money,5.0
1133,Amazon - Echo Plus w/ Built-In Hub - Silver,Bought this Echo for my wife. She loves how just by speaking she can listen to any type of music. It sounds pretty good too.,5.0
1134,Amazon - Echo Plus w/ Built-In Hub - Silver,I purchased my Eco for the holidays. It took me considerable time to get minimally operational. It is rather complex to hook up to other devises. So far it is only hooked up to my Dot. I wish there were more varieties of ways to learn how to use it. I am not nearly able to make use of it yet. But...it does look exciting if I ever get there.,4.0
1135,Amazon - Echo Plus w/ Built-In Hub - Silver,The built in hue allows the echo plus to automatically search and finds connectable devices. The larger speaker area assists in better sound and the alexa to hear my voice!!,5.0
1136,Amazon - Echo Plus w/ Built-In Hub - Silver,I love Alexa...She has become my best friend. Thanks,5.0
1137,Amazon - Echo Plus w/ Built-In Hub - Silver,Kind of hard adding smart items but when you do it’s nice to just talk and not get on computer or smart phone to control,5.0
1138,Amazon - Echo Plus w/ Built-In Hub - Silver,"I really enjoy the sound. It sounds so full. My only disappointment is the limited functionality of the built in hub. I had to purchase the Hue Hub to get full functionality. Other than that, I love it.",4.0
1139,Amazon - Echo Plus w/ Built-In Hub - Silver,Great Christmas gift! The hubby loved it . Just read the manual before setting up!!,4.0
1140,Amazon - Echo Plus w/ Built-In Hub - Silver,"It's awesome. Feels like ""company."" Takes commands on the first try and the sound fills the room beautifully! My guests love it too!",5.0
1141,Amazon - Echo Plus w/ Built-In Hub - Silver,No complaints easy and extremely fun to use. Alexa can do it all,5.0
1142,Amazon - Echo Plus w/ Built-In Hub - Silver,Bought an echo plus and it has been better than I expected. Primarily use it for music in the LR but we are starting to use it for other functions such as the weather and playing jeopardy.,5.0
1143,Amazon - Echo Plus w/ Built-In Hub - Silver,Love this combination package I got while on sale. Amazon Echo Plus is responsive and easy to use. Great sound quality. Easy to integrate with other services such as the Hue Bulb. Just need to get more bulbs to complete my setup.,5.0
1144,Amazon - Echo Plus w/ Built-In Hub - Silver,"I like being able to turn on lights, music and the thermostat in our home!",5.0
1145,Amazon - Echo Plus w/ Built-In Hub - Silver,Alexa is awesome to have at home makes things fun and easy,5.0
1146,Amazon - Echo Plus w/ Built-In Hub - Silver,I have an Amazon Prime account so I started downloading apps and playing all kinds of music on this. I also can control my Hue hub (you need one for certain timers and things) and Wemo plus outlets for my non wifi lights and LED's in the kitchen cabinets.,5.0
1147,Amazon - Echo Plus w/ Built-In Hub - Silver,"I bought this for my Mom for Christmas and ended up she got me one too! Great for everyone, speaker sounds great easy to set up and my Mom ended up getting the dot so she could have her light turned on from downstairs and then tell Alexa to turn it off while in bed. No regrets on this one!",5.0
1148,Amazon - Echo Plus w/ Built-In Hub - Silver,"I gave the Echo 5 stars but I like Amazon products and ultimately the product is good..however, I use Cree smart light bulbs in my house and bought this Echo for the built in Hub to try and eliminate the extra hub space in my house..but the built in hub of the Echo Plus isn’t compatible at this time with Cree light bulbs..so I had to return it and wait for now and stick with my regular Echo and Echo Dot’s.",5.0
1149,Amazon - Echo Plus w/ Built-In Hub - Silver,"Love the echo plus. Easy to set up with comparable extras, has simplified so many things in my home. Takes some getting to use to but patience and practice and males all the difference.",5.0
1150,Amazon - Echo Plus w/ Built-In Hub - Silver,The first one was not working so we had to take it back and get a new one,4.0
1151,Amazon - Echo Plus w/ Built-In Hub - Silver,Great product. Didnt realize it’s compatible with different items,4.0
1152,Amazon - Echo Plus w/ Built-In Hub - Silver,"We use Alexa for so many things. We use it for shopping list, music, lights on or off, even Trivia games.",5.0
1153,Amazon - Echo Plus w/ Built-In Hub - Silver,Christmas gift for my son and my husband. Can’t wait to hook it up,5.0
1154,Amazon - Echo Plus w/ Built-In Hub - Silver,"Works great and we like like the light that came with it., Not one issues so far!",4.0
1155,Amazon - Echo Plus w/ Built-In Hub - Silver,My wife and I love the Amazon echo plus it’s very easy to control the hue lights in the house that we have set up I would recommend this to anybody we love it. We also play a lot of music on it.,5.0
1156,Amazon - Echo Plus w/ Built-In Hub - Silver,We never received the light bulb. Very happy with Alexa just not happy that the bulb was not sent.,4.0
1157,Amazon - Echo Plus w/ Built-In Hub - Silver,It has very limited use without adding on expensive Apps or adding more wireless speakers. I am considering returning the merchandise,3.0
1158,Amazon - Echo Plus w/ Built-In Hub - Silver,Bought this for my son and one for my husband and me. So easy to set up. Very helpful. Doesn’t take up a lot of space.,4.0
1159,Amazon - Echo Plus w/ Built-In Hub - Silver,"When I used to think of amazon echo I think flimsy sounds, Amazon Echo was more of ECHO-Ing, tin can complex... at least from what I have experienced with my friends echos. Echo Plus you ask... Not so much!!! This device has such excellent sound!! One of the best devices I have ever purchased! If I could I would have these all over my house. Forget the dot and the echo 2nd gen. Echo plus is the way to go!!! Beautiful device, sounds is second to none!",5.0
1160,Amazon - Echo Plus w/ Built-In Hub - Silver,"Went to my local Best Buy and a friendly employee greed me and ask me if I needed any help, I ask about the echo and the google assistance and the employee explained the pros and cons of each device and even show me other ones. With his help I end up pickin the new echo Plus (Alexa) and I absolutely LOVE IT! I really like the Phillips Hue Bulb included and I am definitely going to buy more! My customer experience was really great and I am very grateful for the courtesy, knowledge and the time this employee offered me. This experience make me want to come back to this same store for all my needs specially because they can help me choose wisely. Love my Alexa, and love the hue bulb. Now I will be going to buy a new smart tv to control with Alexa next. Great customer service!!! Thank you!!",5.0
1161,Amazon - Echo Plus w/ Built-In Hub - Silver,"Purchased the Echo Plus after reading that the new generation had been upgraded by improving the sound and integration of a controller. For the price provided, I thought that the deal was a good value. I have the first generation unit as well. A quick comparison of the two from a sound, look, etc perspective really didn't lead me to think that there was any noticeable sound improvement nor improved aesthetics. At least the price for the unit has come down quite a bit and the addition of Philips bulb for 'free' was a smart move.Overall, I think that the unit is a good purchase for beginning some home automation projects.",4.0
1162,Amazon - Echo Plus w/ Built-In Hub - Silver,I was really reluctant buying Alexa but I’ve read so much about this item that I bought the package (Alexa and Phillips bulb) and have been amazed with how well it works.,4.0
1163,Amazon - Echo Plus w/ Built-In Hub - Silver,Worked right out of the box easy set up and operation,5.0
1164,Amazon - Echo Plus w/ Built-In Hub - Silver,Love the thing. My wife uses it daily. Should have bought it a long time ago. It even controls our Hue lights.,5.0
1165,Amazon - Echo Plus w/ Built-In Hub - Silver,Purchased the echo after hearing it at a neighbors. Good quality speaker for the small size.,5.0
1166,Amazon - Echo Plus w/ Built-In Hub - Silver,The system is able to react quickly to the verbal directions. It even is able to pickup voices across the room and seems to capture the commands accurately even when spoken quickly.,4.0
1167,Amazon - Echo Plus w/ Built-In Hub - Silver,Got one for my daughter last year and she loves it.,4.0
1168,Amazon - Echo Plus w/ Built-In Hub - Silver,I had 3 dots and decided to get the echo plus. Great product so far. Controls my hue lights. Grandkids love asking it questions.,5.0
1169,Amazon - Echo Plus w/ Built-In Hub - Silver,"Great device. Good speaker, very solid feeling. Microphones listen well.",5.0
1170,Amazon - Echo Plus w/ Built-In Hub - Silver,I have the Echo plus and i love it the speakers sounds loud and clear.,5.0
1171,Amazon - Echo Plus w/ Built-In Hub - Silver,Bought for my husband for Christmas. We keep it in our kitchen and mainly just use it for music. But our kids love that they can tell Alexa to play a song they like and it plays,5.0
1172,Amazon - Echo Plus w/ Built-In Hub - Silver,I really like the echo plus and the hue light bulb does work on the echo plus but I had to buy a bridge from Phillips in order to schedule on off schedule times for the light. I thought the Echo Plus was like a bridge but I guess it isn’t.,2.0
1173,Amazon - Echo Plus w/ Built-In Hub - Silver,One For Us One For The Kids For Christmas!Great way to get connected!,5.0
1174,Amazon - Echo Plus w/ Built-In Hub - Silver,"This Amazon Echo is the COOLEST gadget you can buy, it is VERY SMART and learns very fast. it runs many items in our home IE Nest, LG TV, Lights",5.0
1175,Amazon - Echo Plus w/ Built-In Hub - Silver,The device is extremely useful for all those who choose to have a smart/connected home. The built-in hub helps you to connect your devices easier than not having it. I would recommend this device especially if you have a prime membership.,5.0
1176,Amazon - Echo Plus w/ Built-In Hub - Silver,This is a very neat item. Love all the things this can do!,5.0
1177,Amazon - Echo Plus w/ Built-In Hub - Silver,"Speaker has great sound and it’s awsome that it syncs with other speakers to really fill your house with sound. The smart lights I wasn’t too sure of, but since I’ve installed it I want to get more. It’s a great smarthome hub.",4.0
1178,Amazon - Echo Plus w/ Built-In Hub - Silver,This is my second Alexa and the second time set up so much easier. I love the extra volume for my music and the peer to peer calling gives me a mini hands free intercom. Still discovering the new features.,4.0
1179,Amazon - Echo Plus w/ Built-In Hub - Silver,I loved my echo so much I bought my sister one. I can now turn on my lights when I get home just by asking Alexa.,5.0
1180,Amazon - Echo Plus w/ Built-In Hub - Silver,"Is great, fun, useful. Great speaker. Kids love it.",5.0
1181,Amazon - Echo Plus w/ Built-In Hub - Silver,I really like how she is able to interact and plays music with great sound. She interacts with my smart home.,5.0
1182,Amazon - Echo Plus w/ Built-In Hub - Silver,Got this model only because of the sale price and the built in hub that controls my hue strip lights. And....I didn’t want to say google all the time! Sounds like baby talk to me....lol,4.0
1183,Amazon - Echo Plus w/ Built-In Hub - Silver,"Echo Plus has everything the old Echo had, plus better sound and built-in capability for Smart Home add-ons, like Hue bulbs and SmartThings plugs — without needing a Hue hub or ST hub. Love it!",5.0
1184,Amazon - Echo Plus w/ Built-In Hub - Silver,"I am not a tech person, but I was able to easily connect these devices to my network",5.0
1185,Amazon - Echo Plus w/ Built-In Hub - Silver,This was out first time using any of Amazons alexa products and we love it. So far we have the hue light bulbs and fire stick but plan on updating the front door lock and thermostat. So easy to use and convenient.,5.0
1186,Amazon - Echo Plus w/ Built-In Hub - Silver,"Very easy to set up! Easy to connect with multiple Amazon Echo Dots, as well as multiple smart home products.",5.0
1187,Amazon - Echo Plus w/ Built-In Hub - Silver,"Worked fine first time out of the box. Plug it in, set it up with you Amazon account and you are ready to go. It is very convenient to turn on and off the Phillips light by voice.",5.0
1188,Amazon - Echo Plus w/ Built-In Hub - Silver,I love being able to use Alexa. She is an amazing AI. Until the robots rebel against the human kind I think it’s worth it.,5.0
1189,Amazon - Echo Plus w/ Built-In Hub - Silver,this was a great purchase with one hue bulb included with the echo plus. Installation/set up was a breeze.,4.0
1190,Amazon - Echo Plus w/ Built-In Hub - Silver,"This ia a great product, more technology to make your life easier.",5.0
1191,Amazon - Echo Plus w/ Built-In Hub - Silver,This works perfectly for the smart home connecting to all your devices. Coupled with Amazon prime this has it all. Voice speaker clearly understands you from up close and from across the house.,5.0
1192,Amazon - Echo Plus w/ Built-In Hub - Silver,Definitely recommend to anyone that wants a exciting product,5.0
1193,Amazon - Echo Plus w/ Built-In Hub - Silver,"Alexa is fun to play with for the whole family, and it fills the house with music when not telling us a joke.",5.0
1194,Amazon - Echo Plus w/ Built-In Hub - Silver,"Great product, easier set up than anticipated. Actually bought for my Mother - she loves it.",4.0
1195,Amazon - Echo Plus w/ Built-In Hub - Silver,"I love amazon products, easy to use and install. I recommend them 100%. very good sound and above all price",5.0
1196,Amazon - Echo Plus w/ Built-In Hub - Silver,"I like being able to ask about the weather, set an alarm on my phone or create a shopping list all by just asking Elexia.",5.0
1197,Amazon - Echo Plus w/ Built-In Hub - Silver,"From her jokes, rapping and everyday new fact Alexa is awesome. Its super easy to pull out your phone to check the weather but i honestly never did and would always be surprised when i walked outside with whatever it is that day. But every morning i ask alexa whats the weather and she gives me an in depth review for that day and the rest of the week. There are tons of skills for Alexa most useful some random. But shes a must try. Also plus about the echo plus is if you want to start a smart home you dont need a hub like the other echo pieces. You can just buy some compatible smart bulbs.",5.0
1198,Amazon - Echo Plus w/ Built-In Hub - Silver,You need to have Amazone prime in order to have music,4.0
1199,Amazon - Echo Plus w/ Built-In Hub - Silver,Works great. Can’t wait to find all it can do for me.,5.0
1200,Amazon - Echo Plus w/ Built-In Hub - Silver,Asking trivia questions of Alexa is a hoot but being able to turn off the ceiling fan from bed is golden.,5.0
1201,Amazon - Echo Plus w/ Built-In Hub - Silver,Built-in hub only lets your control Philips Hue with your voice. You still need the Philips Hue hub to be able to use the Hue app. I ended up buying the Hue hub as well. Has better speaker than the regular Echo.,4.0
1202,Amazon - Echo Plus w/ Built-In Hub - Silver,Great product easy to use and would recommend to anyone,5.0
1203,Amazon - Echo Plus w/ Built-In Hub - Silver,I really like this product. My Son got us the Alexa Show for Christmas and I wanted one that would turn on lights and other items. So we purchased this because it has the bridge so that you can use it with the Phillips Hue lights. It works great. I have the Show in the kitchen and I have the Echo in my bedroom. I love that it has a great built in speaker. I can have it play my music in both rooms at the same time.....,5.0
1204,Amazon - Echo Plus w/ Built-In Hub - Silver,Bought for a family memeber and he was so happy with the game,5.0
1205,Amazon - Echo Plus w/ Built-In Hub - Silver,I purchase one for my children and us is a great way to stay connected and smart to have it at home,5.0
1206,Amazon - Echo Plus w/ Built-In Hub - Silver,Alexa really amazes me. She learns new skills everyday.,5.0
1207,Amazon - Echo Plus w/ Built-In Hub - Silver,I’m still trying to get it set up but so far it’s a blast!,5.0
1208,Amazon - Echo Plus w/ Built-In Hub - Silver,We like using the Echo. Probably didn't need the plus because we are just using it to play music on Amazon music.,5.0
1209,Amazon - Echo Plus w/ Built-In Hub - Silver,"I was skeptical about the Amazon Echo products. Why would I need this? I bought the Echo Dot first and was hooked. Bought this Echo Plus for smart home integration. Since then, I have bought a bunch of smart bulbs and plan on more ""things"", I bought an Echo Spot, too. You do not need an Echo product, but they are fun, practical and cool. Can't live without it now!",5.0
