Unnamed: 0,Product,Review_Summary,Rating
3091,Amazon Tap - Alexa-Enabled Portable Bluetooth Speaker,I ordered this and actually came in earlier than predicted and it works beautiful! I'm totally happy with my purchase!!!,5.0
3092,Amazon Tap - Alexa-Enabled Portable Bluetooth Speaker,"I purchased a Echo for home so added a Tap for my office at work, so I can chat with Alexa at work and my main reason was for a decent BT speaker for my office. This has great sound streaming my Prime music and XM vis the XM app. Can't go wrong. Quality music and Alexa when I need some help with spelling hard word's, she getting smart. Pick one up. You have a woman to talk to when the wife is out.",5.0
3093,Amazon Tap - Alexa-Enabled Portable Bluetooth Speaker,I love that the tap is rechargeable and portable. Sounds is great! I highly recommend the tap!,5.0
3094,Amazon Tap - Alexa-Enabled Portable Bluetooth Speaker,I returned it because I wanted better sound...opted for a bose soundlink. Decent speaker with nice amazon prime/Alexa features...just not the sound I was looking for.,3.0
3095,Amazon Tap - Alexa-Enabled Portable Bluetooth Speaker,"excellent gift, ok sound, great portability, would buy again",4.0
3096,Amazon Tap - Alexa-Enabled Portable Bluetooth Speaker,"Love it, works better than anticipated. Also at a good price",5.0
3097,Amazon Tap - Alexa-Enabled Portable Bluetooth Speaker,When it works it's great but for some reason it doesn't always answer me When it doesn't answer me I turn off the tv and make sure no one else is talking and it still doesn't work at that time. It was easy to set up with the phone app. Doesn't seem to matter where the phone is when it isn't working. I've tried close and far and in between. So a case of great when it works and the pits when it doesn't,3.0
3098,Amazon Tap - Alexa-Enabled Portable Bluetooth Speaker,"We have bought two Taps, one for ourselves and one as a gift for our son. We love the portability of the Tap. It's perfect for our deck. Our grandchildren love it, too.",5.0
3099,Amazon Tap - Alexa-Enabled Portable Bluetooth Speaker,This was a gift had no plan to purchase one. But very pleased with the portability and the sound quality,5.0
3100,Amazon Tap - Alexa-Enabled Portable Bluetooth Speaker,Alexa on the go. Works as Bluetooth speaker with your comparable phone.,5.0
3101,Amazon Tap - Alexa-Enabled Portable Bluetooth Speaker,I love my new toy. Alexa is my personal girl Friday. She understands what I want and retrieves it. Easy to set up and use.,5.0
3102,Amazon Tap - Alexa-Enabled Portable Bluetooth Speaker,Good price works great would buy again good value for the price,5.0
3103,Amazon Tap - Alexa-Enabled Portable Bluetooth Speaker,"Music, full home automation control, an assistant, calling, shopping and lists, much much more...anywhere with wifi, home or away. Get one, you will not regret it.",5.0
3104,Amazon Tap - Alexa-Enabled Portable Bluetooth Speaker,Omg I am so enjoying this. Sitting around the back deck with family wishing we have music that doesn't require plugs or wires. Saw it online deals of the day read the reviews and ordered on he spot and drove a half hour drive to my closet Best Buy. Play it now everyday.,5.0
3105,Amazon Tap - Alexa-Enabled Portable Bluetooth Speaker,Great speaker and Echo substitute. This is great for on the go as a Bluetooth speaker and when connected to the internet it works great using the Alexa app.,5.0
3106,Amazon Tap - Alexa-Enabled Portable Bluetooth Speaker,"I have been enjoying the amazon tap for two weeks, and am still finding new things it will do",5.0
3107,Amazon Tap - Alexa-Enabled Portable Bluetooth Speaker,Is it operate my wife loves it my granddaughter knows how to operate a good sounding Bluetooth speaker great freedom it even tells knock knock jokes in makes my granddaughter crack up that makes it worth every penny I paid useful to recommend to anybody,5.0
3108,Amazon Tap - Alexa-Enabled Portable Bluetooth Speaker,We got this for my son for xmas. He loves it. He uses it daily.,5.0
3109,Amazon Tap - Alexa-Enabled Portable Bluetooth Speaker,"Love the Amazon Alexa products! I have 1 Show, 1 Echo, 2 dots, and the Tap. Wish the Tap had the drop-in feature. The tap does make a sound when you have the hands free enabled and say ""Alexa"" instead of the blue lights on the other products. Great for taking outside!",5.0
3110,Amazon Tap - Alexa-Enabled Portable Bluetooth Speaker,"The Tap is a great portable speaker with fantastic sound. If you press a button then you can connect to Amazon Alexa and she can play your music, answer questions, etc. Downgraded one star because there is supposed to be a hands free option for Alexa but I haven't been able to get it to work. Still great to be able to take this around the house vs Echo which is tied to the plug.",4.0
3111,Amazon Tap - Alexa-Enabled Portable Bluetooth Speaker,"Full disclosure. I own five Amazon echos including a few Dots as well as this Tap, so obviously I'm a fan of echoes. Honestly I couldn't figure out from Amazons marketing and the online review how the Tap fit in as compared to full blown Echo and the Dot. I kept thinking it was limited compared to the Echo and the Dot because you had to Tap the button to ask it question. However given that it's completely portable and runs for up to six hours on a charge it makes sense that it would wast battery if it was always listening for a voice command. IMO, the Tap sounds just as good and maybe even better the the Echo in a much smaller form factor. Since it's portable it's probably going to be sitting next to you any way so tapping to ask a question is not really an issue and in someways is better when you have a full table as you can control who gets to request music. My friends and I get into fun wars asking for different music on the full blown Echo but it can also get a little annoying when someone plays Michael Bolton over my Bruce Springsteen. Bottom line just as good of sound as the full blown Tap in a portable and smaller form. Very Happy with all my echoes but this may be my favorite.",5.0
3112,Amazon Tap - Alexa-Enabled Portable Bluetooth Speaker,"Great sound and portablebility. Nice style, lithium battery, requires wifi and there are internet radio stations and news. Amazon has features available as well. I use mine a lot.",5.0
3113,Amazon Tap - Alexa-Enabled Portable Bluetooth Speaker,"Great speaker, able to move around, connect to iPad when watching movies. Love it!",5.0
3114,Amazon Tap - Alexa-Enabled Portable Bluetooth Speaker,Nice portable speaker but wish the sound quality was better.,3.0
3115,Amazon Tap - Alexa-Enabled Portable Bluetooth Speaker,I own an echo and the tap. The tap is slower to respond. If you haven't used the echo then you will like the tap.,3.0
3116,Amazon Tap - Alexa-Enabled Portable Bluetooth Speaker,Great sound. Portable. The kids love it. Didn't think I would use it but I tend to use it a lot.,5.0
3117,Amazon Tap - Alexa-Enabled Portable Bluetooth Speaker,Most speaker like this will be over USD150.00 but this one is less than that price with a great sound quality,5.0
3118,Amazon Tap - Alexa-Enabled Portable Bluetooth Speaker,I love this little speaker. It is small enough to carry it wherever I want to bring it yet loud enough to be heard The Alexa interface is pretty cool as well. The only issue for me is that it doesn't connect with Apple Music. This issue is easily resolved by putting Tap in Bluetooth mode and playing Apple Music through my phone to the Tap,4.0
3119,Amazon Tap - Alexa-Enabled Portable Bluetooth Speaker,"Speaker is pretty loud and I love that I can take with me but the only downside is you have to hold the ""home"" button to use Alexa",3.0
3120,Amazon Tap - Alexa-Enabled Portable Bluetooth Speaker,I use this speaker daily and love the sound quality and its ability to be independant of my phone/tablet unlike normal Bluetooth speakers that require your phone to play music even if they have the same sound quality.,5.0
3121,Amazon Tap - Alexa-Enabled Portable Bluetooth Speaker,Serves my needs as required. Sound is good. Ability to move device where required is ideal,5.0
3122,Amazon Tap - Alexa-Enabled Portable Bluetooth Speaker,You can take everywhere your music and with wifi you are connected with the world. The best is that the battery lasts a long time.,5.0
3123,Amazon Tap - Alexa-Enabled Portable Bluetooth Speaker,"The Amazon Tap is a perfect complement to our Amazon Echo. Put this in our office space...has all the advantages of the Echo and is also a great Bluetooth speaker. Having to ""tap"" the mic button to summon Alexa is no issue at all! Sound quality is as good as any Bluetooth speaker on the market and it's extremely portable.",5.0
3124,Amazon Tap - Alexa-Enabled Portable Bluetooth Speaker,This product is awesome. You can play your favorite music instantly. Also had great fun asking Alexa questions. Some serious some funny. We love it!!,5.0
3125,Amazon Tap - Alexa-Enabled Portable Bluetooth Speaker,"Love it, take it with me everywhere, Not all of us are computer/technical savvy. Need better written, printable instructions on how to use. Step 1, step 2, etc.",5.0
3126,Amazon Tap - Alexa-Enabled Portable Bluetooth Speaker,Love Alexa. We currently have three devices that we use on a daily basis. I use one at work basically for streaming music. Great device. No problems connecting to any of them.,5.0
3127,Amazon Tap - Alexa-Enabled Portable Bluetooth Speaker,"I own the Echo, and love the product! So I purchased the Tap as a gift.",5.0
3128,Amazon Tap - Alexa-Enabled Portable Bluetooth Speaker,"From latest news flash, to weather info, to hearing a joke while cooking and waiting for Alexa to set a timer, the Amazon Tap is a fun tool to have around the house!",5.0
3129,Amazon Tap - Alexa-Enabled Portable Bluetooth Speaker,"This has been a very nice addition, it allows the whole family to use and enjoy it.",4.0
3130,Amazon Tap - Alexa-Enabled Portable Bluetooth Speaker,"I HAVE BOTH THE ECHO AND THE TAP, THEY ARE SPECTACULAR",5.0
3131,Amazon Tap - Alexa-Enabled Portable Bluetooth Speaker,"I wanted a speaker to listen to Pandora and go so much more! Being able to speak to Alexa and get news, weather, timer, light controls and so much more! Love the product!",5.0
3132,Amazon Tap - Alexa-Enabled Portable Bluetooth Speaker,"I really haven't had a chance to use this much yet, but it seems like a coll little gadget.",4.0
3133,Amazon Tap - Alexa-Enabled Portable Bluetooth Speaker,Love every aspect of the Echo. We even went and bought a Tap!,5.0
3134,Amazon Tap - Alexa-Enabled Portable Bluetooth Speaker,Have several echo's throughout the house and bought the Echo Tap so I could move it when I need to move around from the garage to outdside. Mainly listen to music and has worked well. Have noticed that I usually have to yell for Alexa to hear me but that may have to do with the acoustics in the garage. Other than that it works well.,4.0
3135,Amazon Tap - Alexa-Enabled Portable Bluetooth Speaker,"What I like is it its sound, it's portable and I use it at work. The sound fills the whole office.",5.0
3136,Amazon Tap - Alexa-Enabled Portable Bluetooth Speaker,"Do you spend lots of time on Amazon? Do you like listening to music anywhere in your home? This is the device for you. Even after a month of having the Tap, I'm still learning what all I can do with it verbally. Play genre of music in the HUGE Amazon library. I even have ordered items directly from it. One last feature I want to share is that it provides accurate weather information; current and forecast up to a week.",5.0
3137,Amazon Tap - Alexa-Enabled Portable Bluetooth Speaker,I the awesome I use it at work at lot its loud enough to enjoy any where,5.0
3138,Amazon Tap - Alexa-Enabled Portable Bluetooth Speaker,"I just love this tap!! It is so much fun. The music is so great. I play the relation music every night,every night. Best thing ever!",5.0
3139,Amazon Tap - Alexa-Enabled Portable Bluetooth Speaker,I bought it for my 15 year old daughter and she loves it. Her friends even loved it so much they went and bought them too.,5.0
3140,Amazon Tap - Alexa-Enabled Portable Bluetooth Speaker,"I love my smart portable speaker. It has games, weather, news, podcasts, radio stations, etc.If something is missing, I can connect my Bluetooth phone and stream whatever other audio application I want.",5.0
3141,Amazon Tap - Alexa-Enabled Portable Bluetooth Speaker,"Amazon Tap pretty much works as advertised, and understand that the product will evolve with system updates. Love how the weather, traffic, movies and sports scores/schedules are answered quickly and effortlessly. This was an excellent gift as I gave it to both my son and daughter and my son, unknowingly gave we a Tap back as well. Can't wait to see what improvements are made with the updates coming",4.0
3142,Amazon Tap - Alexa-Enabled Portable Bluetooth Speaker,"I got it on a pretty good sale... so I feel it was worth it. The sound is good, I like that it's portable and rechargeable. I think it is best if you have a prime account so you have access to the prime music.",5.0
3143,Amazon Tap - Alexa-Enabled Portable Bluetooth Speaker,Alexa works great and does lots of things for you. Fun for the family.,5.0
3144,Amazon Tap - Alexa-Enabled Portable Bluetooth Speaker,"For the price, you should be able to use as a speaker when talking on the phone. I had to use my daughter's Beats Pill for this function, therefore it's not worth all the hype.",2.0
3145,Amazon Tap - Alexa-Enabled Portable Bluetooth Speaker,"The Tap is essentially a smaller version of the Echo that has Alexa capability like Echo does, but also doubles as a portable Bluetooth speaker. You do need to tap it to ask Alexa to do anything, but otherwise it works the same as Echo. I prefer the Echo, but the Tap is great for college students and those who just want to supplement their Echo.",4.0
3146,Amazon Tap - Alexa-Enabled Portable Bluetooth Speaker,It's not bad for the novelty of Alexa. Might as well get the echo. Sound it not bad and I'm no audiophile. Might be good when my echo dots come in. Is it worth it? There are better Bluetooth speakers out there.,4.0
3147,Amazon Tap - Alexa-Enabled Portable Bluetooth Speaker,I prefer spending the extra $70 or $80 to get the echo,4.0
3148,Amazon Tap - Alexa-Enabled Portable Bluetooth Speaker,Great device I use it on a regular basis. good investment,3.0
3149,Amazon Tap - Alexa-Enabled Portable Bluetooth Speaker,"It's 85% as good as an Echo... Great sound, nice and loud, but... But the button. That button!!I would give this 5 stars and buy more of them, IF it was always listening while plugged in. Other than that, it does everything an Echo does, it's smaller, and (due to the battery) portable. I like it - I do. But it's not as useful as the Echo in the situation I use it the most.",4.0
3150,Amazon Tap - Alexa-Enabled Portable Bluetooth Speaker,Amazing Sound! All around great product! Nothing negative so far.,5.0
3151,Amazon Tap - Alexa-Enabled Portable Bluetooth Speaker,I have an Alexa but wanted a speaker for traveling. You can use this without a plug in cord.,4.0
3152,Amazon Tap - Alexa-Enabled Portable Bluetooth Speaker,"If you want a certain level of privacy and at the same time a speech enabled assistant, then this is the product for you. The Tap only listens to your, when you push the ""button, otherwise it is deaf to its surroundings. You get the awesome power of Alexa, provided by Amazon, and no worries about anyone listening to you surreptitiously.",5.0
3153,Amazon Tap - Alexa-Enabled Portable Bluetooth Speaker,Pretty good sound for the size and configuration of speaker. Easy to set up.,5.0
3154,Amazon Tap - Alexa-Enabled Portable Bluetooth Speaker,"I'm thinking this must of been a fluke, it never worked. Had to return item but received full refund",2.0
3155,Amazon Tap - Alexa-Enabled Portable Bluetooth Speaker,I habe the echo and I bought this one fort my son's room but it's not as user friendly. I wish I would've just bought the other one.,2.0
3156,Amazon Tap - Alexa-Enabled Portable Bluetooth Speaker,I have two Echo Dots and wanted something that was more portable for other times when I'm not near those two devices in my home. I also needed a speaker so I thought I'd try the Echo Tap. You can choose to just press it to activate or you can enable hands-free and it will respond just like my Echo Dot does. The sound is amazing out of this little thing. I love the charging dock. No dealing with trying to plug it in... just sit it down on the charging dock and you're good.,5.0
3157,Amazon Tap - Alexa-Enabled Portable Bluetooth Speaker,"Good price, travels well, has a lot of good features, compact, user friendly.",4.0
3158,Amazon Tap - Alexa-Enabled Portable Bluetooth Speaker,I already own an echo dot but don't love the sound quality for music playback - the tab does a great job especially when you consider its size and price - overall very happy,5.0
3159,Amazon Tap - Alexa-Enabled Portable Bluetooth Speaker,"Was super easy to connect via Bluetooth - great sound, fun to use.",4.0
3160,Amazon Tap - Alexa-Enabled Portable Bluetooth Speaker,"I only purchased this because I loved the sound quality. Alexa is just a added bonus personally as I rarely hit the ""tap"" button to ask her anything. The few times I asked her questions, she hasn't disappointed. EXTRA: Now what would make this device amazing is if Alexa was able to connect to my Apple Music playlist! If only...",5.0
3161,Amazon Tap - Alexa-Enabled Portable Bluetooth Speaker,"This is my second Echo purchase. My first was the original Echo for my home and the automation feature aside. The sound is excellent, Alexa's response is better than any digital assistant to date, and the ready access to Prime is convenient. This is all of that and portable and rechargeable as well. Additionally the inclusion of Bluetooth and a headphone jack is amazing.",5.0
3162,Amazon Tap - Alexa-Enabled Portable Bluetooth Speaker,"Echo sounds better for music, but Tap gives me portability. Good to have both. Now Tap is voice activated, so it's all good.",4.0
3163,Amazon Tap - Alexa-Enabled Portable Bluetooth Speaker,Best speaker with Alexa enabled. Value of money!!,5.0
3164,Amazon Tap - Alexa-Enabled Portable Bluetooth Speaker,Has a very good Bluetooth speakers sound quality is good but otherwise she's pretty useless when it comes to get answering questions,1.0
3165,Amazon Tap - Alexa-Enabled Portable Bluetooth Speaker,I bought this item on a whim and because it was on sale. I've been pleasantly surprised. Search sounds great for its size.,4.0
3166,Amazon Tap - Alexa-Enabled Portable Bluetooth Speaker,We love our Amazon Echo but it is hard wired to kitchen. Because of where we live AM reception is poor but through an Echo or Amazon Tap I can listen to some of my favorite stations through iHeart Radio and the Tap is portable.,5.0
3167,Amazon Tap - Alexa-Enabled Portable Bluetooth Speaker,I love my tap. It sounds great and is so easy to use.,5.0
3168,Amazon Tap - Alexa-Enabled Portable Bluetooth Speaker,Bought it for a couple of my friends and it was a big hit with them! Very useful!,5.0
3169,Amazon Tap - Alexa-Enabled Portable Bluetooth Speaker,I bought this as a gift for Christmas and it was well liked,5.0
3170,Amazon Tap - Alexa-Enabled Portable Bluetooth Speaker,"Much better than the echo dot. However, the fact that you have to touch the button to activate it instead of just talking to it is a bit annoying. Speaker is fairly powerful for its size.",3.0
3171,Amazon Tap - Alexa-Enabled Portable Bluetooth Speaker,"Great addition to my Alexa collection. Very portable, batter lasts as expected.",5.0
3172,Amazon Tap - Alexa-Enabled Portable Bluetooth Speaker,"It's so fantastic to just ask a device to turn on lights, or play music. So convenient. Love this!",5.0
3173,Amazon Tap - Alexa-Enabled Portable Bluetooth Speaker,"I bought this after I bought the Amazon Echo. This was actually an impulse buy. I saw it and bought it not reading any reviews on it, because I enjoyed the echo so much. It does everything the Echo does, but the sound quality is not great. When you're playing at middle volume, it's ok. The lows are there but doesn't sound good. I'm guessing I'm comparing it with the Bose mini soundlink. When you set the volume high, the bass is almost non-existent. The mids and highs are loud with the louder volume. Another difference is that with tap, you have to press the mic button to start saying commands where as with the echo, you can just say the wake up word and it will start listening to your commands. I do like the fact that it's portable. Because of that, I'm on edge of returning it and holding off until maybe another model comes out with better bass.",4.0
3174,Amazon Tap - Alexa-Enabled Portable Bluetooth Speaker,"I wasn't sure how we would like the tap, but I must say it has been fun talking to Alexa. I like asking her to tell me a joke, play my favorite radio station or play music. The fun continues as I add apps and Alexa expands her knowledge base.",4.0
3175,Amazon Tap - Alexa-Enabled Portable Bluetooth Speaker,Great sound and functionality. Minimal kinks in programming. Love it for my bedroom.,5.0
3176,Amazon Tap - Alexa-Enabled Portable Bluetooth Speaker,"The echo is great for music, weather, and anything else you have integrated in the house.",5.0
3177,Amazon Tap - Alexa-Enabled Portable Bluetooth Speaker,"this is a very good product, the speakers are good, the price was right. I liked everything about it, other than the fact that you had to press the button each time you wanted to talk to it, unlike the echo and the dot. The portability was good, but I didn't have much use for it being portable. Unless you are going to keep the Tap within arm's reach, you're better off with one of the other hands free voice activated products. recommended with caveats",4.0
3178,Amazon Tap - Alexa-Enabled Portable Bluetooth Speaker,It makes me so happy to listen all kind of their music station,5.0
3179,Amazon Tap - Alexa-Enabled Portable Bluetooth Speaker,This is the best of both worlds. A reasonably priced BT speaker and an Amazon Alexa enabled device. I would highly recommend to anyone looking for a BT speaker and considering an Alexa enabled device.,5.0
3180,Amazon Tap - Alexa-Enabled Portable Bluetooth Speaker,The Amazon tap I like other then I wish you could just say her name and she would respond. Sounds great when playing music,5.0
3181,Amazon Tap - Alexa-Enabled Portable Bluetooth Speaker,"Used it as a bluetooth speaker and love how I can use Spotify with it....just say Alexa, and ask for your favorite artist.....",4.0
3182,Amazon Tap - Alexa-Enabled Portable Bluetooth Speaker,"I was debating whether to get the stationary Alexa device or the Tap and decided on portability. It's been fun figuring out how to phrase requests but with a little trial and error we're on a roll. I use it for play lists at work, alarm clock announcement by Dan Marino and news briefs. It's surprisingly sturdy but wish it was waterproof so I could take it with me while fishing.",5.0
3183,Amazon Tap - Alexa-Enabled Portable Bluetooth Speaker,Haven't been able to train Alexa like we've heard. Probably our own fault. We have fun with it.,4.0
3184,Amazon Tap - Alexa-Enabled Portable Bluetooth Speaker,"Thoughts of being able to have the Echo ""grow"" as I added to the list of tasks, excited me. Including the latest app, having it to recognize my smartphone's contact list to place and to receive calls. However, the Echo I purchased does not link up to my Samsung smartphone. Disappointed is a understatement.",4.0
3185,Amazon Tap - Alexa-Enabled Portable Bluetooth Speaker,Was easy to set up. Excellent sound quality for the price,5.0
3186,Amazon Tap - Alexa-Enabled Portable Bluetooth Speaker,"I was looking for just a Bluetooth speaker to add to my laptop for better sound. When I first listened to Amazon Tap I was so impressed with the sound quality.....then add in all the features it was a no brainer for a purchase! Sound quality is off the charts, Alexa learns more every day, and so do I! If you are a Prime member, this is a must! If you aren't...then you really should be!",5.0
3187,Amazon Tap - Alexa-Enabled Portable Bluetooth Speaker,Amazon tap is one of my best buys this year so far...The only thing that could make the tap better is an upgrade so you don't have to tap every command....That would make it a 5star device....,4.0
3188,Amazon Tap - Alexa-Enabled Portable Bluetooth Speaker,I live in a small apartment and this fan kept the whole place cool.,5.0
3189,Amazon Tap - Alexa-Enabled Portable Bluetooth Speaker,"The Tap is portable, has excellent sound quality and is a good value for the money.",5.0
3190,Amazon Tap - Alexa-Enabled Portable Bluetooth Speaker,Bought this gift for my wife and she loves it. Works as expected.,4.0
3191,Amazon Tap - Alexa-Enabled Portable Bluetooth Speaker,"Easy set up and amazing usefulness, love it. I use it all the time and continue to find new ways to take advantage of all there is within Alexa. Will purchase another one for bedroom!",5.0
3192,Amazon Tap - Alexa-Enabled Portable Bluetooth Speaker,"Love this product. It is nice looking, easy to carry, and the sound is amazing. Very easy to set up and connect to amazon echo. Nothing to complain about th he speaker itself. However the carrying case is kind of stupid and useless also. One has to take it down just in order to charge.",5.0
3193,Amazon Tap - Alexa-Enabled Portable Bluetooth Speaker,"I love everything about it.... it is portable, sounds better than most portable speakers, and Alexa rocks it. Only thing that kept it from a 5 star rating is that you have to manually activate Alexa. Wish it would work like the Echo and Dot, while it is on its base.",4.0
3194,Amazon Tap - Alexa-Enabled Portable Bluetooth Speaker,We're in our 70s and and have a good time with it.,4.0
