Unnamed: 0,Product,Review_Summary,Rating
19257,"Fire HD 10 Tablet, 10.1 HD Display, Wi-Fi, 16 GB - Includes Special Offers, Silver Aluminum","I love this kindle! I had one of the first Fire HD kindles that is still kicking and awesome, but when I saw this in the store I just had to have it. I think it's more user friendly and feels like it offers so many more options and functions than the Fire HD I have. Not to mention it dwarfs my last kindle in size. If I had to make one complaint, it's that there is not an ""auto brightness"" function (or at least I haven't found it) and you can't make your pages a cream color rather than stark white. Both those options were easier on my eyes, but I am testing out the Blue Shade mode to see if that helps as much as it's supposed to with night time/ bed time reading. All in all, I am extremely happy with this purchase.",5.0
19258,"Fire HD 10 Tablet, 10.1 HD Display, Wi-Fi, 16 GB - Includes Special Offers, Silver Aluminum","Bought an IPad and didn't like it. Returned it and got the Fire 10.1. This is my third Fire, love it....no.learning curve.",5.0
19259,"Fire HD 10 Tablet, 10.1 HD Display, Wi-Fi, 16 GB - Includes Special Offers, Silver Aluminum","I had originally decided to get a kindle instead of an iPad due to the cost. It's a great screen and has good sound, but the battery is pure junk! I should have went with an iPad.",2.0
3211,"Fire HD 10 Tablet, 10.1 HD Display, Wi-Fi, 16 GB - Includes Special Offers, Silver Aluminum",I was initially going to just get the Amazon Kindle but I thought this gives me a tablet and a easy way to read books. I buy e-college texts. It has helped me so much!! I'm so happy I invested my money in this.,5.0
3212,"Fire HD 10 Tablet, 10.1 HD Display, Wi-Fi, 16 GB - Includes Special Offers, Silver Aluminum","This was an Xmas gift for my wife. She had wanted a pad of some sort but I just couldn't afford an Ipad so I looked at the Fire as an alternative. First the screen size was just what I wanted. Second the price was very reasonable. Third it had functions and capabilities that were suitable for my wife's skills and needs. She absolutely loves it and I actually got a compliment on my present giving. That don't happen very often let me tell you. I will recommend this she's pleased I'm pleased what else do you need? My son was able to piggyback off of this gift, and purchased her the cover to go with it. So it really worked for my family. And I made my wife happy .",5.0
3213,"Fire HD 10 Tablet, 10.1 HD Display, Wi-Fi, 16 GB - Includes Special Offers, Silver Aluminum","Bought an IPad and didn't like it. Returned it and got the Fire 10.1. This is my third Fire, love it....no.learning curve.",5.0
3214,"Fire HD 10 Tablet, 10.1 HD Display, Wi-Fi, 16 GB - Includes Special Offers, Silver Aluminum",Love the bigger screen but do think this Fire HD 10TH runs a little slow. My last Fire HD was not as slow.,4.0
3215,"Fire HD 10 Tablet, 10.1 HD Display, Wi-Fi, 16 GB - Includes Special Offers, Silver Aluminum",I love my original Kindle Fire but the size and features on the latest Kindle are a plus,5.0
3216,"Fire HD 10 Tablet, 10.1 HD Display, Wi-Fi, 16 GB - Includes Special Offers, Silver Aluminum",Just writing this review to get my points...This was a gift for my mother. I think she likes it fine.,4.0
3217,"Fire HD 10 Tablet, 10.1 HD Display, Wi-Fi, 16 GB - Includes Special Offers, Silver Aluminum",Very satisfied. Use it daily while watching TV and other activites,5.0
3219,"Fire HD 10 Tablet, 10.1 HD Display, Wi-Fi, 16 GB - Includes Special Offers, Silver Aluminum",Got this laptop for an in-bound college student. Best option that I found.,4.0
3220,"Fire HD 10 Tablet, 10.1 HD Display, Wi-Fi, 16 GB - Includes Special Offers, Silver Aluminum","Love the tablet, not only for reading (upgrade from Kindle) but for searching the Internet, email, etc. And I can take it anywhere. Cheaper than an iPAD and does enough for what I need.",5.0
3221,"Fire HD 10 Tablet, 10.1 HD Display, Wi-Fi, 16 GB - Includes Special Offers, Silver Aluminum","This tablet is certainly large which makes it cumbersome when reading in a reclining position. However, its terrific for reading or watching films on a plane, desk or otherwise sitting up.",5.0
3222,"Fire HD 10 Tablet, 10.1 HD Display, Wi-Fi, 16 GB - Includes Special Offers, Silver Aluminum","I got the amazon Fire HD 10 for reading and other activities. It was very easy to set up. Netflix worked ok on it. It mostly works well, but there are limitations to the apps that are available. I tried it out for a while and then returned it for a Samsung S2 9.7.",4.0
3223,"Fire HD 10 Tablet, 10.1 HD Display, Wi-Fi, 16 GB - Includes Special Offers, Silver Aluminum","Excellent value priced 10"" tablet. To bad Amazon killed it. I purchased it as a gift for my wife and she loves the size and quality of the display.",5.0
3224,"Fire HD 10 Tablet, 10.1 HD Display, Wi-Fi, 16 GB - Includes Special Offers, Silver Aluminum",I bought this Tablet for my Wife. She uses it every day. It is very usefulto her. She uses it in place of a computer. She watches movies on it.The Graphics are excellent.,5.0
3225,"Fire HD 10 Tablet, 10.1 HD Display, Wi-Fi, 16 GB - Includes Special Offers, Silver Aluminum",Just writing this review to get my points...This was a gift for my mother. I think she likes it fine.,4.0
3227,"Fire HD 10 Tablet, 10.1 HD Display, Wi-Fi, 16 GB - Includes Special Offers, Silver Aluminum","I got the amazon Fire HD 10 for reading and other activities. It was very easy to set up. Netflix worked ok on it. It mostly works well, but there are limitations to the apps that are available. I tried it out for a while and then returned it for a Samsung S2 9.7.",4.0
3228,"Fire HD 10 Tablet, 10.1 HD Display, Wi-Fi, 16 GB - Includes Special Offers, Silver Aluminum",Great notepad! Huge screen and easily downloaded apps to use. Love it!,5.0
3230,"Fire HD 10 Tablet, 10.1 HD Display, Wi-Fi, 16 GB - Includes Special Offers, Silver Aluminum","had a problem with my purchase, but Best Buy made it good, they are very good!",4.0
3232,"Fire HD 10 Tablet, 10.1 HD Display, Wi-Fi, 16 GB - Includes Special Offers, Silver Aluminum",Nice size works fine needs to weigh a little less.,4.0
3234,"Fire HD 10 Tablet, 10.1 HD Display, Wi-Fi, 16 GB - Includes Special Offers, Silver Aluminum","Perfect technology for my 11 year old son for games, reading, and homework.",5.0
3235,"Fire HD 10 Tablet, 10.1 HD Display, Wi-Fi, 16 GB - Includes Special Offers, Silver Aluminum","I love it!! It can do it all!! Beautiful color graphics and in no time at all, I can watch a movie or play games or read my favorite novel. I love it!!",5.0
3236,"Fire HD 10 Tablet, 10.1 HD Display, Wi-Fi, 16 GB - Includes Special Offers, Silver Aluminum",Very easy to use and does everything I need it to do. Would have given it 5 stars but it hasn't changed enough from the last Kindle that I purchased several years ago.,4.0
3237,"Fire HD 10 Tablet, 10.1 HD Display, Wi-Fi, 16 GB - Includes Special Offers, Silver Aluminum","As I age, it's difficult for me to see the smaller screens so when this one came out .... I was delighted!!! Love playing my games!!!",5.0
3238,"Fire HD 10 Tablet, 10.1 HD Display, Wi-Fi, 16 GB - Includes Special Offers, Silver Aluminum","As I age, it's difficult for me to see the smaller screens so when this one came out .... I was delighted!!! Love playing my games!!!",5.0
3239,"Fire HD 10 Tablet, 10.1 HD Display, Wi-Fi, 16 GB - Includes Special Offers, Silver Aluminum",Biggest and best Kindle yet. Light as a feather. Buy one today.,5.0
3240,"Fire HD 10 Tablet, 10.1 HD Display, Wi-Fi, 16 GB - Includes Special Offers, Silver Aluminum","Love my kindle fire, takes awesome pictures and its convenient for on the go.",5.0
3241,"Fire HD 10 Tablet, 10.1 HD Display, Wi-Fi, 16 GB - Includes Special Offers, Silver Aluminum",I love this product it is so easy to use It has a clear picture,5.0
3243,"Fire HD 10 Tablet, 10.1 HD Display, Wi-Fi, 16 GB - Includes Special Offers, Silver Aluminum","I love the 2 cameras, and the video capabilities. I have set up the picture albums and can even share on Facebook and messenger. I like the side charger. Much better than front.I love the size too.",5.0
3245,"Fire HD 10 Tablet, 10.1 HD Display, Wi-Fi, 16 GB - Includes Special Offers, Silver Aluminum","big screen,2 year old granddaughter watches Sesame Street and scrolls through selections....",4.0
3246,"Fire HD 10 Tablet, 10.1 HD Display, Wi-Fi, 16 GB - Includes Special Offers, Silver Aluminum",The store representative took his time with me to choose the right size and the lady at the check out got me hooked up with Best Buy Program membership.,5.0
3247,"Fire HD 10 Tablet, 10.1 HD Display, Wi-Fi, 16 GB - Includes Special Offers, Silver Aluminum",like better than the 7 inch Kindle better to read.,5.0
3248,"Fire HD 10 Tablet, 10.1 HD Display, Wi-Fi, 16 GB - Includes Special Offers, Silver Aluminum","I love this kindle! I had one of the first Fire HD kindles that is still kicking and awesome, but when I saw this in the store I just had to have it. I think it's more user friendly and feels like it offers so many more options and functions than the Fire HD I have. Not to mention it dwarfs my last kindle in size. If I had to make one complaint, it's that there is not an ""auto brightness"" function (or at least I haven't found it) and you can't make your pages a cream color rather than stark white. Both those options were easier on my eyes, but I am testing out the Blue Shade mode to see if that helps as much as it's supposed to with night time/ bed time reading. All in all, I am extremely happy with this purchase.",5.0
3249,"Fire HD 10 Tablet, 10.1 HD Display, Wi-Fi, 16 GB - Includes Special Offers, Silver Aluminum","I had reviewed and looked at this Samsung 65"" 4k HDTV and at this timeit was the best for the money..Very satisfied with TV and would recommend it to anyone.",5.0
3250,"Fire HD 10 Tablet, 10.1 HD Display, Wi-Fi, 16 GB - Includes Special Offers, Silver Aluminum",I like the bigger screen size. It allows me to read my books without straining my eyes and allows more of the text to be displayed.,5.0
3251,"Fire HD 10 Tablet, 10.1 HD Display, Wi-Fi, 16 GB - Includes Special Offers, Silver Aluminum",Tablet is easy to work with only can be slow to come up on certain sites,4.0
3252,"Fire HD 10 Tablet, 10.1 HD Display, Wi-Fi, 16 GB - Includes Special Offers, Silver Aluminum","I've had the first kindle fire, I love the tablet.Why because it's bigger",5.0
3253,"Fire HD 10 Tablet, 10.1 HD Display, Wi-Fi, 16 GB - Includes Special Offers, Silver Aluminum","This tablet is so much easier to use than my 6"" fire. It is great for reading or eatching movies.",5.0
3254,"Fire HD 10 Tablet, 10.1 HD Display, Wi-Fi, 16 GB - Includes Special Offers, Silver Aluminum",Kindle products are easy to use and set up. It does most everything the expensive tablets do.,4.0
3255,"Fire HD 10 Tablet, 10.1 HD Display, Wi-Fi, 16 GB - Includes Special Offers, Silver Aluminum","This tablet was SO easy to set up, even this old technologically-challenged grandma did it without help! I am able to load many books on it. It is convenient and easy to handle.",5.0
3257,"Fire HD 10 Tablet, 10.1 HD Display, Wi-Fi, 16 GB - Includes Special Offers, Silver Aluminum",Good products and service and happy with Amazon Fire Tablet,4.0
3258,"Fire HD 10 Tablet, 10.1 HD Display, Wi-Fi, 16 GB - Includes Special Offers, Silver Aluminum",I love this product it is so easy to use It has a clear picture,5.0
3259,"Fire HD 10 Tablet, 10.1 HD Display, Wi-Fi, 16 GB - Includes Special Offers, Silver Aluminum",slower than my last kindle. the power button is not easy accesible when in a case.,4.0
3260,"Fire HD 10 Tablet, 10.1 HD Display, Wi-Fi, 16 GB - Includes Special Offers, Silver Aluminum",I love my new Kindle!! I would recommend this to everyone!! It has so many features and love the size!!,5.0
3261,"Fire HD 10 Tablet, 10.1 HD Display, Wi-Fi, 16 GB - Includes Special Offers, Silver Aluminum","love the big screen, clear pictures and fast loading. battery lasts long. I use it every day !",4.0
3262,"Fire HD 10 Tablet, 10.1 HD Display, Wi-Fi, 16 GB - Includes Special Offers, Silver Aluminum",Great table does everything that i need it for. Great resolution and screen for reading books,5.0
3264,"Fire HD 10 Tablet, 10.1 HD Display, Wi-Fi, 16 GB - Includes Special Offers, Silver Aluminum",The store representative took his time with me to choose the right size and the lady at the check out got me hooked up with Best Buy Program membership.,5.0
3265,"Fire HD 10 Tablet, 10.1 HD Display, Wi-Fi, 16 GB - Includes Special Offers, Silver Aluminum",It is great for a bigger picture but runs really slow.,3.0
3266,"Fire HD 10 Tablet, 10.1 HD Display, Wi-Fi, 16 GB - Includes Special Offers, Silver Aluminum",upgraded from a previous model and cannot be happier,5.0
3268,"Fire HD 10 Tablet, 10.1 HD Display, Wi-Fi, 16 GB - Includes Special Offers, Silver Aluminum",NEW LARGER SCREENIS GREAT FOR WATCHING PRIME MOVIES AND READING BOOKS,5.0
3269,"Fire HD 10 Tablet, 10.1 HD Display, Wi-Fi, 16 GB - Includes Special Offers, Silver Aluminum",I go this tablet after problems with 2 Samsung tablets. so far like it. all apps I use available. A little slower than previous tablets that is the only reason for the 4 stars,4.0
3270,"Fire HD 10 Tablet, 10.1 HD Display, Wi-Fi, 16 GB - Includes Special Offers, Silver Aluminum",I love my new Kindle. It is bigger than the last Kindle I had. This Kindle is much easier to handle and to read.,5.0
3271,"Fire HD 10 Tablet, 10.1 HD Display, Wi-Fi, 16 GB - Includes Special Offers, Silver Aluminum","I have been a kindle owner since they first came out. This version has many,many more bells and whistles but I still use mine mostly for books, audible books and a place for me to download music I can listen to when I travel. Sometimes it is a bit slow opening up different apps and functions but overall it is functional, dependable and useful to me",4.0
3272,"Fire HD 10 Tablet, 10.1 HD Display, Wi-Fi, 16 GB - Includes Special Offers, Silver Aluminum","I use my Kindle fire HD 10 in 3 ways 1 for reading Kindle books, 2 for streaming TV shows or movies while riding my exercise bike, 3 to surf the internet.",5.0
3273,"Fire HD 10 Tablet, 10.1 HD Display, Wi-Fi, 16 GB - Includes Special Offers, Silver Aluminum",Bought this tablet for my 84 year old grandpa and he loves it. Easy to use,5.0
3274,"Fire HD 10 Tablet, 10.1 HD Display, Wi-Fi, 16 GB - Includes Special Offers, Silver Aluminum","My first tablet. OUTSTANDING for NETFLIX, email, etc.",5.0
3275,"Fire HD 10 Tablet, 10.1 HD Display, Wi-Fi, 16 GB - Includes Special Offers, Silver Aluminum","The Amazon fire HD10 is one of the best deals on the market. I've had a IPad and would rather have the HD10! It's what-1/3 of the price of a IPad and just as good, if not better",5.0
3276,"Fire HD 10 Tablet, 10.1 HD Display, Wi-Fi, 16 GB - Includes Special Offers, Silver Aluminum","This was an Xmas gift for my wife. She had wanted a pad of some sort but I just couldn't afford an Ipad so I looked at the Fire as an alternative. First the screen size was just what I wanted. Second the price was very reasonable. Third it had functions and capabilities that were suitable for my wife's skills and needs. She absolutely loves it and I actually got a compliment on my present giving. That don't happen very often let me tell you. I will recommend this she's pleased I'm pleased what else do you need?  My son was able to piggyback off of this gift, and purchased her the cover to go with it. So it really worked for my family. And I made my wife happy .",5.0
3277,"Fire HD 10 Tablet, 10.1 HD Display, Wi-Fi, 16 GB - Includes Special Offers, Silver Aluminum","I am reading positive reviews and wish I could say the same. Best Buy is great, so this is not a reflection on them, just our experience with the product. We have had this product for just over one month and I have had to contact Amazon Support, perform factory resets to get content to show up, and the device is poorly designed as the SD card pops out constantly, which messes with DRM, and does you no good if this happens when you are not connected to the Internet to fix it. We are returning, and spending the extra money for an iPad. Will not purchase another kindle device unfortunately just based on this experience. If you just use the device for reading, maybe this is for you, but trying to download information to SD card and actually being able to access it has been beyond frustrating, as well as having to do factory resets so content owned/ already purchased on Amazon would show up on the device in the library.",1.0
3278,"Fire HD 10 Tablet, 10.1 HD Display, Wi-Fi, 16 GB - Includes Special Offers, Silver Aluminum","An amazing electronic tool, so portable, great storage, books, great convenience.",5.0
3279,"Fire HD 10 Tablet, 10.1 HD Display, Wi-Fi, 16 GB - Includes Special Offers, Silver Aluminum",I bought this device for my wife. She has been using a Kindle Fire 7.I wanted something with a bigger screen for her.She likes it very much.,5.0
3280,"Fire HD 10 Tablet, 10.1 HD Display, Wi-Fi, 16 GB - Includes Special Offers, Silver Aluminum",I bought this Tablet for my Wife. She uses it every day. It is very usefulto her. She uses it in place of a computer. She watches movies on it.The Graphics are excellent.,5.0
3281,"Fire HD 10 Tablet, 10.1 HD Display, Wi-Fi, 16 GB - Includes Special Offers, Silver Aluminum","Love how user friendly the Kindle Fire is, for any age..",5.0
3282,"Fire HD 10 Tablet, 10.1 HD Display, Wi-Fi, 16 GB - Includes Special Offers, Silver Aluminum",This Kindle is alot larger and better for viewing.,5.0
3283,"Fire HD 10 Tablet, 10.1 HD Display, Wi-Fi, 16 GB - Includes Special Offers, Silver Aluminum","I find the picture quality amazing, the size over earlier model is welcome. Also, battery lasts many hours. For the price, it is a real bargain.",5.0
3284,"Fire HD 10 Tablet, 10.1 HD Display, Wi-Fi, 16 GB - Includes Special Offers, Silver Aluminum",Purchased this for my mother for her birthday. She loves it. The large screen is what she wanted most.,5.0
3285,"Fire HD 10 Tablet, 10.1 HD Display, Wi-Fi, 16 GB - Includes Special Offers, Silver Aluminum",My sister told me about the Kindle Fire and I wanted one so she said she bought hers from Best Buy.,5.0
3286,"Fire HD 10 Tablet, 10.1 HD Display, Wi-Fi, 16 GB - Includes Special Offers, Silver Aluminum",Sales guy didn't have much knowledge about the Kindle. He wasn't very helpful in getting me started.,5.0
3288,"Fire HD 10 Tablet, 10.1 HD Display, Wi-Fi, 16 GB - Includes Special Offers, Silver Aluminum",Want a port for addition memory this model had it!,5.0
3289,"Fire HD 10 Tablet, 10.1 HD Display, Wi-Fi, 16 GB - Includes Special Offers, Silver Aluminum","This kindle has made life easier by adding the micro sd card slot to enhance the memory capacity up to 128gb more than it has built in, makes it easy to switch cards so you can have your whole library on hand without slowing down the overall processing capability",5.0
3290,"Fire HD 10 Tablet, 10.1 HD Display, Wi-Fi, 16 GB - Includes Special Offers, Silver Aluminum",For books games and internet it's perfectSound is a ittle weak,3.0
3293,"Fire HD 10 Tablet, 10.1 HD Display, Wi-Fi, 16 GB - Includes Special Offers, Silver Aluminum","This was an upgrade from my Amazon 7 inch. Bigger screen was the key for me. It's great for listening to music, reading books, watching movies, tv sports, tv shows and playing all the games. Hours of relaxation and entertainment along with Amazon ' s new Alexa.",5.0
3294,"Fire HD 10 Tablet, 10.1 HD Display, Wi-Fi, 16 GB - Includes Special Offers, Silver Aluminum",Wish it had its own onternet connection but other than that great purchase,5.0
3295,"Fire HD 10 Tablet, 10.1 HD Display, Wi-Fi, 16 GB - Includes Special Offers, Silver Aluminum","I love it!! It can do it all!! Beautiful color graphics and in no time at all, I can watch a movie or play games or read my favorite novel. I love it!!",5.0
3296,"Fire HD 10 Tablet, 10.1 HD Display, Wi-Fi, 16 GB - Includes Special Offers, Silver Aluminum","I bought this for my daughter who wanted an iPad, but for about half the price she is completely happy with it - she even calls it her iPad. I think I may even buy one for myself to replace my aging iPad.",5.0
3297,"Fire HD 10 Tablet, 10.1 HD Display, Wi-Fi, 16 GB - Includes Special Offers, Silver Aluminum",I go this tablet after problems with 2 Samsung tablets. so far like it. all apps I use available. A little slower than previous tablets that is the only reason for the 4 stars,4.0
3298,"Fire HD 10 Tablet, 10.1 HD Display, Wi-Fi, 16 GB - Includes Special Offers, Silver Aluminum","very good product. Exactly what I wanted, and a very good price",5.0
3299,"Fire HD 10 Tablet, 10.1 HD Display, Wi-Fi, 16 GB - Includes Special Offers, Silver Aluminum",Nice tablet and very fast/capable. The storage options are way better than the previous models. I would highly recommend this tablet to anyone in the market for one.,5.0
3300,"Fire HD 10 Tablet, 10.1 HD Display, Wi-Fi, 16 GB - Includes Special Offers, Silver Aluminum",Easy to use wide variety of functions awesome price,5.0
3301,"Fire HD 10 Tablet, 10.1 HD Display, Wi-Fi, 16 GB - Includes Special Offers, Silver Aluminum",I bought this for my wife for Christmas and she loves it! You can't beat it for the price!,5.0
3302,"Fire HD 10 Tablet, 10.1 HD Display, Wi-Fi, 16 GB - Includes Special Offers, Silver Aluminum",Very nice. Easy to use. Got it to use with Amazon prime. Great combo.,5.0
3305,"Fire HD 10 Tablet, 10.1 HD Display, Wi-Fi, 16 GB - Includes Special Offers, Silver Aluminum","Works great for my grandson - had the Geek squad get a security plan setup on it and him acquainted with it. Battery life not great, but with a bright 10 inch screen on a THIN tablet is not surprising.",5.0
3309,"Fire HD 10 Tablet, 10.1 HD Display, Wi-Fi, 16 GB - Includes Special Offers, Silver Aluminum",I really like the auto on off feature. Volume control could be more ergonomic.,5.0
3310,"Fire HD 10 Tablet, 10.1 HD Display, Wi-Fi, 16 GB - Includes Special Offers, Silver Aluminum",This Fire 10 is so much better than my old Kindle Fire HD that I now wonder why I waited so long to upgrade. The 10' display is awesome and the speed is very good. All the Amazon apps from my old Kindle were immediately loaded onto my new one and adding the others through the Kindle app store was quick and easy.,4.0
3311,"Fire HD 10 Tablet, 10.1 HD Display, Wi-Fi, 16 GB - Includes Special Offers, Silver Aluminum","I wasn't offer the warranty, but I enjoy it a lot.",5.0
3312,"Fire HD 10 Tablet, 10.1 HD Display, Wi-Fi, 16 GB - Includes Special Offers, Silver Aluminum","We bought this because we thought it would be great for reading books and playing a few games. However, awkward size makes the device very weird to hold and generally not enjoyable. The Fire HD 8 shares the exact same specs and has a higher battery life. There's almost no reason to take this device over the 8.",3.0
3315,"Fire HD 10 Tablet, 10.1 HD Display, Wi-Fi, 16 GB - Includes Special Offers, Silver Aluminum","Second kindle I use it for reading,games,internet,and shopping",5.0
3316,"Fire HD 10 Tablet, 10.1 HD Display, Wi-Fi, 16 GB - Includes Special Offers, Silver Aluminum",Love Amazon however their tablet limits you to using their browser and their apps. Go online and you can get around them and download google and the playstore. Made my Fire into regular android tablet. Much happier now.,4.0
3317,"Fire HD 10 Tablet, 10.1 HD Display, Wi-Fi, 16 GB - Includes Special Offers, Silver Aluminum",My wife really enjoys the amazon fire. Has very good picture quality. Very easy to figure out how to use because its similar to our smart phone.,4.0
3319,"Fire HD 10 Tablet, 10.1 HD Display, Wi-Fi, 16 GB - Includes Special Offers, Silver Aluminum","I absolutely love my Kindle-Fire HD 10 16 GB. I can read it day OR night without light. And the picture quality is amazing! I haven't had any problems with it so far other than it's so thin, you need a case so you don't drop it. Very easy to add games, music, and books. I have even ordered items through Amazon without problems. I highly recommend this product.",5.0
3321,"Fire HD 10 Tablet, 10.1 HD Display, Wi-Fi, 16 GB - Includes Special Offers, Silver Aluminum","The Amazon Fire tablets are nice tablets. They're especially great for streaming tv and movies. And since it's a Kindle it's great for books too. It is a little odd with the Internet browser, and still a little limited in the app store. But overall a great little tablet.",5.0
3322,"Fire HD 10 Tablet, 10.1 HD Display, Wi-Fi, 16 GB - Includes Special Offers, Silver Aluminum","I got this for my mom to use as her ""computer"" and I am so happy with it. It's ease of use and ability to store pics for my mom is a big plus. Thanks !!!!",5.0
3323,"Fire HD 10 Tablet, 10.1 HD Display, Wi-Fi, 16 GB - Includes Special Offers, Silver Aluminum","Love how user friendly the Kindle Fire is, for any age..",5.0
3324,"Fire HD 10 Tablet, 10.1 HD Display, Wi-Fi, 16 GB - Includes Special Offers, Silver Aluminum",My husband is up in years & really enjoys spending time on his Kindle. He had a smaller one & it gave out on him so this one is ideal. He spends hours on it & has hours of fun!!!,5.0
3325,"Fire HD 10 Tablet, 10.1 HD Display, Wi-Fi, 16 GB - Includes Special Offers, Silver Aluminum",makes reading easier and more enjoyable in that I can see a whole page at one time. The protective cover that Best Buy sell was a disappointment in that it covered the On/Off switch and did not hold the tablet very well so that I had to find another cover from another source.,5.0
