Unnamed: 0,Product,Review_Summary,Rating
19161,"Fire HD 10 Tablet, 10.1 HD Display, Wi-Fi, 16 GB - Includes Special Offers, Silver Aluminum","I love the kindle, although do then to drop them. Always get the insurance and best buy makes it easy to replace them",4.0
19162,"Fire HD 10 Tablet, 10.1 HD Display, Wi-Fi, 16 GB - Includes Special Offers, Silver Aluminum",Got this for my dad as a gift. He loved it! Great alternative to an iPad,5.0
19163,"Fire HD 10 Tablet, 10.1 HD Display, Wi-Fi, 16 GB - Includes Special Offers, Silver Aluminum",I love my original Kindle Fire but the size and features on the latest Kindle are a plus,5.0
19164,"Fire HD 10 Tablet, 10.1 HD Display, Wi-Fi, 16 GB - Includes Special Offers, Silver Aluminum","Easy to setup, easy to use. I've had another tablet, but it wasn't as easy and comfortable to use. For what I bought it for, it's perfect for me. It weighs less than a pound (compared to my other tablet), and I can read what's on the screen easier. Without a manual, the best thing you can do is play with it. I'm still learning this and expect to get rolling on it very soon.",5.0
19165,"Fire HD 10 Tablet, 10.1 HD Display, Wi-Fi, 16 GB - Includes Special Offers, Silver Aluminum",Easy to use wide variety of functions awesome price,5.0
19166,"Fire HD 10 Tablet, 10.1 HD Display, Wi-Fi, 16 GB - Includes Special Offers, Silver Aluminum",I absolutely love my new kindle tablet!! I love the size and feel of it. It has auto blue shade. I can set it for what time I want it to dim.,5.0
19167,"Fire HD 10 Tablet, 10.1 HD Display, Wi-Fi, 16 GB - Includes Special Offers, Silver Aluminum","I can do everything I need on this tablet while traveling - check my email, browse the internet with the silk browser app, youtube, free app games etc. Because I have an amazon prime account as well, I linked my tablet to it so I can access a huge variety of free music, tv and movies. There are several offline options to load files onto the SD card, or to your tablets memory, so you can watch movies or use it as a mp3 player while away from internet. I watched a 2 hour movie on the airplane and only went through 30% of the battery power. Beautiful screen, loud speakers with the option for headphones. I have no reason to want anything more expensive, such as an ipad or surface since this does all I need while away from home.",5.0
19168,"Fire HD 10 Tablet, 10.1 HD Display, Wi-Fi, 16 GB - Includes Special Offers, Silver Aluminum","The Amazon fire HD10 is one of the best deals on the market. I've had a IPad and would rather have the HD10! It's what-1/3 of the price of a IPad and just as good, if not better",5.0
19169,"Fire HD 10 Tablet, 10.1 HD Display, Wi-Fi, 16 GB - Includes Special Offers, Silver Aluminum","This Kindle in the largest,thinnest yetfastestand most durable. We purchase the geek squad insurance with it kindly. Best decision ever.",5.0
19170,"Fire HD 10 Tablet, 10.1 HD Display, Wi-Fi, 16 GB - Includes Special Offers, Silver Aluminum","I think the kindle is the best value for the money, this is my third. Each model gets better than the last, I'm loving my 10.1. Comfortable to use does everything I need and beautiful video.",5.0
19171,"Fire HD 10 Tablet, 10.1 HD Display, Wi-Fi, 16 GB - Includes Special Offers, Silver Aluminum","This was an upgrade from my Amazon 7 inch. Bigger screen was the key for me. It's great for listening to music, reading books, watching movies, tv sports, tv shows and playing all the games. Hours of relaxation and entertainment along with Amazon ' s new Alexa.",5.0
19172,"Fire HD 10 Tablet, 10.1 HD Display, Wi-Fi, 16 GB - Includes Special Offers, Silver Aluminum","Gift for my wife, she loves it. Reads on it all the time.",5.0
19173,"Fire HD 10 Tablet, 10.1 HD Display, Wi-Fi, 16 GB - Includes Special Offers, Silver Aluminum","Love the capabilities it has to offer.Downside, it totally shuts off by itself and you have to start what you doing all over again",3.0
19174,"Fire HD 10 Tablet, 10.1 HD Display, Wi-Fi, 16 GB - Includes Special Offers, Silver Aluminum",Picture quality is very clear good size to take with me.I wished i would found a cover for this model at the store. Universal model does not work as to I have to take cover off to use camera,4.0
19175,"Fire HD 10 Tablet, 10.1 HD Display, Wi-Fi, 16 GB - Includes Special Offers, Silver Aluminum",Bought this tablet for my 84 year old grandpa and he loves it. Easy to use,5.0
19176,"Fire HD 10 Tablet, 10.1 HD Display, Wi-Fi, 16 GB - Includes Special Offers, Silver Aluminum","Love the tablet, not only for reading (upgrade from Kindle) but for searching the Internet, email, etc. And I can take it anywhere. Cheaper than an iPAD and does enough for what I need.",5.0
19177,"Fire HD 10 Tablet, 10.1 HD Display, Wi-Fi, 16 GB - Includes Special Offers, Silver Aluminum",This was a great purchase met needs of 93 old mom in law who needed a large read space for bad eyes,5.0
19178,"Fire HD 10 Tablet, 10.1 HD Display, Wi-Fi, 16 GB - Includes Special Offers, Silver Aluminum","I bought this for my daughter who wanted an iPad, but for about half the price she is completely happy with it - she even calls it her iPad. I think I may even buy one for myself to replace my aging iPad.",5.0
19179,"Fire HD 10 Tablet, 10.1 HD Display, Wi-Fi, 16 GB - Includes Special Offers, Silver Aluminum",Excellent tablet both for reading books and for going to the web,5.0
19180,"Fire HD 10 Tablet, 10.1 HD Display, Wi-Fi, 16 GB - Includes Special Offers, Silver Aluminum",I bought this Tablet for my Wife. She uses it every day. It is very usefulto her. She uses it in place of a computer. She watches movies on it.The Graphics are excellent.,5.0
19181,"Fire HD 10 Tablet, 10.1 HD Display, Wi-Fi, 16 GB - Includes Special Offers, Silver Aluminum","We bought this because we thought it would be great for reading books and playing a few games. However, awkward size makes the device very weird to hold and generally not enjoyable. The Fire HD 8 shares the exact same specs and has a higher battery life. There's almost no reason to take this device over the 8.",3.0
19182,"Fire HD 10 Tablet, 10.1 HD Display, Wi-Fi, 16 GB - Includes Special Offers, Silver Aluminum","I enjoyed the way the Fire 10 transfered all of my books, games and apps. It only took a little bit of time to go through the start up. The Fire starts up quick and I love the larger screen for reading my books. The colors are brilliant.",5.0
19183,"Fire HD 10 Tablet, 10.1 HD Display, Wi-Fi, 16 GB - Includes Special Offers, Silver Aluminum",Love the bigger screen but do think this Fire HD 10TH runs a little slow. My last Fire HD was not as slow.,4.0
19184,"Fire HD 10 Tablet, 10.1 HD Display, Wi-Fi, 16 GB - Includes Special Offers, Silver Aluminum",Nice size works fine needs to weigh a little less.,4.0
19185,"Fire HD 10 Tablet, 10.1 HD Display, Wi-Fi, 16 GB - Includes Special Offers, Silver Aluminum",Kindle products are easy to use and set up. It does most everything the expensive tablets do.,4.0
19186,"Fire HD 10 Tablet, 10.1 HD Display, Wi-Fi, 16 GB - Includes Special Offers, Silver Aluminum",Great table does everything that i need it for. Great resolution and screen for reading books,5.0
19187,"Fire HD 10 Tablet, 10.1 HD Display, Wi-Fi, 16 GB - Includes Special Offers, Silver Aluminum","I had a 7 inch kindle hd tablet. I wanted a larger screen so I purchased the 10 inch kindle. I am very happy with the device. I surf the web, play some games, read books, and process my email.",5.0
19188,"Fire HD 10 Tablet, 10.1 HD Display, Wi-Fi, 16 GB - Includes Special Offers, Silver Aluminum","I love the 2 cameras, and the video capabilities. I have set up the picture albums and can even share on Facebook and messenger. I like the side charger. Much better than front.I love the size too.",5.0
19189,"Fire HD 10 Tablet, 10.1 HD Display, Wi-Fi, 16 GB - Includes Special Offers, Silver Aluminum",Purchased as a gift and the owner loves the functionality and size of the tablet.,5.0
19190,"Fire HD 10 Tablet, 10.1 HD Display, Wi-Fi, 16 GB - Includes Special Offers, Silver Aluminum",Grandchild loves the tablet. Easy to set up and child and adult user griendly,4.0
19191,"Fire HD 10 Tablet, 10.1 HD Display, Wi-Fi, 16 GB - Includes Special Offers, Silver Aluminum",I did some research on different types of tablets and this one had what I needed,5.0
19192,"Fire HD 10 Tablet, 10.1 HD Display, Wi-Fi, 16 GB - Includes Special Offers, Silver Aluminum","The Kindle10 is OK, but a bit confusing to figure out. I do love the larger screen since I need to increase the text size. However, I did find a book that does explain the Kindle10 version on Amazon.",4.0
19193,"Fire HD 10 Tablet, 10.1 HD Display, Wi-Fi, 16 GB - Includes Special Offers, Silver Aluminum",This is a great tablet for the money. The only thing I would like to see is a longer battery life. Otherwise it's perfect,4.0
19194,"Fire HD 10 Tablet, 10.1 HD Display, Wi-Fi, 16 GB - Includes Special Offers, Silver Aluminum",Bought 3 for different and after 3 years mine went kerplot gona get new upgraded one for Christmas this year,5.0
19195,"Fire HD 10 Tablet, 10.1 HD Display, Wi-Fi, 16 GB - Includes Special Offers, Silver Aluminum",Large display makes it easy to use. Very easy to use.,5.0
19196,"Fire HD 10 Tablet, 10.1 HD Display, Wi-Fi, 16 GB - Includes Special Offers, Silver Aluminum",I love my new Kindle!! I would recommend this to everyone!! It has so many features and love the size!!,5.0
19197,"Fire HD 10 Tablet, 10.1 HD Display, Wi-Fi, 16 GB - Includes Special Offers, Silver Aluminum",Got for my 9 year old grandson. Durable & plenty fast for his games. No more squenting to see his phòne,5.0
19198,"Fire HD 10 Tablet, 10.1 HD Display, Wi-Fi, 16 GB - Includes Special Offers, Silver Aluminum","very happy. tablet or smart tv for bedroom. movies,news,games and web browsing. great picture and good sound. best product for price.",5.0
19199,"Fire HD 10 Tablet, 10.1 HD Display, Wi-Fi, 16 GB - Includes Special Offers, Silver Aluminum",Use for entertainment only. It works GREAT. Best option for those that don't want to spend so much for an I Pad.,5.0
19200,"Fire HD 10 Tablet, 10.1 HD Display, Wi-Fi, 16 GB - Includes Special Offers, Silver Aluminum",Although not the greatest tablets on the market when compared to Apple or Samsung products but when you weight in the price it is worth the purchase!,4.0
19201,"Fire HD 10 Tablet, 10.1 HD Display, Wi-Fi, 16 GB - Includes Special Offers, Silver Aluminum",Very happy with my purchase!! I bought this for my Mom and it was easy for her to navigate and she was able to easily download books and games.,5.0
19202,"Fire HD 10 Tablet, 10.1 HD Display, Wi-Fi, 16 GB - Includes Special Offers, Silver Aluminum",Love the larger screen and picture clarity. It is very easy to use.,5.0
19203,"Fire HD 10 Tablet, 10.1 HD Display, Wi-Fi, 16 GB - Includes Special Offers, Silver Aluminum","Great tablet, great resolution, very light and fast speed.",5.0
19204,"Fire HD 10 Tablet, 10.1 HD Display, Wi-Fi, 16 GB - Includes Special Offers, Silver Aluminum",Great Tablet.Performs very well so far.Pictures and graphics are of very good quality.,4.0
19205,"Fire HD 10 Tablet, 10.1 HD Display, Wi-Fi, 16 GB - Includes Special Offers, Silver Aluminum",My old tablet died..needed a new fast. This one was alot better than my old one. Clear screen videos look amazing..Sound is better than expected..It was in stock too. Overall very happy item and buying experience!,5.0
19206,"Fire HD 10 Tablet, 10.1 HD Display, Wi-Fi, 16 GB - Includes Special Offers, Silver Aluminum",This is a wonderful tablet. It's lite weight and super simple to use. I bought one for myself and thinking of getting one for my grandmother.,5.0
19207,"Fire HD 10 Tablet, 10.1 HD Display, Wi-Fi, 16 GB - Includes Special Offers, Silver Aluminum",This is my first kindle and I have been very pleased with it for what I payed for it.,5.0
19208,"Fire HD 10 Tablet, 10.1 HD Display, Wi-Fi, 16 GB - Includes Special Offers, Silver Aluminum","The tablet is fast, clear, and easy to use. Highly recommended!",5.0
19209,"Fire HD 10 Tablet, 10.1 HD Display, Wi-Fi, 16 GB - Includes Special Offers, Silver Aluminum","My first tablet. OUTSTANDING for NETFLIX, email, etc.",5.0
19210,"Fire HD 10 Tablet, 10.1 HD Display, Wi-Fi, 16 GB - Includes Special Offers, Silver Aluminum","very good product. Exactly what I wanted, and a very good price",5.0
19211,"Fire HD 10 Tablet, 10.1 HD Display, Wi-Fi, 16 GB - Includes Special Offers, Silver Aluminum",Great notepad! Huge screen and easily downloaded apps to use. Love it!,5.0
19212,"Fire HD 10 Tablet, 10.1 HD Display, Wi-Fi, 16 GB - Includes Special Offers, Silver Aluminum","I sometimes find the store a little intimidating, and certainly overwhelming. I don't always know what I want beforehand. My existing Surface failed in far to short a time frame, and since I really only used it to read I was able to replace its functions with a kindle fire, and I am actually much happier with it.",5.0
19213,"Fire HD 10 Tablet, 10.1 HD Display, Wi-Fi, 16 GB - Includes Special Offers, Silver Aluminum","This was an Xmas gift for my wife. She had wanted a pad of some sort but I just couldn't afford an Ipad so I looked at the Fire as an alternative. First the screen size was just what I wanted. Second the price was very reasonable. Third it had functions and capabilities that were suitable for my wife's skills and needs. She absolutely loves it and I actually got a compliment on my present giving. That don't happen very often let me tell you. I will recommend this she's pleased I'm pleased what else do you need?  My son was able to piggyback off of this gift, and purchased her the cover to go with it. So it really worked for my family. And I made my wife happy .",5.0
19214,"Fire HD 10 Tablet, 10.1 HD Display, Wi-Fi, 16 GB - Includes Special Offers, Silver Aluminum",The store representative took his time with me to choose the right size and the lady at the check out got me hooked up with Best Buy Program membership.,5.0
19215,"Fire HD 10 Tablet, 10.1 HD Display, Wi-Fi, 16 GB - Includes Special Offers, Silver Aluminum",I've had my kindle fire 7.0 for more than 3 years. it works great but I wanted a bigger screen. I love it.,5.0
19216,"Fire HD 10 Tablet, 10.1 HD Display, Wi-Fi, 16 GB - Includes Special Offers, Silver Aluminum","I had the smaller version of this & was looking to get rid of it & my google nexus. This is just what I wanted, it uses my Amazon prime account & takes a memory card so I can load it with all my videos I watch while at the gym.",5.0
19217,"Fire HD 10 Tablet, 10.1 HD Display, Wi-Fi, 16 GB - Includes Special Offers, Silver Aluminum","I LOVE MY KINDLE! I surf the web, take pictures and play games on it. I use it everyday.",5.0
19218,"Fire HD 10 Tablet, 10.1 HD Display, Wi-Fi, 16 GB - Includes Special Offers, Silver Aluminum","I love the new Kindle fire 10"" HD. I love the large screen to watch movies on.",5.0
19219,"Fire HD 10 Tablet, 10.1 HD Display, Wi-Fi, 16 GB - Includes Special Offers, Silver Aluminum","I do not find this as easy to use as my original Kindle Fire but I do like the camera a lot better, though it is not clear megapixels",3.0
19220,"Fire HD 10 Tablet, 10.1 HD Display, Wi-Fi, 16 GB - Includes Special Offers, Silver Aluminum",I bought this device for my wife. She has been using a Kindle Fire 7.I wanted something with a bigger screen for her.She likes it very much.,5.0
19221,"Fire HD 10 Tablet, 10.1 HD Display, Wi-Fi, 16 GB - Includes Special Offers, Silver Aluminum","I love this Kindle 10, it is large enough to see very easily and very easy to handle when traveling. I love the size of it.",5.0
19222,"Fire HD 10 Tablet, 10.1 HD Display, Wi-Fi, 16 GB - Includes Special Offers, Silver Aluminum","I bought this tablet for my wife. She likes the size for reading books and for reading info on the web. The tablet's size is a little big for just holding it and for carrying it around. It also has to be charged often, and that's not even considering time reading books. Hard to find a case for this latest kindle.",4.0
19223,"Fire HD 10 Tablet, 10.1 HD Display, Wi-Fi, 16 GB - Includes Special Offers, Silver Aluminum",Love this product works great so far i would recommend this to others,5.0
19224,"Fire HD 10 Tablet, 10.1 HD Display, Wi-Fi, 16 GB - Includes Special Offers, Silver Aluminum",use it everyday. enjoy reading using the Kindle Fire HD 10.,5.0
19225,"Fire HD 10 Tablet, 10.1 HD Display, Wi-Fi, 16 GB - Includes Special Offers, Silver Aluminum",I love this device! Perfect size for my bad eyesight! Lol! I use it all the time! One down side is the .battery life is not great!,4.0
19226,"Fire HD 10 Tablet, 10.1 HD Display, Wi-Fi, 16 GB - Includes Special Offers, Silver Aluminum","Bought this tablet a month or so ago and waited to see see how I'd like it. My husband has owned a Zoom and I've owned 2-8 inch Samsungs...this by far is my favorite. (we bought one for him the same time and he loves his too). I use it for email, games, social media, internet and some accounting. I love it. It's fast, reliable, easy to use, easy to see. It seems durable but for extra protection, I bought a shock case with a flip stand on the back so it can be protected and more versatile. My only wish would be that its battery lasted longer for my constant use...but I suppose everyone needs a break every few (2-4) hours. It does charge back up pretty fast.I think its a great tablet!",5.0
19227,"Fire HD 10 Tablet, 10.1 HD Display, Wi-Fi, 16 GB - Includes Special Offers, Silver Aluminum","had a problem with my purchase, but Best Buy made it good, they are very good!",4.0
19228,"Fire HD 10 Tablet, 10.1 HD Display, Wi-Fi, 16 GB - Includes Special Offers, Silver Aluminum","Love how user friendly the Kindle Fire is, for any age..",5.0
19229,"Fire HD 10 Tablet, 10.1 HD Display, Wi-Fi, 16 GB - Includes Special Offers, Silver Aluminum","I absolutely love my Kindle-Fire HD 10 16 GB. I can read it day OR night without light. And the picture quality is amazing! I haven't had any problems with it so far other than it's so thin, you need a case so you don't drop it. Very easy to add games, music, and books. I have even ordered items through Amazon without problems. I highly recommend this product.",5.0
19230,"Fire HD 10 Tablet, 10.1 HD Display, Wi-Fi, 16 GB - Includes Special Offers, Silver Aluminum","Upgraded from a 7"" to 10"" Kindle Fire and it is so worth it. Great picture. Good storage. Love my Kindle.",5.0
19231,"Fire HD 10 Tablet, 10.1 HD Display, Wi-Fi, 16 GB - Includes Special Offers, Silver Aluminum","I love the kindle. I'm not completely happy with the sound quality of the speaker's. And, a month later it already seems to be lagging and freezing a bit. I have one music app, several books, and a few games on it. I don't seem to be using it as much as my 7 during long trips just because of the size.",4.0
19232,"Fire HD 10 Tablet, 10.1 HD Display, Wi-Fi, 16 GB - Includes Special Offers, Silver Aluminum",I absolutely love my new Kindle. The size is perfect. My kids and I can't put it down!,5.0
19233,"Fire HD 10 Tablet, 10.1 HD Display, Wi-Fi, 16 GB - Includes Special Offers, Silver Aluminum",Great tablet! New to me so I have a lot to learn about it's functions.,5.0
19234,"Fire HD 10 Tablet, 10.1 HD Display, Wi-Fi, 16 GB - Includes Special Offers, Silver Aluminum","I JUST luv my Fire HD Tablet,love playing my games on it,so easy to carry around",5.0
19235,"Fire HD 10 Tablet, 10.1 HD Display, Wi-Fi, 16 GB - Includes Special Offers, Silver Aluminum",This is my 3rd Kindle. I have continued to move up on the screen size and this one is so easy to see and read. I do however sometimes have a problem with it when I am online. It can take forever to load up a site and move from page to page so that can be annoying. I have extremely fast internet so that is not the problem and when I check strength of wifi connection it always says excellent so not sure why it takes so long. Do not have that problem on my other 2.,3.0
19236,"Fire HD 10 Tablet, 10.1 HD Display, Wi-Fi, 16 GB - Includes Special Offers, Silver Aluminum","Got this Kindle Fire to replace a laptop that died. So far I have been very pleased. Finding new things that it can do. Not happy with the camera, but I might not know all the details about it yet.",3.0
19237,"Fire HD 10 Tablet, 10.1 HD Display, Wi-Fi, 16 GB - Includes Special Offers, Silver Aluminum",My husband is up in years & really enjoys spending time on his Kindle. He had a smaller one & it gave out on him so this one is ideal. He spends hours on it & has hours of fun!!!,5.0
19238,"Fire HD 10 Tablet, 10.1 HD Display, Wi-Fi, 16 GB - Includes Special Offers, Silver Aluminum",This is a great tablet. If you are upgrading like I did all your games can be moved over.,5.0
19239,"Fire HD 10 Tablet, 10.1 HD Display, Wi-Fi, 16 GB - Includes Special Offers, Silver Aluminum",the first one I got was very slow. I turned it in today and this one works great,3.0
19240,"Fire HD 10 Tablet, 10.1 HD Display, Wi-Fi, 16 GB - Includes Special Offers, Silver Aluminum",I don't care for having to close each window separately I would prefer to be able to select close all or exit all,3.0
19241,"Fire HD 10 Tablet, 10.1 HD Display, Wi-Fi, 16 GB - Includes Special Offers, Silver Aluminum","I love it!! It can do it all!! Beautiful color graphics and in no time at all, I can watch a movie or play games or read my favorite novel. I love it!!",5.0
19242,"Fire HD 10 Tablet, 10.1 HD Display, Wi-Fi, 16 GB - Includes Special Offers, Silver Aluminum",Nice phone for the price. Would recommend if on a budget.,4.0
19243,"Fire HD 10 Tablet, 10.1 HD Display, Wi-Fi, 16 GB - Includes Special Offers, Silver Aluminum",I would recommend this tablet because of the value,5.0
19244,"Fire HD 10 Tablet, 10.1 HD Display, Wi-Fi, 16 GB - Includes Special Offers, Silver Aluminum",Purchased this for my mother for her birthday. She loves it. The large screen is what she wanted most.,5.0
19245,"Fire HD 10 Tablet, 10.1 HD Display, Wi-Fi, 16 GB - Includes Special Offers, Silver Aluminum","I love the kindle and have had one in one shape or another since they first came out, but I just could not take how slow this model was. I returned it and purchased a Samsung tablet.",2.0
19246,"Fire HD 10 Tablet, 10.1 HD Display, Wi-Fi, 16 GB - Includes Special Offers, Silver Aluminum",Biggest and best Kindle yet. Light as a feather. Buy one today.,5.0
19247,"Fire HD 10 Tablet, 10.1 HD Display, Wi-Fi, 16 GB - Includes Special Offers, Silver Aluminum","I bought this for a family member because they had the smaller 7"" Amazon Fire. The 10"" version can be held easier in my opinion",5.0
19248,"Fire HD 10 Tablet, 10.1 HD Display, Wi-Fi, 16 GB - Includes Special Offers, Silver Aluminum","Can't live without this, use for email, banking, social media, reading, watching movies, tv shows, online college courses. Even prints to wireless printer.",5.0
19249,"Fire HD 10 Tablet, 10.1 HD Display, Wi-Fi, 16 GB - Includes Special Offers, Silver Aluminum",Very good but does not take all aps unless it is related to Amazon. I could not get all the aps I wanted. Good tablet for reading.,4.0
19250,"Fire HD 10 Tablet, 10.1 HD Display, Wi-Fi, 16 GB - Includes Special Offers, Silver Aluminum","The Fire 10 will do anything that the I Pad will do, and is at a much more attractive price.",5.0
19251,"Fire HD 10 Tablet, 10.1 HD Display, Wi-Fi, 16 GB - Includes Special Offers, Silver Aluminum",Very nice. Easy to use. Got it to use with Amazon prime. Great combo.,5.0
19252,"Fire HD 10 Tablet, 10.1 HD Display, Wi-Fi, 16 GB - Includes Special Offers, Silver Aluminum","you might find it somewhat short on available apps. My wife has an Android (Samsung) that is quite deep in app selection. That is not to say you can't find suitable choices. Every machine has it's qwerks and the Kindle starts up when you plug it in to charge. Unnecessary. Overall the 10"" is great viewing, especially for the older eyes.",4.0
19253,"Fire HD 10 Tablet, 10.1 HD Display, Wi-Fi, 16 GB - Includes Special Offers, Silver Aluminum","Great size, easy to use and it has a sleek look that is attractive.",5.0
19254,"Fire HD 10 Tablet, 10.1 HD Display, Wi-Fi, 16 GB - Includes Special Offers, Silver Aluminum",Wish it had its own onternet connection but other than that great purchase,5.0
19255,"Fire HD 10 Tablet, 10.1 HD Display, Wi-Fi, 16 GB - Includes Special Offers, Silver Aluminum",This is what I have been waiting for. This HD10 Kindle is Super!,5.0
19256,"Fire HD 10 Tablet, 10.1 HD Display, Wi-Fi, 16 GB - Includes Special Offers, Silver Aluminum","Over the past few years, I have purchased Kindle Fires for various family members. The workmanship for those Kindles in abysmal. Two weeks ago, my Kindle Fire HDX shorted itself out. I replaced it with Amazon Fire 10.1. This device does NOT hold a charge for more than three and a half hours. You read that correctly!. I have been using it on a daily basis, each time it needs to be charged, it does a repeat performance. There is absolutely NO way that I will ever purchase any device manufactured by Amazon, ever again. I tell it like it is, if you want terrible device performance, opt for the Amazon product. If you need a reliable device, look at other manufacturers for the options you need.",1.0
