Unnamed: 0,Product,Review_Summary,Rating
3326,"Fire HD 10 Tablet, 10.1 HD Display, Wi-Fi, 16 GB - Includes Special Offers, Silver Aluminum",I love this device! Perfect size for my bad eyesight! Lol! I use it all the time! One down side is the .battery life is not great!,4.0
3327,"Fire HD 10 Tablet, 10.1 HD Display, Wi-Fi, 16 GB - Includes Special Offers, Silver Aluminum","The Amazon tablet series has come along way since it first came out. The screen on the Fire HD 10 is stunning. Clear and easy to read. If used to android apps though, may be disappointed that some of your favorite apps will not be available on this tablet.",4.0
3328,"Fire HD 10 Tablet, 10.1 HD Display, Wi-Fi, 16 GB - Includes Special Offers, Silver Aluminum","Love my new kindle, thought the screen would be too large but after using it a few days, all is good. Very thin , got a case for it, I now feel at home with it. Do not like the ""new"" lock screen lock to open the tablet at all, its tiny and hard to ""unlock"" most always taking several times to swipe it just right.",4.0
3330,"Fire HD 10 Tablet, 10.1 HD Display, Wi-Fi, 16 GB - Includes Special Offers, Silver Aluminum",Great tablet! New to me so I have a lot to learn about it's functions.,5.0
3332,"Fire HD 10 Tablet, 10.1 HD Display, Wi-Fi, 16 GB - Includes Special Offers, Silver Aluminum",Employees were very helpful. I always enjoy shopping at Best Buy.,4.0
3333,"Fire HD 10 Tablet, 10.1 HD Display, Wi-Fi, 16 GB - Includes Special Offers, Silver Aluminum",Even though the ppi is lower than the other tablets I didn't really notice it. I like the letterbox format which allows the use of more of the screen area when viewing movies and TV.,5.0
3334,"Fire HD 10 Tablet, 10.1 HD Display, Wi-Fi, 16 GB - Includes Special Offers, Silver Aluminum",Purchased this for my mother for her birthday. She loves it. The large screen is what she wanted most.,5.0
3335,"Fire HD 10 Tablet, 10.1 HD Display, Wi-Fi, 16 GB - Includes Special Offers, Silver Aluminum",I would be happy to give it as Christmas gifts to many of the people I know. I love the size of the screen. A charge last and the Bluetooth sinks well with the wireless keyboard. It's almost as good as I IPad.,5.0
3336,"Fire HD 10 Tablet, 10.1 HD Display, Wi-Fi, 16 GB - Includes Special Offers, Silver Aluminum","Great size, easy to use and it has a sleek look that is attractive.",5.0
3337,"Fire HD 10 Tablet, 10.1 HD Display, Wi-Fi, 16 GB - Includes Special Offers, Silver Aluminum",The display is so much better than my previous Kindle Fire and have found more uses for it. It's nice to pull up my Comcast app and watch shows while working out on the treadmill. It was a pleasant surprise to find that Alexa was loaded as well!,5.0
3338,"Fire HD 10 Tablet, 10.1 HD Display, Wi-Fi, 16 GB - Includes Special Offers, Silver Aluminum","Can't live without this, use for email, banking, social media, reading, watching movies, tv shows, online college courses. Even prints to wireless printer.",5.0
3339,"Fire HD 10 Tablet, 10.1 HD Display, Wi-Fi, 16 GB - Includes Special Offers, Silver Aluminum",Very nice people and good product. I would buy from again.,5.0
3340,"Fire HD 10 Tablet, 10.1 HD Display, Wi-Fi, 16 GB - Includes Special Offers, Silver Aluminum",Easy to set up. Good size tablet. Like the addition of Alexa,5.0
